### ISSUE TITLE
NAT Reflection problem

### ISSUE THREAD

**Issue by githubatf2f10** [opnsense/core#2043]
please refer details in the bottom of this existing one.

**Comment by githubatf2f10** [comment]
https://github.com/opnsense/core/issues/1417
https://forum.opnsense.org/index.php?topic=6696.0
https://discourse.mailinabox.email/t/letsencrypt-expired-and-dns-errors/2704

**Comment by AdSchellevis** [comment]
@githubatf2f10 chances are not very high that this will lead to a fix for your issue, I'm not against opening an issue... But look at it from the other side, the number of text people may have to gather from all the postings you made are quite huge, which makes it very hard to figure out what you experience as your issue. 

Try to keep your issue brief and step by step.

**Comment by githubatf2f10** [comment]
my set up is like this..

Internet ---WAN(pppoe)--opnsense--several internal netowrks (one of them is DMZ).
On DMZ, I have this email Server (MAIB).

There will be traffic leaving MAIB to it's own public IP(which is WAN ip) as this Mail server need to be accessed from outside. This requires NAT Reflection to help it to work,as in OpenWRT router's NAT Loopback. OpnSense has this NAT Reflection and it has in its rule set. However, the packet still leaked outward through PPPoE without an opportunity of Reflecting back out with DMZ interface ip. The DNAT part seemed being done, but SNAT part is not happening. That 's why we see packet with WANIP to DNAT private Mail server ip is shipped out to Internet ...

**Comment by githubatf2f10** [comment]
configured options here.
Network Address Translation
Reflection for port forwards Enable (pure nat)
Reflection for 1:1 Enable
Automatic outbound NAT for Reflection Enable

NAT->Port Foward :
NAT reflection use system default
Filter rule association Rule NAT

Firewall: NAT: Outbound Mode
Tried both Manual and Hybrid....

**Comment by githubatf2f10** [comment]
These two are critical in doing reflection nat....
@torwrt# iptables-save | grep NAT
-A zone_dmz_prerouting -s 192.168.140.0/24 -d 76.10.176.225/32 -p tcp -m tcp --dport 53 -m comment --comment "dns (reflection)" -j DNAT --to-destination 192.168.140.253:53
-A zone_dmz_prerouting -s 192.168.140.0/24 -d 76.10.176.225/32 -p udp -m udp --dport 53 -m comment --comment "dns (reflection)" -j DNAT --to-destination 192.168.140.253:53

-A zone_dmz_postrouting -s 192.168.140.0/24 -d 192.168.140.253/32 -p tcp -m tcp --dport 53 -m comment --comment "dns (reflection)" -j SNAT --to-source 192.168.140.1
-A zone_dmz_postrouting -s 192.168.140.0/24 -d 192.168.140.253/32 -p udp -m udp --dport 53 -m comment --comment "dns (reflection)" -j SNAT --to-source 192.168.140.1

On openSense, we are missing this, like that on openWRT ?????

-A zone_dmz_prerouting -s 192.168.140.0/24 -d 76.10.176.225/32 -p udp -m udp --dport 53 -m comment --comment "dns (reflection)" -j DNAT --to-destination 192.168.140.253:53

@trumpwall:~ # pfctl -sn
no nat on em0_vlan140 inet proto tcp from 192.168.140.1 to 192.168.140.253 port = domain
no nat on em0_vlan140 inet proto udp from 192.168.140.1 to 192.168.140.253 port = domain
nat on em0_vlan140 inet proto tcp from 192.168.140.0/24 to 192.168.140.253 port = domain -> 192.168.140.1 port 1024:65535
nat on em0_vlan140 inet proto udp from 192.168.140.0/24 to 192.168.140.253 port = domain -> 192.168.140.1 port 1024:65535

**Comment by githubatf2f10** [comment]
I have updated with new info on the other links.. anyway, I will post some briefly here. That screen capture is on the other link as well...

On openSense, we are missing this, like that on openWRT ?????

-A zone_dmz_prerouting -s 192.168.140.0/24 -d 76.10.176.225/32 -p udp -m udp --dport 53 -m comment --comment "dns (reflection)" -j DNAT --to-destination 192.168.140.253:53

@trumpwall:~ # pfctl -sn
no nat on em0_vlan140 inet proto tcp from 192.168.140.1 to 192.168.140.253 port = domain
no nat on em0_vlan140 inet proto udp from 192.168.140.1 to 192.168.140.253 port = domain
nat on em0_vlan140 inet proto tcp from 192.168.140.0/24 to 192.168.140.253 port = domain -> 192.168.140.1 port 1024:65535
nat on em0_vlan140 inet proto udp from 192.168.140.0/24 to 192.168.140.253 port = domain -> 192.168.140.1 port 1024:65535

It looks like it has this Pre-routing on OpenSense as well...???!!! Then, this didnt' catch or function???

rdr on pppoe0 inet proto tcp from any to (pppoe0) port = domain -> 192.168.140.253
rdr on pppoe0 inet proto udp from any to (pppoe0) port = domain -> 192.168.140.253
rdr on em0_vlan140 inet proto tcp from any to (pppoe0) port = domain -> 192.168.140.253
rdr on em0_vlan140 inet proto udp from any to (pppoe0) port = domain -> 192.168.140.253

**Comment by githubatf2f10** [comment]
I did a capture of what I have with opnsense as well. It looks like it has its Nat Reflection setting in the finalized rule set as well... Just don't understand why it didn't function like OpenWRT did. It seemed not being able to capture that packet and modify DNAT+SNAT and send that packet back; instead, it send out to PPPoE with DNAT only and that ships packet out to be discarded by ISP...

Here's what I see on PPPoE tcpdump on opnSense. SNAT is not done and the packet is out to WAN....

@trumpwall:~ # tcpdump -ni pppoe0 port 53

07:39:13.173835 IP 76.10.176.225.56965> 192.168.140.253.53: Flags [S], seq 333284484, win 29200, options [mss 1460,sackOK,TS val 1144622951 ecr 0,nop,wscale 7], length 0

on opnWRT, you don't see this traffic leaking out to WAN, as it's been properly reflected back on DMZ already..
@torwrt:# tcpdump -ni pppoe-wan port 53
07:07:17.556020 IP 76.10.176.225.27726 > 192.203.230.10.53: 40886% [1au] NS? . (28)
07:07:17.556147 IP 76.10.176.225.53311 > 192.203.230.10.53: 20231% [1au] A? aspmx.l.google.com. (47)
07:07:17.556244 IP 76.10.176.225.10260 > 192.203.230.10.53: 57585% [1au] AAAA? aspmx.l.google.com. (47)

**Comment by githubatf2f10** [comment]
here's an output of the rules, rdr seems working as it stated here... the post NAT part might not fuction as it should.../??? It looks like that OpnSense did DNAT and shipped packet directly to WAN, without redirecting packet back on DMZ with that 192.168.140.253.Therefore, Post NAT rule on DMZ (NAT Reflect) did not do SNAT to change it's source ip to DMZ ip......??? Is this a possible reason?

root@trumpwall:~ # grep rdr /tmp/rules.debug
no rdr proto carp
no rdr on em0_vlan110 proto tcp from any to ( em0_vlan110 ) port { 443 80 22 }
rdr on pppoe0 inet proto tcp from any to (pppoe0) port 80 -> 192.168.140.253
rdr on { em0_vlan120 em0_vlan140 em0_vlan130 em0_vlan110 openvpn } inet proto tcp from any to (pppoe0) port 80 -> 192.168.140.253
rdr on pppoe0 inet proto tcp from any to (pppoe0) port 25 -> 192.168.140.253
rdr on { em0_vlan120 em0_vlan140 em0_vlan130 em0_vlan110 openvpn } inet proto tcp from any to (pppoe0) port 25 -> 192.168.140.253
rdr on pppoe0 inet proto tcp from any to (pppoe0) port 443 -> 192.168.140.253
rdr on { em0_vlan120 em0_vlan140 em0_vlan130 em0_vlan110 openvpn } inet proto tcp from any to (pppoe0) port 443 -> 192.168.140.253

rdr on pppoe0 inet proto { tcp udp } from any to (pppoe0) port 53 -> 192.168.140.253
rdr on { em0_vlan120 em0_vlan140 em0_vlan130 em0_vlan110 openvpn } inet proto { tcp udp } from any to (pppoe0) port 53 -> 192.168.140.253
rdr on pppoe0 inet proto tcp from any to (pppoe0) port 993 -> 192.168.140.253
rdr on { em0_vlan120 em0_vlan140 em0_vlan130 em0_vlan110 openvpn } inet proto tcp from any to (pppoe0) port 993 -> 192.168.140.253
rdr on pppoe0 inet proto tcp from any to (pppoe0) port 587 -> 192.168.140.253
rdr on { em0_vlan120 em0_vlan140 em0_vlan130 em0_vlan110 openvpn } inet proto tcp from any to (pppoe0) port 587 -> 192.168.140.253

**Comment by githubatf2f10** [comment]
Here's my configuration screen captures.... It seems to me that Packet is DNATed from WAN IP to my intended Private IP;

    rdr on pppoe0 inet proto { tcp udp } from any to (pppoe0) port 53 -> 192.168.140.253
    rdr on { em0_vlan120 em0_vlan140 em0_vlan130 em0_vlan110 openvpn } inet proto { tcp udp } from any to (pppoe0) port 53 -> 192.168.140.253

At this moment, the packet 192.168.140.253--->192.168.140.253:53, for example, should follow Routing Table to be sent back to DMZ zone with 192.168.140.1 as DMZ interface....to be processed by SNAT into a packet like, 192.168.140.1-->192.168.140.253....

However, it is still sent out through WAN, with public ip as source, not being redirected back through DMZ to my Private IP.

@trumpwall:~ # tcpdump -ni pppoe0 port 53

    07:39:13.173835 IP 76.10.176.225.56965> 192.168.140.253.53: Flags [S], seq 333284484, win 29200, options [mss 1460,sackOK,TS val 1144622951 ecr 0,nop,wscale 7], length 0
    07:39:13.173835 IP 76.10.176.225.56965> 192.168.140.253.53: Flags [S], seq 333284484, win 29200, options [mss 1460,sackOK,TS val 1144622951 ecr 0,nop,wscale 7], length 0

Hence, the SNAT has never been applied, although I can see in the rule set, we have correct NAT Reflection rules and correct RDR rules...

    @trumpwall:~ # pfctl -sn
    no nat on em0_vlan140 inet proto tcp from 192.168.140.1 to 192.168.140.253 port = domain
    no nat on em0_vlan140 inet proto udp from 192.168.140.1 to 192.168.140.253 port = domain
    nat on em0_vlan140 inet proto tcp from 192.168.140.0/24 to 192.168.140.253 port = domain -> 192.168.140.1 port 1024:65535
    nat on em0_vlan140 inet proto udp from 192.168.140.0/24 to 192.168.140.253 port = domain -> 192.168.140.1 port 1024:65535

**Comment by githubatf2f10** [comment]
Do we have a way of seeing how that packet is processed at each stage of it coming to OpnSense and leaving OpnSense, including routing decisions? I used tcpdump for interface capture to find out these issues, however, it's not clear still how each decision was made in opsense.

For example, I would like to see...

    Packet with src.ip->dst.ip coming to DMZ, now being processed by either SNAT rules or other rules,
    Packet resides in OpnSense, now being processed by NAT Reflection rules, and/or routing rules
    Packet leaves OpnSense at interface, now being processed by DNAT rules.
    if being dropped,denied,then by which rules/reason...etc.

That way, I can clearly see which rules/setting is doing what to that packet at each stage of its life traversing OpnSense. That will help us to clearly find out exact which step is the root of problem.

thanks in advance.

**Comment by githubatf2f10** [comment]
![screenshot_20171226_081252](https://user-images.githubusercontent.com/34818203/34500030-f5dc254e-efd6-11e7-82fb-f1c72babad2c.png)
![screenshot_20171226_081337](https://user-images.githubusercontent.com/34818203/34500031-f5f09844-efd6-11e7-8884-22d21fae9dd0.png)
![screenshot_20171226_081425](https://user-images.githubusercontent.com/34818203/34500032-f5ff3e76-efd6-11e7-952e-f98d727bb5d5.png)
![screenshot_20171226_081453](https://user-images.githubusercontent.com/34818203/34500033-f612467e-efd6-11e7-8c2b-3f65ab3e9a0c.png)
![screenshot_20171226_081522](https://user-images.githubusercontent.com/34818203/34500034-f62ccb70-efd6-11e7-8b11-bfeefb1c6202.png)
![screenshot_20171226_081549](https://user-images.githubusercontent.com/34818203/34500035-f644213a-efd6-11e7-8df6-dd6ccdceea8b.png)
![screenshot_20171226_081603](https://user-images.githubusercontent.com/34818203/34500036-f663fb72-efd6-11e7-8dfd-ec3bdae8ea0c.png)

**Comment by githubatf2f10** [comment]
btw, why do we see so many "rule set" in this GUI?
![screenshot_20171224_102433](https://user-images.githubusercontent.com/34818203/34500065-17051f28-efd7-11e7-9998-c5a715237fc1.png)

**Comment by StrikerTwo** [comment]
Because you have no description in your NAT rules. If you had one, it would be added to the corresponding firewall rule as well.

**Comment by githubatf2f10** [comment]
@StrikerTwo Thanks a lot for this!!!

**Comment by StrikerTwo** [comment]
No problem. I only know this because I had lots of "Rule NAT" entries myself ;)

**Comment by githubatf2f10** [comment]
do you happen to know how to solve this NAT Reflection issue? thanks @StrikerTwo 
It's a bit confused by the packet being processed... I may have to revert back to pfSense later. I know one guy with similar setup with me and he uses pfSense fine with this...

**Comment by StrikerTwo** [comment]
Nope, sorry. 
The only things I can think of (after digging through your wall of posts) is 
* running UBound DNS on the opnsense box and let it forward the requests to your MIAB box (instead of NAT)

OR
* installing pfsense in a VM and comparing the pf rules it creates in your scenario to the OPNsense rules. If it works with pfsense and doesn't with opnsense there has to be a difference somewhere.

**Comment by githubatf2f10** [comment]
thanks @StrikerTwo

**Comment by githubatf2f10** [comment]
@fichtner 

I know that you guys may have other priorities; however, if some one can give a hand on this, it would be much appreciated..

It seems to me that somewhere along the path, the packet is not routed back based on DNATTEd internal IP.. I just don't know how to get traces of the packet being treated by which rule and routing...

thanks

**Comment by githubatf2f10** [comment]
Hi Guys,

How can get some more help on this? I need to present a solution to customer next week...

We need to decide either using pfSense or opnSense or something else. This issue is a show stopper for the deployment.

Thanks

**Comment by githubatf2f10** [comment]
As far as I understand, that DNAT is supposed to happen first at DMZ interface and then followed by Routing, then followed by SNAT at egress interface (DMZ in this case)..
My observation seems that Routing decision being made first (based on dst.ip=my WAP ip), then or at same time, DNAT rule on DMZ is applied. So the packet is routed to WAN interface and dst.ip=my internal server ip. Thus caused packet leaked out WAN interface.

If it works correctly, it should get DNATed first with dst.ip=my private server ip, then Routing route that packet out DMZ again, applying SNAT at this moment.

Can one can help out?

Thanks in advance.

**Comment by githubatf2f10** [comment]
root@trumpwall:~ # netstat -4rnW
Routing tables

Internet:
Destination        Gateway            Flags       Use    Mtu      Netif Expire
default            206.248.155.241    UGS          35   1492     pppoe0

0.0.0.0/1          10.10.216.37       UGS       58026   1500     ovpnc1
128.0.0.0/1        10.10.216.37       UGS       46373   1500     ovpnc1

206.248.155.241    link#12            UH            0   1492     pppoe0
162.219.178.67/32  206.248.155.241    UGS     8139743   1492     pppoe0

10.10.216.1/32     10.10.216.37       UGS           0   1500     ovpnc1
10.10.216.37       link#6             UH            0   1500     ovpnc1
10.10.216.38       link#6             UHS           0  16384        lo0

76.10.176.225      link#12            UHS           0  16384        lo0

127.0.0.1          link#3             UH       150782  16384        lo0

192.168.140.0/24   link#10            U       2954248   1500 em0_vlan140
192.168.140.1      link#10            UHS           0  16384        lo0

root@trumpwall:~ # ifconfig
em0: flags=8843<UP,BROADCAST,RUNNING,SIMPLEX,MULTICAST> metric 0 mtu 1500
        options=50098<VLAN_MTU,VLAN_HWTAGGING,VLAN_HWCSUM,VLAN_HWFILTER,VLAN_HWTSO>
enc0: flags=0<> metric 0 mtu 1536
        nd6 options=21<PERFORMNUD,AUTO_LINKLOCAL>
        groups: enc 
lo0: flags=8049<UP,LOOPBACK,RUNNING,MULTICAST> metric 0 mtu 16384
        inet 127.0.0.1 netmask 0xff000000 

ovpnc1: flags=8051<UP,POINTOPOINT,RUNNING,MULTICAST> metric 0 mtu 1500
        inet 10.10.216.38 --> 10.10.216.37  netmask 0xffffffff 

em0_vlan140: flags=8843<UP,BROADCAST,RUNNING,SIMPLEX,MULTICAST> metric 0 mtu 1500
        inet 192.168.140.1 netmask 0xffffff00 broadcast 192.168.140.255 

pppoe0: flags=88d1<UP,POINTOPOINT,RUNNING,NOARP,SIMPLEX,MULTICAST> metric 0 mtu 1492
        inet 76.10.176.225 --> 206.248.155.241  netmask 0xffffffff

**Comment by githubatf2f10** [comment]
on 18.1.1. This issues are still not resolved!!!!!!!!!!!!!!!!!!!!!

**Comment by githubatf2f10** [comment]
On pfSense, it works fine...!!!

Here's "rdr" related part and I don't see much difference.....

[2.4.2-RELEASE][admin@trumpwall.f2f10.com]/root: grep rdr /tmp/rules.debug
no rdr proto carp
rdr-anchor "relayd/*"
rdr-anchor "tftp-proxy/*"
rdr on pppoe0 proto tcp from any to 76.10.176.225 port 443 -> 192.168.140.253
rdr on { em0.110 em0.120 em0.130 em0.140 openvpn } proto tcp from any to 76.10.176.225 port 443 -> 192.168.140.253
rdr on pppoe0 proto tcp from any to 76.10.176.225 port 80 -> 192.168.140.253
rdr on { em0.110 em0.120 em0.130 em0.140 openvpn } proto tcp from any to 76.10.176.225 port 80 -> 192.168.140.253
rdr on pppoe0 proto tcp from any to 76.10.176.225 port 25 -> 192.168.140.253
rdr on { em0.110 em0.120 em0.130 em0.140 openvpn } proto tcp from any to 76.10.176.225 port 25 -> 192.168.140.253
rdr on pppoe0 proto { tcp udp } from any to 76.10.176.225 port 53 -> 192.168.140.253
rdr on { em0.110 em0.120 em0.130 em0.140 openvpn } proto { tcp udp } from any to 76.10.176.225 port 53 -> 192.168.140.253
rdr on pppoe0 proto tcp from any to 76.10.176.225 port 993 -> 192.168.140.253
rdr on { em0.110 em0.120 em0.130 em0.140 openvpn } proto tcp from any to 76.10.176.225 port 993 -> 192.168.140.253
rdr on pppoe0 proto tcp from any to 76.10.176.225 port 587 -> 192.168.140.253
rdr on { em0.110 em0.120 em0.130 em0.140 openvpn } proto tcp from any to 76.10.176.225 port 587 -> 192.168.140.253
rdr on pppoe0 proto tcp from any to 76.10.176.225 port 8578 -> 192.168.140.250 port 1194
rdr on { em0.110 em0.120 em0.130 em0.140 openvpn } proto tcp from any to 76.10.176.225 port 8578 -> 192.168.140.250 port 1194
# UPnPd rdr anchor
rdr-anchor "miniupnpd"

**Comment by githubatf2f10** [comment]
Just reload OpnSense again after trying pfSense; I noticed that one of my rules was using ICMP, instead of IPv4. Once it got fixed, Mailinabox checks everything fine. So, it's not the fault of Pure NAT, it's my fault of configuration.
![screenshot_20180218_055734](https://user-images.githubusercontent.com/34818203/36351096-49b66f20-1472-11e8-8e73-910d30b89ca1.png)
