### ISSUE TITLE
Incorrect LLA used in route to delegated prefix due to kea-dhcp6 extracting hardware address from DUID-LL[T]

### ISSUE THREAD

**Issue by dseven** [opnsense/core#10217]
**Important notices**

Before you add a new report, we ask you kindly to acknowledge the following:

- [x] I have read the contributing guidelines at https://github.com/opnsense/core/blob/master/CONTRIBUTING.md
- [x] I am convinced that my issue is new after having checked both open and closed issues at https://github.com/opnsense/core/issues?q=is%3Aissue

**Describe the bug**

Executive summary:

By default, kea-dhcp6 extracts the "hardware address" from DUID-LLT and DUID-LL types when creating leases. For delegated prefixes, opnsense picks up this hardware address and uses it to add a route. By design, the address used in the DUID-LL[T] is not necessarily that of the interface requesting the lease, so the route can get created with an incorrect and unreachable next-hop.

Fortunately there is a way to configure kea-dhcp6 to not use this extraction method. If opnsense is going to rely on the hardware address in the lease for routing, it seems it must apply this configuration.

Detail:

I've been experimenting a bit with Kea DHCP, and have run into an interesting issue. 

My "production" opnsense instance gets a /56 IA_PD from my ISP. I did get Kea basically working for IPv4 and v6, but wanted to experiment a bit further, so I created a sandbox opnsense instance to do this on. I wanted functional (internet routable) IPv6 in the sandbox. Prefix delegation appeared to work, and my sandbox LAN clients get appropriate addresses, but internet access was not working. On closer inspection, the route for IA_PD on the upstream firewall was pointing the LLA of the downstream firewall's LAN interface, but that's not reachable. It needs to point to the LLA of the WAN interface.

Upstream (production) firewall has a VLAN interface on a network in common with the WAN interface of the downstream firewall. Upstream firewall runs kea-dhcp6 on that interface, with an address pool and a PD pool:

```
            {
                "id": 2,
                "subnet": "2a07:aa:bb:cc06::\/64",
                "pools": [
                    {
                        "pool": "2a07:aa:bb:cc06::1:0-2a07:aa:bb:cc06::1:ffff"
                    }
                ],
                "pd-pools": [
                    {
                        "prefix": "2a07:aa:bb:ccf0::",
                        "prefix-len": 60,
                        "delegated-len": 62
                    }
                ],
                "reservations": [],
                "interface": "vlan0.6"
            }
        ],
```

Downstream (sandbox) firewall has two interfaces, igc0 and igc1. By default, opnsense uses the first interface (igc0) for LAN and the second (igc1) for WAN, and they are plumbed accordingly. The MAC addresses are 00:d0:b4:01:a5:a0 and 00:d0:b4:01:a5:a1 respectively.

dhcp6c defaults to generating a DUID-LLT using the LLA of the first interface it finds with a valid LLA (i.e. igc0, the LAN interface). It (correctly) uses the same DUID-LLT for DHCPv6 requests on ALL interfaces, including WAN (RFC 8415: "The choice of network interface can be completely arbitrary, as long as that interface provides a globally unique link-layer address for the link type; the same DUID-LLT SHOULD be used in configuring all network interfaces connected to the device, regardless of which interface's link-layer address was used to generate the DUID-LLT."). A packet capture of a DHCP request looks like:

```
Frame 5: Packet, 159 bytes on wire (1272 bits), 159 bytes captured (1272 bits)
Ethernet II, Src: Katsujima_01:a5:a1 (00:d0:b4:01:a5:a1), Dst: IPv6mcast_01:00:02 (33:33:00:01:00:02)
Internet Protocol Version 6, Src: fe80::2d0:b4ff:fe01:a5a1, Dst: ff02::1:2
User Datagram Protocol, Src Port: 546, Dst Port: 547
DHCPv6
    Message type: Solicit (1)
    Transaction ID: 0xa11308
    Client Identifier
        Option: Client Identifier (1)
        Length: 14
        DUID: 00010001317f500b00d0b401a5a0
        DUID Type: link-layer address plus time (1)
        Hardware type: Ethernet (1)
        DUID Time: Apr 25, 2026 11:12:27.000000000 GMT Daylight Time
        Link-layer address: 00:d0:b4:01:a5:a0
        Link-layer address (Ethernet): Katsujima_01:a5:a0 (00:d0:b4:01:a5:a0)
    Identity Association for Non-temporary Address
    Elapsed time
    Option Request
    Identity Association for Prefix Delegation

```

Note the MAC addresses in the packet source (WAN) and in the DUID (LAN).

kea-dhcp6 on the upstream firewall receives the DHCPc6 request for IA_NA and IA_PD, and grants leases accordingly. For DUID-LLT or DUID-LL, it "cleverly" extracts the "hardware-address" from the DUID (https://kea.readthedocs.io/en/kea-2.2.0/arm/dhcp6-srv.html#mac-hardware-addresses-in-dhcpv6 , https://github.com/isc-projects/kea/blob/b51e765d4a5356f49d0eee3075f855a037f16c96/src/lib/dhcp/pkt.cc#L217-L227), and records this as the "hwaddr" (`/var/db/kea/kea-leases6.csv*`) / "hw-address" (API).

```
root@opnsense:~ # echo '{ "command": "lease6-get-all", "service": [ "dhcp6" ] }' | socat - UNIX-CONNECT:/var/run/kea/kea6-ctrl-socket | jq '.arguments.leases[] | select(."type" == "IA_PD" and ."state" == 0) | {"ip-address": ."ip-address", state: .state, duid: .duid, "hw-address": ."hw-address"}'
{
  "ip-address": "2a07:aa:bb:ccfc::",
  "state": 0,
  "duid": "00:01:00:01:31:7f:50:0b:00:d0:b4:01:a5:a0",
  "hw-address": "00:d0:b4:01:a5:a0"
}
root@opnsense:~ #
```

Kea even admits (https://kea.readthedocs.io/en/kea-2.2.0/arm/dhcp6-srv.html#mac-hardware-addresses-in-dhcpv6) that this is forbidden by RFC 8415 ("Clients and servers MUST treat DUIDs as opaque values and MUST only compare DUIDs for equality. Clients and servers SHOULD NOT in any other way interpret DUIDs. [...] It should be noted that an attempt to parse a DUID to obtain a client's link-layer address is unreliable, as there is no guarantee that the client is still using the same link-layer address as when it generated its DUID.") but they do it (by default) anyway.

opnsense's "kea_prefix_watcher" then scans the `kea-leases6.csv*` files, picks up the IA_PD with its "hwaddr", and looks that MAC address up in "hostwatch" to determine the LLA to use in the downstream route to the IA_PD. Curiously, hostwatch (observed through `/usr/local/opnsense/scripts/interfaces/list_hosts.py --proto inet6 --ndp`) shows entries for both WAN *and* LAN interfaces of the downstream firewall, so the (wrong) LLA is found.

```
root@opnsense:~ # /usr/local/opnsense/scripts/interfaces/list_hosts.py --proto inet6 --ndp | jq '.rows | map(select(.[2] | startswith("fe80::2d0:b4ff:fe01:a5a")))'
[
  [
    "igc0",
    "00:d0:b4:01:a5:a0",
    "fe80::2d0:b4ff:fe01:a5a0"
  ],
  [
    "igc0",
    "00:d0:b4:01:a5:a2",
    "fe80::2d0:b4ff:fe01:a5a2"
  ],
  [
    "vlan0.6",
    "00:d0:b4:01:a5:a0",
    "fe80::2d0:b4ff:fe01:a5a0"
  ],
  [
    "vlan0.6",
    "00:d0:b4:01:a5:a1",
    "fe80::2d0:b4ff:fe01:a5a1"
  ]
]
root@opnsense:~ #
```

Therefore the upstream firewall ends up with a route to the IA_PD pointing to the LLA of the downstream firewall's LAN interface, which is unreachable:

```
root@opnsense:~ # route -6 get 2a07:aa:bb:ccfc::
   route to: 2a07:aa:bb:ccfc::
destination: 2a07:aa:bb:ccfc::
       mask: ffff:ffff:ffff:fffc::
    gateway: fe80::2d0:b4ff:fe01:a5a0%vlan0.6
        fib: 0
  interface: vlan0.6
      flags: <UP,GATEWAY,DONE,STATIC>
 recvpipe  sendpipe  ssthresh  rtt,msec    mtu        weight    expire
       0         0         0         0      1500         1         0
root@opnsense:~ #
```

and so return packets for attempts to ping google have nowhere to go:

```
root@opnsense:~ # tcpdump -nni vlan0.6 ip6
tcpdump: verbose output suppressed, use -v[v]... for full protocol decode
listening on vlan0.6, link-type EN10MB (Ethernet), snapshot length 262144 bytes
07:55:18.054908 IP6 fe80::7e83:34ff:feb8:dcc2 > ff02::1:ff01:a5a0: ICMP6, neighbor solicitation, who has fe80::2d0:b4ff:fe01:a5a0, length 32
07:55:18.060953 IP6 2a07:aa:bb:ccfc:6a7c:624f:630c:e4c8 > 2a00:1450:4009:c13::71: ICMP6, echo request, id 17, seq 8, length 64
07:55:19.054886 IP6 fe80::7e83:34ff:feb8:dcc2 > ff02::1:ff01:a5a0: ICMP6, neighbor solicitation, who has fe80::2d0:b4ff:fe01:a5a0, length 32
07:55:19.084820 IP6 2a07:aa:bb:ccfc:6a7c:624f:630c:e4c8 > 2a00:1450:4009:c13::71: ICMP6, echo request, id 17, seq 9, length 64
07:55:20.108888 IP6 2a07:aa:bb:ccfc:6a7c:624f:630c:e4c8 > 2a00:1450:4009:c13::71: ICMP6, echo request, id 17, seq 10, length 64
07:55:20.126340 IP6 fe80::7e83:34ff:feb8:dcc2 > ff02::1:ff01:a5a0: ICMP6, neighbor solicitation, who has fe80::2d0:b4ff:fe01:a5a0, length 32
07:55:21.125832 IP6 fe80::7e83:34ff:feb8:dcc2 > ff02::1:ff01:a5a0: ICMP6, neighbor solicitation, who has fe80::2d0:b4ff:fe01:a5a0, length 32
07:55:21.132967 IP6 2a07:aa:bb:ccfc:6a7c:624f:630c:e4c8 > 2a00:1450:4009:c13::71: ICMP6, echo request, id 17, seq 11, length 64
```

If I change the downstream firewall's dhcp6c to use a DUID-UUID instead of DUID-LLT, kea-dhcp6 grants a new lease, and it (apparently) uses the packet's source MAC address as the "hwaddr" (that of the WAN interface) in lieu of being able to (inappropriately) extract it from the DUID, and kea_prefix_watcher maps this to the correct LLA (the WAN one), and everything works. Explicitly setting to DUID-LLT or DUID-LL with the MAC address of the WAN interface also works.

Forunately it is possible to configure the `mac-sources` in kea-dhcp6 (https://kea.readthedocs.io/en/kea-2.2.0/arm/dhcp6-srv.html#mac-hardware-addresses-in-dhcpv6). It would be nice if there was a way to configure exclusions ("I want everything *except* the DUID method"), but it doesn't appear that there is, so we're stuck with:

```
{
    "Dhcp6": {
        "mac-sources": [
            "raw",
            "client-link-addr-option",
            "ipv6-link-local",
            "remote-id",
            "subscriber-id",
            "docsis-cmts",
            "docsis-modem"
        ]
     }
}
```

With that in place, the correct hardware address appears in the lease:

```
root@opnsense:~ # echo '{ "command": "lease6-get-all", "service": [ "dhcp6" ] }' | socat - UNIX-CONNECT:/var/run/kea/kea6-ctrl-socket | jq '.arguments.leases[] | select(."type" == "IA_PD" and ."state" == 0) | {"ip-address": ."ip-address", state: .state, duid: .duid, "hw-address": ."hw-address"}'
{
  "ip-address": "2a07:aa:bb:ccf0::",
  "state": 0,
  "duid": "00:01:00:01:31:7f:50:0b:00:d0:b4:01:a5:a0",
  "hw-address": "00:d0:b4:01:a5:a1"
}
root@opnsense:~ #
```

and the route is created correctly:

```
root@opnsense:~ # route -6 get 2a07:aa:bb:ccf0::
   route to: 2a07:aa:bb:ccf0::
destination: 2a07:aa:bb:ccf0::
       mask: ffff:ffff:ffff:fffc::
    gateway: fe80::2d0:b4ff:fe01:a5a1%vlan0.6
        fib: 0
  interface: vlan0.6
      flags: <UP,GATEWAY,DONE,STATIC>
 recvpipe  sendpipe  ssthresh  rtt,msec    mtu        weight    expire
       0         0         0         0      1500         1         0
root@opnsense:~ #
```

If opnsense is going to use the hardware address to form the routes for delegated prefixes, it appears it must apply this fix.

Side-note; scanning `/var/db/kea/kea-leases6.csv` seems potentially fragile. Shouldn't opnsense really be using the Kea API (i.e. a published interface) to get current lease details?

Further side notes; this my investigation turned up a couple of tangential bugs, which I'll report separately...

The opnsense UI (Interfaces -> Settings -> System DHCP Unique Identifier) actually generates an incorrectly formatted DUID-UUID. The "type" part of a DUID is always 2 bytes - per RFC 8415 "A DUID consists of a 2-octet type code represented in network byte order, followed by a variable number of octets that make up the actual identifier." and section 11.5 confirms that the type should be 16 bits (value of 4), so the DUID-UUID should start with "00:04:", not "00:00:00:04:". Curiously, though, kea-dhcp6 doesn't seem to care about the malformed DUID, and grants leases for it anyway.

Changing the "System DHCP Unique Identifier" doesn't seem to take effect unless/until I manually kill the `dhcp6c` process and then refresh (Interfaces -> Overview) the WAN interface. Just doing the refresh without killing the `dhcp6c` process results in the old DUID still being used.

**Environment**

OPNsense 26.1.6-amd64

**Comment by Monviech** [comment]
`Side-note; scanning /var/db/kea/kea-leases6.csv seems potentially fragile. Shouldn't opnsense really be using the Kea API (i.e. a published interface) to get current lease details?`

Yes, just implemented over the past few days, feel free to test:
https://github.com/opnsense/core/pull/10197

Labeling this as support since I first have to read this all, understand it, and cross reference this with the current design.

**Comment by Monviech** [comment]
So it loops through all `mac-sources` methods and the first one that succeeds is then taken.

From the source code and documentation it looks like this is indeed the strict order:

1. RAW socket source MAC -- not implemented here
2. RFC6939 client link-layer address relay option
3. DUID-derived MAC
4. IPv6 source link-local-derived MAC
5. remote-id relay option
6. subscriber-id -- not implemented here
7. DOCSIS CMTS
8. DOCSIS modem

It is indeed weird that "3. DUID-derived MAC" is preferred before "4. IPv6 source link-local-derived MAC" since EUI-64 is a better assumption (my opinion)

Since 1 is not implemented (by KEA; documentation states it), and 2 only concerns relays, it always matches 3, and that assumption can be wrong I guess.

I would not want to hardcode anything here, if implemented this should be a multi select dropdown and documented.

**Comment by dseven** [comment]
That looks about right.

Configurable seems good, but I'd tend towards disabling the DUID in the defaults. Ideally I suppose the order should be configurable too.

I kindof disagree on this being a feature request (as opposed to a bug), though, as the current implementation can (quite likely, depending on how the client generates its perfectly valid DUID) result in nonfunctional prefix delegations.

**Comment by Monviech** [comment]
I guess it makes sense to stray from the KEA defaults when offering a configurable option.

The actual order would be fragile to implement with just an option field, since that stores selections not in any sorted order.

I would not consider it a bug though, it's more of a missing feature, though the line is thin between the two I admit.

**Comment by dseven** [comment]
In fairness, the real bug is that Kea is blatantly violating RFC 8415 😁

**Comment by Monviech** [comment]
I cannot speak for KEA, but thank you for the report and pointing into this direction, I feel like I also experienced this issue while testing but could not point my finger on it.

I think here:

https://github.com/opnsense/core/pull/9905

Still a valid guard, but the actual cause could have also been a mismatch due to the DUID thingy.

**Comment by dseven** [comment]
Thanks. It was a fun one to dig into!

It's possible that your case had the same root cause, and it happened that your hostwatch didn't have the entry for the "wrong" MAC address. I'm still not really sure why my hostwatch does have an entry for my downstream firewall's LAN interface, but I haven't spent any time trying to get to the bottom of that.

I believe I have also I've seen cases of kea_prefix_watcher creating routes for leases that are not current, but haven't fully explored that either. I haven't looked at your new implementation that uses the Kea API yet, but I'm hopeful that it will be more shielded from some of the old data found lying around in the CSV files.

**Comment by Monviech** [comment]
I have changed the script to use the `state` of a lease, which is documented upstream in my code comment

https://github.com/opnsense/core/blob/0513f26235900a6c8c4a818549dd7c2ec4e11139/src/opnsense/scripts/kea/kea_prefix_watcher.py#L120-L122

It should only install routes for valid leases, that's my hope. But you know KEA too by now >:), its never as it seems.
