### ISSUE TITLE
MAC Interface source in failover mode - CARP unicast - flood trafic

### ISSUE THREAD

**Issue by blacknote942** [opnsense/core#8201]
Hi,
Not certain if it's the good place to ask, please could you have a look on that case and tell me.

OPNsense 24.7.11_2-amd64 - FAILOVER

Case CARP in multicast:
While no ISC DHCP is running or any other service that generate unicast trafic from the slave makes it fully silent.
So far, its mac-address disapears from the core switch.
In that case, any unicast packet to the SLAVE without arp request would be broadcasted to the entire network.
CARP VRRP packets are multicasted all over network to client or guest terminal. This is ugly and unsecure to me. I would prefer to use the unicast mode.

Case CARP in unicast:
On interfaces without any source service or regulary trafic from the salve is doing the same: the mac from the slave times out on switches and then, any unicast packets from CARP are broadcasted all over the networks... no luck.

So the CARP unicast mode would be great to circle/reduce the data path between the master and slave but,  without dhcp-failover or any services providing data from the salve, the consequences are "worst".
I had to add static mac on the CORE SWITCH to respond but this is ugly too.

My idea would be to be abble to get a GARP option on interfaces. I've seen sthg like that on Stormshield for VIP.
Looked for arping but doesnt exist anymore as plugin?
A check box for GARP any 60sec per Interface would be optimal. Maybe an option on the CARP configuration too.

Thanks for your replies and any help - I'm certain about the consequences - got backtraces - i might be wrong on something anyway.
Feel free to let me know.

Then thank you for all works done.

Regards
BN.

**Comment by fichtner** [comment]
Hi,

Maybe you are looking for https://forum.opnsense.org/index.php?topic=31680.msg168662#msg168662


Cheers,
Franco

**Comment by fichtner** [comment]
Maybe that was the wrong hint, there is also https://reviews.freebsd.org/D7695 so `net.link.ether.inet.garp_rexmit_count`

**Comment by blacknote942** [comment]
I have configured it in tunables + reboot but nothing in tcpdump for about 2 hours..
![image](https://github.com/user-attachments/assets/2e29e17a-61b2-4fa2-b403-f8d04a2cf7e4)
I should have had a GARP about every 4 min.

**Comment by blacknote942** [comment]
So i decided to try to script a auto ping interface from slave to VIP- master. it works.
Aim is to be abble to use the UNICAST CARP mode without having to declare static mac on core switch - slave mac without trafic would be timeout and packets would be floodded all over interface and networks.

now, the core switch learns from 4 min ping the slave mac and i migrate again to the unicast carp mode.
now, i'm facing again the second issue i already noticed. If im wrong on sthg, please correct and suggest.

CARP UNICAST mode is active and so far, it uses the multicast mac to provioded the "gateway". The firewall, uses that multicast mac only to receive but uses its real mac to reply. The multicast mac is so far unknown on the network. devices lean it from arp but no trafic is provided by the firewall from the gateway address with that mac. 

consequences: any trafic to the multicast GW mac is flooded all over the network.

bad luck or really bad configuration from mine.
I already post some on the opnsense forum and it doesnt look so far that it has been noticed so much. Consequences are somehow terrible.

in resume the situation:

in some cases, the slave doenst make any trafic so its mac timeout on the network - any direct packets without arp are flooded - visible with the unicast carp mode.
> static mac on the core switch or script to ping from the slave resolves the situation

In unicast mode, the multicast gw isnt used as a source from the master so packets from devices to the GW are flooded all over the network.

from master
22:37:28.964500 ARP, Request who-has 10.73.10.254 tell 10.73.10.111, length 46
22:37:28.964506 ARP, Reply 10.73.10.254 is-at 00:00:5e:00:01:0a (oui IANA), length 28

from core sw > no multicast mac from the vlan10 - i havent migrated the others.

SWC# show mac-address-table detail | i 00:00
00:00:5e:00:01:49    20       dynamic                   lag300     300        false  false
00:00:5e:00:01:64    100      dynamic                   lag100     300        false  false
00:00:5e:00:01:6e    110      dynamic                   lag100     300        false  false
00:00:5e:00:01:77    119      dynamic                   lag100     300        false  false
00:00:5e:00:01:7d    125      dynamic                   lag100     300        false  false
00:00:5e:00:01:82    130      dynamic                   lag100     300        false  false
00:00:5e:00:01:8c    140      dynamic                   lag100     300        false  false
00:00:5e:00:01:ac    172      dynamic                   lag100     300        false  false
00:00:5e:00:01:b4    180      dynamic                   lag100     300        false  false
00:00:5e:00:01:be    190      dynamic                   lag100     300        false  false
00:00:5e:00:01:c8    200      dynamic                   lag100     300        false  false
00:00:5e:00:01:fa    250      dynamic                   lag100     300        false  false

SWC# show mac-address-table detail | i f4:90 > each mac from firewall are well known since the cron ping is active
f4:90:ea:01:27:d2    10       dynamic                   lag100     300        false  false
f4:90:ea:01:27:ca    10       dynamic                   lag200     300        false  false

on the SLAVE: it received the packet wich is destined to 00:00:5e:00:01:0a

root@fw-slave:~ # tcpdump -i vlan0.10 ether host 00:00:5e:00:01:0a -XXX
tcpdump: verbose output suppressed, use -v[v]... for full protocol decode
listening on vlan0.10, link-type EN10MB (Ethernet), snapshot length 262144 bytes
22:52:37.395560 IP 10.73.10.200 > 10.73.10.254: ICMP echo request, id 36219, seq 1, length 108
        0x0000:  0000 5e00 010a 4cd5 8750 3900 0800 4500  ..^...L..P9...E.

**Comment by blacknote942** [comment]
sharing the auto ping from BACKUP Firewall


Relativement à CARP UNICAST
A la non émission de packet du SLAVE si aucun service n'en founit (ie ISCDHCP)
Nécessite de faire un GARP ou autre trafic depuis le SLAVE pour mettre à jour ARP du SW et éviter la diffusion de packet UNICAST dans le réseau
Action est faite par défaut sur toutes les IF SLAVE en BACKUP - simplification et assurance de réaliser l'opération quelques soit le service et les interfaces anciennes ou nouvelles.

Une ACL permettant ICMP entre toutes les interfaces du FW vers la VIP est nécessaire.
En cas de nouvelle Interface, l'ALIAS et l'ACL (IF) doivent être maj.

![image](https://github.com/user-attachments/assets/ee818b2e-1e4c-4ae6-9504-98a0904d48d5)

ATTENTION: TYPE INTERFACE A DEFINIR sauf vtnet/vlan/igc


SCRIPT

cd "your path"
mkdir script-monit && cd script-monit
vi slave_monit_master_garp.sh


#!/bin/sh
# envoie un ping vers VIP si CARP BACKUP
# ref: garp slave en carp unicast

iftypes="vtnet igc vlan"

for iftype in $iftypes; do
        netstat -rnW | grep -v default | grep $iftype | awk '{print $6}' > /tmp/fileif
        while IFS= read -r line; do
        ifconfig $line | grep BACKUP > /dev/null
        if [ $? = 0 ]; then
                ifconfig $line | grep inet | grep vhid | awk '{print $2}' > /tmp/fileifip
                masterip=`sed -n "1p" /tmp/fileifip`
                ping -c 1 -t 1 $masterip > /dev/null
        fi
        done < "/tmp/fileif"
done

exit


chmod 744 slave_monit_master_garp.sh


ACTION
 
cd /usr/local/opnsense/service/conf/actions.d

vi actions_slave_monit_master_garp.conf
 
root@fw-slave:/usr/local/opnsense/service/conf/actions.d # cat slave_monit_master_garp.conf
 
[check]
command:"your path"/script-monit/slave_monit_master_garp.sh
parameters:
type:script_output
message:slavepingmastervip
description: slave_monit_master_garp
 
 
service configd restart
#TEST:
configctl slave_monit_master_garp check
 
 
CRON JOB > */4

**Comment by blacknote942** [comment]
In fact, the final trick would be to force the MASTER to use the multicast mac adress while sending the unicast vrrp packets to the slave.

MULTICAST VRRP
23:11:15.659892 IP 10.73.10.251 > vrrp.mcast.net: VRRPv2, Advertisement, vrid 10, prio 10, authtype none, intvl 10s, length 36
        0x0000:  0100 5e00 0012 0000 5e00 010a 0800 45e0  ..^.....^.....E.

UNICAST VRRP
23:11:53.890942 IP 10.73.10.251 > 10.73.10.252: VRRPv2, Advertisement, vrid 10, prio 10, authtype none, intvl 10s, length 36
        0x0000:  f490 ea01 27ca f490 ea01 27d2 0800 45e0  ....'.....'...E.

**Comment by blacknote942** [comment]
Just a reminder on that case - with the old version 24.7

- CARP multicast:
- It floods onto the entire network (normal) but problematic > needs to block CARP/VRRP multicast adress from the CORE towards EDGE or on each client port but much heavier. That flood is normal but really bad to foward it to client devices. That's why i would like to use the unicast mode.


- CARP unicast: issue:
Without any service (dhcp failover like) between the two firewalls, the SLAVE mac is ageout in the network - any unicast CARP messages sent from the MASTER to the SLAVE are flooded while switches have aged out and cleared the SLAVE MACADDR.
It appears so far that MASTER FW never requests the SLAVE MAC ADDR with ARP while it continues to send CARP unicast to the SLAVE.
Those messages are flooded all over the network by switches.
At this point i dont know/remember if the SLAVE MACADDR was still in the FW MASTER ARP TABLE.

>> I guess CARP unicast should implement some periodic message sent from the SLAVE to the MASTER.

The second issue is about the real mac used by FW Interface in UNICAST MODE: those observation and details need more investigation by the way:
the real interface mac is used in CARP messages as it is used to answer to devices and in ARP headers - wich are used by switches to learn the source mac. Since then, switches lose the VIP macaddr from MACTABLE and messages from devices to VIP are flooded.
> i will try to build a new lab about it soon - with 25 version.


At the moment and following the STAR architecture:
- MULTICAST: (used) blocked CARP/VRRP with ACL on CORE SWICTH towards branches
- UNICAST: (not used anymore) add the ping between FW CARP IF to make sure the SLAVE is always known by the CORE and by the MASTER on any interfaces ; no solution for the VIP MAC lost on switches - forcing the switch to use the VIP MAC for answering would be necessary.

Thanks for reading, sorry for miswriting
Great job again everyone who dev and build such systems (despite some possible "issues" here who anytime can help to go forward.

regards
BN
