### ISSUE TITLE
BUG [URGENT] [Multi WAN] Gateways does not respect reply-to in 26.1.8

### ISSUE THREAD

**Issue by Oriann** [opnsense/core#9806]
**Important notices**

Before you add a new report, we ask you kindly to acknowledge the following:

- [x] I have read the contributing guide lines at https://github.com/opnsense/core/blob/master/CONTRIBUTING.md
- [x] I am convinced that my issue is new after having checked both open and closed issues at https://github.com/opnsense/core/issues?q=is%3Aissue

**Describe the bug**

OPNsense does not add reply-to multi-wan rules, traffic is routing asymetric (eg.access to website or cloud is going through WAN1, download is initiating from WAN2). Manually setting up reply-to gateway or gateway policy does not help. I tried new rules and old rules too without success.

**To Reproduce**

1. Set up multiwan
2. Set up PF and manual rules same for both WAN (no extra settings needed)
3. Try to access website and then download something from it
4. See asymetric routing (best to test with downloading something big)

**Expected behavior**

With default PF and rules, reply-to should be added to all rules IF not disabled globally or locally by user himself

**Describe alternatives you considered**

I tried alternative from which is OPNsense forked, it worked on first try, no asymetric routing no special settings in PF or rules.

**Relevant log files**

I am not experienced in logging so I tell me what to download I will do that.

**Environment**

Software version used and hardware type if relevant, e.g.:

OPNsense 26.1.2 (amd64).
Intel(R) Celeron(R) J4125 CPU @ 2.00GHz
Network Intel

**Comment by fichtner** [comment]
Steps are unclear. Did you set up a new box using 26.1 or did you upgrade? Old rules or new rules? Wizard used or not?

And is there a forum reference for it?


Cheers,
Franco

**Comment by Oriann** [comment]
I have tried:

1. Factory reset my box
2. Set up a new box
3. Tried alternative pfSense

In my first post I have already wrote - 

> I tried new rules and old rules too without success.

I am always setting up box without wizard. There is no forum reference as I have searched for it if somebody have same problem. I did not made a new thread because everytime on forum is first answer to make github ticket. So I did it first.

**Comment by fichtner** [comment]
I still don't understand. It was working on 25.7.x and stopped working on 26.1.2 or where is your conclusion coming from?

**Comment by Oriann** [comment]
I have moved to new house and got another ISP finally so I tried to set up same multiwan config for my services. Just to clarify I already had this setup working earlier in times when I was using pfSense and it worked on first try.
So I set up multiwan same but on OPNsense version 26.1.2 but came into issues also in previous version 26.1.1 and also in 25.7.11_9

How did I find out its not working as intended:
I am selfhosting my nextcloud instance and other 15 services. My flow with services are different based on what need more upload and download. So for example I have:

Backend (Wordpress) > reverse proxy (Nginx) > WAN1
Bacekend (Nextcloud) > reverse proxy (still the same one) > WAN2

WAN1 with WAN2 is in failover group (Tier 1 WAN1 and Tier2 WAN2). Default WAN in GUI is WAN1.

When I access my Nextcloud instance (from remote location) nslookup and network inspector showing the correct WAN2 interface, BUT when I start downloading from my nextcloud (also from remote location) stream is coming from WAN1. And this is not desirable for me.

So to your question I have not used this configuration on OPNsense till now, I have just discovered it 3 days earlier and found out via my testing that reply-to maybe not working correctly.

**Comment by Oriann** [comment]
Here is screenshots of what I did to make multiwan work without asymetric routing (because thats standard config I suppose for most users).

<details>
  <summary>Gateways</summary>
  
 <img width="2092" height="172" alt="Image" src="https://github.com/user-attachments/assets/887ecaf1-82cf-4a88-98cc-d64fc626c445" /> 
  
</details>

<details>
  <summary>DNAT </summary>
  
<img width="2066" height="441" alt="Image" src="https://github.com/user-attachments/assets/b9d37e33-ec89-478c-8c76-c35e0ecf7574" />

</details>


<details>
  <summary>Firewall>Advanced </summary>
  
<img width="1319" height="942" alt="Image" src="https://github.com/user-attachments/assets/83e0d21a-5c2b-4ab2-a89a-af6e51d00634" />

<img width="1289" height="1111" alt="Image" src="https://github.com/user-attachments/assets/c9dea96f-e66d-4c72-8209-b7f3bf8644c2" />

</details>

**Comment by Oriann** [comment]
Another insight:
Disabling reply-to on both WAN1 and WAN2 rules will result in the default gateway (WAN1) functioning normally and services being available through it. While services going through WAN2 will stop working completely (ERR_CONNECTION_TIMED_OUT).

Setting **Bind states to interface** will result in only working default WAN1 services, WAN2 services does not accept any connections (ERR_CONNECTION_TIMED_OUT)

Looks like, default gateway takes the precedence no matter what you set up in FW rules.

**Comment by fichtner** [comment]
We've just released a hotfix for 26.1.2 which includes one known reply-to bug but I'm unsure if this is relevant here.

**Comment by Oriann** [comment]
Just upgraded to hotfix 26.1.2 but I have still same problems. Tested all again with resetting states everytime.

**Comment by fichtner** [comment]
I was expecting as much. Unfortunately we can't help much with setup issues in community support and there's no clear picture of the bug that was according to you also present in 25.7.11_9 which makes this rather strange.

**Comment by Oriann** [comment]
I made forum post so maybe somebody will test and help to reproduce. I will try older version if I have time I have invested 2 days to testing this...

[https://forum.opnsense.org/index.php?topic=50956.0](url)

**Comment by s-allain** [comment]
Before applying any patches & updates, we also wet this issue (Incoming OpenVPN packet to a DSL Line/Routeur, not the Primary Gateway), packets replies were leaving from the Primary Gateway (Starlink).

Workaround was to add a "Reply-To" as the DSL Gateway for the incoming OpenVPN trafic (firewall rule).

Environment is also a multi WAN setup, in a HA Cluster.

**Comment by Oriann** [comment]
I have tried to manually set up reply-to in incoming rules on WAN2, but it was ignored. 

THIS IS EXPECTED BEHAVIOR

Inbound:

Client > firewall WAN1> reverse proxy > Lan server
 
Outbound:

Lan server > reverse proxy > WAN1 > client

THIS IS WHAT HAPPENS NOW ON 26.1.2 AND SHOULD NOT

Inbound:
Client > firewall WAN1> reverse proxy > Lan server

Outbound:
Lan server > reverse proxy > WAN2 > client

I have also tried  setting up reply-to on LAN rule but its also ignored and traffic still leaves via default gateway WAN1, but it should leave via WAN2 ! I dont know how to describe this more for devs....its seems like nobody care anyway so maybe I will be forced to go back to pfSense (and I really dont want)where this bug does not exist. I am superuser but not professional debugger but I am sure asymetric routing is not normal behavior if its not users intend.

**Comment by Oriann** [comment]
@fichtner as collegue @AdSchellevis wanted I have finally found the last working version and last working config from that version so here it is. And no its not a joke I have really tested all version up to this one from 26.1.2.

last known working version and config:
OPNsense 22.7-amd64FreeBSD 13.1-RELEASEOpenSSL 1.1.1q 5 Jul 2022

[config-OPNsense.home.arpa-20260221004208.xml](https://github.com/user-attachments/files/25454112/config-OPNsense.home.arpa-20260221004208.xml)

[rules.debug](https://github.com/user-attachments/files/25454127/rules.debug)

Also I am uploading config on 26.1.2 which is configured just as same as on 22.7 but as I have wrote earlier, default gateway does not respect reply-to. Also on 22.7 making automatic rule in DNAT was sufficient to make this work.

**EDIT2_Version 26.1.2 (clean new install config with only neccesary rules to debug):**
[rules.debug](https://github.com/user-attachments/files/25457070/rules.debug)

[config-OPNsense.home.arpa-20260221104224.xml](https://github.com/user-attachments/files/25457183/config-OPNsense.home.arpa-20260221104224.xml)
________________________________________
**EDIT3_Version 25.7 (clean new install config with only neccesary rules to debug):**

[rules.debug](https://github.com/user-attachments/files/25457216/rules.debug)

[config-OPNsense.home.arpa-20260221111425.xml](https://github.com/user-attachments/files/25457217/config-OPNsense.home.arpa-20260221111425.xml)
________________________________________


Also this confirms this is a huge regression...

For debugging I have set up traffic shaper on WAN1 upload and started a download of a file in a remote location from cloud taht is located beside OPNsense. On 22.7 no matter what download was always full speed. On 26.1.2 speed was limited by shaper (aha!) BUT it should not be because my cloud uses WAN2 for incoming and outgoing traffic.

**Comment by AdSchellevis** [comment]
> Also this confirms this is a huge regression...

That is highly unlikely, given you have to go back to 2022 and thousands of people have been using the software in the meantime without issues. Assuming our config will act equal to the one from your old firewall may play a role here, although in the 26.1 configuration in notice features that don't exist in the other firewall.

What stands out is both configurations aren't equal, so next step I would take is at least try to create the exact same on your new install to assess the differences more easily. There are a lot more rules in the 26.1 setup than the ones tested, so that should be easy to try.

After recreating the same on the latest, best share the sample config and rules.debug again, and the ip addresses of the conversation in question if the issue persists. 

Some of the major differences that stand out are:

* The number of rules, which makes it difficult to compare
* Using wildcard matches via aliases for the target in the new
* Using aliases for targets
* `route-to` usage in the new

So lets start to compare apples with apples first.

If the issue persist with the same setup, I don't mind having another look, although this clearly is community support and not a regression.

**Comment by mimugmail** [comment]
Sorry for also hopping in. 
From a troubleshoot perspective you have two issues and you need one fixed so you know whats the real issue.

First: Remove gateway group, bind states (which is not default) and all reply-to Tests. Use 25.7.11 and "old" rules. Set upstream rules on both Interface : WANx and configure your nginx. This needs to work perfectly on both WANs (both websites). When got this running from external in all combinations. Make a break an review, also a snapshot of config.

Second: now you can choose to add gateway group on top.

**Comment by Oriann** [comment]
I have edited my previous post with clean new install 26.1.2 debug file and sample config. The same config works properly on 22.7.
I am now installing 25.7 so I will update my previous post once more with same config.

**Comment by Oriann** [comment]
Updated my previous post with 25.7 config, same bug different hour. [https://github.com/opnsense/core/issues/9806#issuecomment-3937687811](url)

 @mimugmail 
> Sorry for also hopping in. From a troubleshoot perspective you have two issues and you need one fixed so you know whats the real issue.
> 
> First: Remove gateway group, bind states (which is not default) and all reply-to Tests. Use 25.7.11 and "old" rules. Set upstream rules on both Interface : WANx and configure your nginx. This needs to work perfectly on both WANs (both websites). When got this running from external in all combinations. Make a break an review, also a snapshot of config.
> 
> Second: now you can choose to add gateway group on top.

I posted clean configs, I tested theese options just to make sure there in not some switch I forgot about in Multiwan environment. Sadly none of theese make some difference.
Important thing is that nslookup shows that my cloud is correctly on WAN2 but when I start downloading from it from remote location traffic goes through WAN1 as routing table never existed in OPNsense, this does not happen in 22.7.

**Comment by AdSchellevis** [comment]
@Oriann when you mention downloading, who initiates the connection? your new input rules look like this now:

22.7
```
# grep reply-to rules_22.7.debug 
pass in quick on pppoe0 reply-to ( pppoe0 ******* ) inet proto {tcp udp} from {any} to {192.168.20.98} port {80} keep state label "cd133bb13320d74e776bdb8321d15fed"
pass in quick on pppoe0 reply-to ( pppoe0 ******* ) inet proto {tcp udp} from {any} to {192.168.20.98} port {443} keep state label "eb689c40698237d50a8b76a83a533aea"
pass in quick on igc4 reply-to ( igc4 ****** ) inet proto {tcp udp} from {any} to {192.168.20.98} port {80} keep state label "7b772edc13435132a7dae4c9c0b2703c"
pass in quick on igc4 reply-to ( igc4 ****** ) inet proto {tcp udp} from {any} to {192.168.20.98} port {443} keep state label "974aacfc3d009a90c7ff3fd59ea560d9"
```

25.7
```
# grep reply-to rules.debug 
pass in quick on pppoe1 reply-to ( pppoe1  ***** ) inet proto {tcp udp} from {any} to {192.168.20.98/32} port {80} keep state label "823b4b16ab89f20c71eb65eda3d2d487"
pass in quick on pppoe1 reply-to ( pppoe1 ***** ) inet proto {tcp udp} from {any} to {192.168.20.98/32} port {443} keep state label "e49d0677c25ee59f85eb3539f0d0fd50"
pass in quick on igc4 reply-to ( igc4 ***** ) inet proto {tcp udp} from {any} to {192.168.20.98} port {80} keep state label "9c01d7d9c574302365aa3acf95a3c42b"
pass in quick on igc4 reply-to ( igc4 ***** ) inet proto {tcp udp} from {any} to {192.168.20.98/32} port {443} keep state label "9fd0d901ed15ea66504fbc3ea17a26ff"
```

which looks similar, so assuming you initiate the connection from outside and "download" from `192.168.20.98` the reply-to situation looks the same.

**Comment by AdSchellevis** [comment]
there is however one difference between both, and that is the route-to situation (which doesn't exist in the old config):

```
# grep route-to rules_26.1.debug 
pass out log route-to ( igc4 ***** ) from {(igc4)} to {!(igc4:network)} keep state allow-opts label "6d33da20f2bde6cd9e677002df9212b0" # let out anything from firewall host itself (force gw)
pass out log route-to ( pppoe1 *****) from {(pppoe1)} to {!(pppoe1:network)} keep state allow-opts label "5f940c783de2c14b63730bba60744c9b" # let out anything from firewall host itself (force gw)
```

Which you can disable in the firewall settings when needed.

**Comment by Oriann** [comment]
@AdSchellevis connection is initiated from remote location server, download happens from 192.168.20.98 as this is my reverse proxy.

As the secondary post you mean this option ? I have tried to switch on or off multiple times but without success.

<img width="1249" height="58" alt="Image" src="https://github.com/user-attachments/assets/85a3d8e6-10dd-48c9-93ee-037a8e0c5e45" />

Is there any debug test which I can perform to show you more verbose output from which you can solve where is the problem ?

**Comment by Oriann** [comment]
I made packet capture when I was downloading a file from remote location but dunno if its helpful

[0bc260b8-2bfe-489c-90b4-e64df20bd43d.zip](https://github.com/user-attachments/files/25457476/0bc260b8-2bfe-489c-90b4-e64df20bd43d.zip)

EDIT:
Better packet capture with real public ip addresses: (WAN Vodafone is main gateway, WAN Netdeluxe is secondary where should all my server traffic flow), Remote downloading client is 80.251.254.246

[eb2db4c5-f760-4177-a5ff-52b7e9dc55ba.zip](https://github.com/user-attachments/files/25457521/eb2db4c5-f760-4177-a5ff-52b7e9dc55ba.zip)

**Comment by AdSchellevis** [comment]
@Oriann sorry a bit too much text, so this might already be in there, but your remote client is connecting to igc4 or the ppp interface?

**Comment by Oriann** [comment]
@AdSchellevis remote client is connecting to igc4 interface

Here is more debug info with states:

<details>
  <summary>States</summary>

```
pfctl -ss -vv | grep -A20 178.213.45.35
No ALTQ support in kernel
ALTQ related functions disabled
all tcp 192.168.20.98:443 (192.168.1.202:443) <- 178.213.45.35:55192       TIME_WAIT:TIME_WAIT
   [3990052285 + 3992912384] wscale 7  [243510668 + 3556835840] wscale 8
   age 00:23:35, expires in 00:06:23, 761:779 pkts, 127015:150057 bytes, rule 84
   id: 7d029a6900000000 creatorid: 58075cf3 reply-to: 192.168.1.1@igc4
   origif: igc4
all tcp 178.213.45.35:55192 -> 192.168.20.98:443       TIME_WAIT:TIME_WAIT
   [243510668 + 3556835840] wscale 8  [3990052285 + 3992912384] wscale 7
   age 00:23:35, expires in 00:06:23, 761:779 pkts, 127015:150057 bytes, rule 71, allow-opts
   id: 7e029a6900000000 creatorid: 58075cf3
   origif: igc1
all tcp 192.168.20.98:443 (31.30.119.249:443) <- 178.213.45.35:47748       ESTABLISHED:ESTABLISHED
   [3300379650 + 2139424256] wscale 7  [1159974103 + 4294312192] wscale 7
   age 00:22:38, expires in 23:59:57, 929:757 pkts, 135354:145841 bytes, rule 80
   id: 7d039a6900000000 creatorid: 58075cf3 reply-to: 10.26.202.187@pppoe1
   origif: pppoe1
all tcp 178.213.45.35:47748 -> 192.168.20.98:443       ESTABLISHED:ESTABLISHED
   [1159974103 + 4294312192] wscale 7  [3300379650 + 2139424256] wscale 7
   age 00:22:38, expires in 23:59:57, 929:757 pkts, 135354:145841 bytes, rule 71, allow-opts
   id: 7e039a6900000000 creatorid: 58075cf3
   origif: igc1
all tcp 192.168.20.98:443 (31.30.119.249:443) <- 85.132.136.15:45448       ESTABLISHED:ESTABLISHED
   [1679777140 + 12780032] wscale 7  [2132333532 + 4294312192] wscale 7
   age 00:22:36, expires in 23:59:52, 1111:741 pkts, 145536:146720 bytes, rule 80
   id: 83039a6900000000 creatorid: 58075cf3 reply-to: 10.26.202.187@pppoe1
   origif: pppoe1
all tcp 85.132.136.15:45448 -> 192.168.20.98:443       ESTABLISHED:ESTABLISHED
   [2132333532 + 4294312192] wscale 7  [1679777140 + 12780032] wscale 7
   age 00:22:36, expires in 23:59:52, 1111:741 pkts, 145536:146720 bytes, rule 71, allow-opts
   id: 84039a6900000000 creatorid: 58075cf3
   origif: igc1
all tcp 192.168.20.98:443 (31.30.119.249:443) <- 85.71.57.164:59124       ESTABLISHED:ESTABLISHED
   [1068269927 + 2147353088] wscale 7  [710947685 + 4294312192] wscale 7
   age 00:22:34, expires in 23:59:55, 1231:915 pkts, 173019:181012 bytes, rule 80
   id: 89039a6900000000 creatorid: 58075cf3 reply-to: 10.26.202.187@pppoe1
   origif: pppoe1
all tcp 85.71.57.164:59124 -> 192.168.20.98:443       ESTABLISHED:ESTABLISHED
--
all tcp 192.168.20.98:443 (192.168.1.202:443) <- 178.213.45.35:63601       ESTABLISHED:ESTABLISHED
   [2853175505 + 3640656384] wscale 7  [623690766 + 262656] wscale 8
   age 00:08:37, expires in 23:59:58, 977:1014 pkts, 146614:216649 bytes, rule 84
   id: d5169a6900000000 creatorid: 58075cf3 reply-to: 192.168.1.1@igc4
   origif: igc4
all tcp 192.168.20.98:443 (192.168.1.202:443) <- 178.213.45.35:63600       ESTABLISHED:ESTABLISHED
   [2593192790 + 2717778432] wscale 7  [118385565 + 2152923392] wscale 8
   age 00:08:37, expires in 23:59:53, 130:154 pkts, 16686:16707 bytes, rule 84
   id: d6169a6900000000 creatorid: 58075cf3 reply-to: 192.168.1.1@igc4
   origif: igc4
all tcp 178.213.45.35:63601 -> 192.168.20.98:443       ESTABLISHED:ESTABLISHED
   [623690766 + 262656] wscale 8  [2853175505 + 3640656384] wscale 7
   age 00:08:37, expires in 23:59:58, 979:1016 pkts, 147806:219649 bytes, rule 71, allow-opts
   id: d7169a6900000000 creatorid: 58075cf3
   origif: igc1
all tcp 178.213.45.35:63600 -> 192.168.20.98:443       ESTABLISHED:ESTABLISHED
   [118385565 + 2152923392] wscale 8  [2593192790 + 2717778432] wscale 7
   age 00:08:37, expires in 23:59:53, 132:156 pkts, 17878:19707 bytes, rule 71, allow-opts
   id: d8169a6900000000 creatorid: 58075cf3
   origif: igc1
all tcp 192.168.20.98:443 (192.168.1.202:443) <- 178.213.45.35:63618       ESTABLISHED:ESTABLISHED
   [2018909760 + 872350208] wscale 7  [4130979868 + 2152857856] wscale 8
   age 00:08:33, expires in 23:58:30, 32:28 pkts, 14153:4800 bytes, rule 84
   id: ed169a6900000000 creatorid: 58075cf3 reply-to: 192.168.1.1@igc4
   origif: igc4
all tcp 178.213.45.35:63618 -> 192.168.20.98:443       ESTABLISHED:ESTABLISHED
   [4130979868 + 2152857856] wscale 8  [2018909760 + 872350208] wscale 7
   age 00:08:33, expires in 23:58:30, 32:28 pkts, 14153:4800 bytes, rule 71, allow-opts
   id: ee169a6900000000 creatorid: 58075cf3
   origif: igc1
all tcp 192.168.1.55:22000 <- 192.168.20.5:35448       ESTABLISHED:ESTABLISHED
   [1969682132 + 1179904] wscale 8  [1846433959 + 2281505280] wscale 7
   age 00:07:43, expires in 23:59:48, 23:22 pkts, 3385:3164 bytes, rule 75
   id: 16189a6900000000 creatorid: 58075cf3
   origif: igc1
all tcp 192.168.1.202:6316 (192.168.20.5:35448) -> 192.168.1.55:22000       ESTABLISHED:ESTABLISHED
   [1846433959 + 2281505280] wscale 7  [1969682132 + 1179904] wscale 8
   age 00:07:43, expires in 23:59:48, 23:22 pkts, 3385:3164 bytes, rule 71, allow-opts
   id: 17189a6900000000 creatorid: 58075cf3
   origif: igc4
all tcp 192.168.1.55:22000 <- 192.168.20.5:38766       ESTABLISHED:ESTABLISHED
   [701578329 + 1179904] wscale 8  [2191516420 + 3288203776] wscale 7
   age 00:06:43, expires in 23:59:18, 22:21 pkts, 3297:3094 bytes, rule 75
   id: 7e199a6900000000 creatorid: 58075cf3
   origif: igc1
all tcp 192.168.1.202:22789 (192.168.20.5:38766) -> 192.168.1.55:22000       ESTABLISHED:ESTABLISHED
--
all tcp 192.168.20.98:443 (31.30.119.249:443) <- 178.213.45.35:42616       ESTABLISHED:ESTABLISHED
   [4275644822 + 2137196800] wscale 7  [3879063995 + 2152726784] wscale 7
   age 01:22:42, expires in 23:59:53, 3386:2911 pkts, 433794:752978 bytes, rule 82
   id: f785996900000000 creatorid: 58075cf3 reply-to: 10.26.202.187@pppoe1
   origif: pppoe1
all tcp 178.213.45.35:42616 -> 192.168.20.98:443       ESTABLISHED:ESTABLISHED
   [3879063995 + 2152726784] wscale 7  [4275644822 + 2137196800] wscale 7
   age 01:22:42, expires in 23:59:53, 3386:2913 pkts, 433794:753192 bytes, rule 71, allow-opts
   id: f885996900000000 creatorid: 58075cf3
   origif: igc1
all tcp 192.168.20.98:443 (192.168.1.202:443) <- 80.251.254.246:55804       ESTABLISHED:ESTABLISHED
   [2433636470 + 1342047232] wscale 7  [919674356 + 4283433472] wscale 8
   age 01:22:42, expires in 23:59:20, 105:72 pkts, 16723:7896 bytes, rule 86
   id: 0286996900000000 creatorid: 58075cf3 reply-to: 192.168.1.1@igc4
   origif: igc4
all tcp 80.251.254.246:55804 -> 192.168.20.98:443       ESTABLISHED:ESTABLISHED
   [919674356 + 4283433472] wscale 8  [2433636470 + 1342047232] wscale 7
   age 01:22:42, expires in 23:59:20, 105:72 pkts, 16723:7896 bytes, rule 71, allow-opts
   id: 0386996900000000 creatorid: 58075cf3
   origif: igc1
all tcp 192.168.20.98:443 (31.30.119.249:443) <- 178.213.42.37:36008       ESTABLISHED:ESTABLISHED
   [277702378 + 4294181120] wscale 7  [1597882045 + 2151809280] wscale 7
   age 01:22:41, expires in 23:59:48, 543:380 pkts, 38178:42090 bytes, rule 82
   id: 0786996900000000 creatorid: 58075cf3 reply-to: 10.26.202.187@pppoe1
   origif: pppoe1
all tcp 178.213.42.37:36008 -> 192.168.20.98:443       ESTABLISHED:ESTABLISHED
--
all tcp 192.168.20.98:443 (192.168.1.202:443) <- 178.213.45.35:50756       ESTABLISHED:ESTABLISHED
   [505812898 + 2332099072] wscale 7  [2407240916 + 3670272] wscale 8
   age 01:22:40, expires in 23:59:53, 497:500 pkts, 29059:38734 bytes, rule 86
   id: 5586996900000000 creatorid: 58075cf3 reply-to: 192.168.1.1@igc4
   origif: igc4
all tcp 178.213.45.35:50756 -> 192.168.20.98:443       ESTABLISHED:ESTABLISHED
   [2407240916 + 3670272] wscale 8  [505812898 + 2332099072] wscale 7
   age 01:22:40, expires in 23:59:53, 497:500 pkts, 29059:38734 bytes, rule 71, allow-opts
   id: 5686996900000000 creatorid: 58075cf3
   origif: igc1
all tcp 3.122.46.27:8883 <- 192.168.20.196:51290       ESTABLISHED:ESTABLISHED
   [1429297741 + 1080164352] wscale 8  [2649090485 + 4286710016] wscale 6
   age 01:22:38, expires in 23:59:58, 348:177 pkts, 30819:25439 bytes, rule 77
   id: 1a87996900000000 creatorid: 58075cf3
   origif: igc1
all tcp 31.30.119.249:28789 (192.168.20.196:51290) -> 3.122.46.27:8883       ESTABLISHED:ESTABLISHED
   [2649090485 + 4286710016] wscale 6  [1429297741 + 1080164352] wscale 8
   age 01:22:38, expires in 23:59:58, 348:177 pkts, 30819:25439 bytes, rule 76, allow-opts
   id: 1b87996900000000 creatorid: 58075cf3 route-to: 10.26.202.187@pppoe1
   origif: pppoe1
all tcp 34.242.255.230:8820 <- 192.168.20.180:54646       ESTABLISHED:ESTABLISHED
   [1791259351 + 3212181760] wscale 9  [303913117 + 7995392] wscale 5
   age 01:22:38, expires in 23:59:54, 342:176 pkts, 15389:8292 bytes, rule 77
   id: 1d87996900000000 creatorid: 58075cf3
   origif: igc1
all tcp 31.30.119.249:36181 (192.168.20.180:54646) -> 34.242.255.230:8820       ESTABLISHED:ESTABLISHED
--
all tcp 192.168.20.98:443 (31.30.119.249:443) <- 178.213.45.35:40668       ESTABLISHED:ESTABLISHED
   [2483070035 + 2152530176] wscale 7  [397288433 + 4294312192] wscale 7
   age 01:22:34, expires in 23:59:56, 847:909 pkts, 60550:83249 bytes, rule 82
   id: a488996900000000 creatorid: 58075cf3 reply-to: 10.26.202.187@pppoe1
   origif: pppoe1
all tcp 178.213.45.35:40668 -> 192.168.20.98:443       ESTABLISHED:ESTABLISHED
   [397288433 + 4294312192] wscale 7  [2483070035 + 2152530176] wscale 7
   age 01:22:34, expires in 23:59:56, 847:909 pkts, 60550:83249 bytes, rule 71, allow-opts
   id: a588996900000000 creatorid: 58075cf3
   origif: igc1
all tcp 192.168.20.98:443 (31.30.119.249:443) <- 178.213.42.37:55358       ESTABLISHED:ESTABLISHED
   [2799651122 + 4294181120] wscale 7  [3845365469 + 4294312192] wscale 7
   age 01:22:34, expires in 23:59:57, 847:907 pkts, 60482:82969 bytes, rule 82
   id: b188996900000000 creatorid: 58075cf3 reply-to: 10.26.202.187@pppoe1
   origif: pppoe1
all tcp 178.213.42.37:55358 -> 192.168.20.98:443       ESTABLISHED:ESTABLISHED
   [3845365469 + 4294312192] wscale 7  [2799651122 + 4294181120] wscale 7
   age 01:22:34, expires in 23:59:57, 847:908 pkts, 60482:83115 bytes, rule 71, allow-opts
   id: b288996900000000 creatorid: 58075cf3
   origif: igc1
all tcp 192.168.20.98:443 (31.30.119.249:443) <- 85.71.57.164:54532       ESTABLISHED:ESTABLISHED
   [2048875414 + 4294181120] wscale 7  [2529024298 + 4294312192] wscale 7
   age 01:22:34, expires in 23:59:57, 767:826 pkts, 56994:79217 bytes, rule 82
   id: b388996900000000 creatorid: 58075cf3 reply-to: 10.26.202.187@pppoe1
   origif: pppoe1
all tcp 85.71.57.164:54532 -> 192.168.20.98:443       ESTABLISHED:ESTABLISHED
--
all tcp 192.168.20.98:443 (192.168.1.202:443) <- 178.213.45.35:50778       TIME_WAIT:TIME_WAIT
   [2814253066 + 855638528] wscale 7  [2615139680 + 590336] wscale 8
   age 01:22:33, expires in 00:07:14, 4144:4478 pkts, 537806:1031045 bytes, rule 86
   id: d588996900000000 creatorid: 58075cf3 reply-to: 192.168.1.1@igc4
   origif: igc4
all tcp 178.213.45.35:50778 -> 192.168.20.98:443       TIME_WAIT:TIME_WAIT
   [2615139680 + 590336] wscale 8  [2814253066 + 855638528] wscale 7
   age 01:22:33, expires in 00:07:14, 4149:4483 pkts, 540786:1038545 bytes, rule 71, allow-opts
   id: d688996900000000 creatorid: 58075cf3
   origif: igc1
all tcp 34.241.218.80:8883 <- 192.168.20.105:49161       ESTABLISHED:ESTABLISHED
   [3180789617 + 2491089153]  [1526924544 + 1006567680]
   age 01:22:30, expires in 23:59:12, 202:149 pkts, 29343:18586 bytes, rule 77
   id: 6789996900000000 creatorid: 58075cf3
   origif: igc1
all tcp 31.30.119.249:40785 (192.168.20.105:49161) -> 34.241.218.80:8883       ESTABLISHED:ESTABLISHED
   [1526924544 + 1006567680]  [3180789617 + 2491089153]
   age 01:22:30, expires in 23:59:12, 202:149 pkts, 29343:18586 bytes, rule 76, allow-opts
   id: 6889996900000000 creatorid: 58075cf3 route-to: 10.26.202.187@pppoe1
   origif: pppoe1
all tcp 52.48.138.63:8883 <- 192.168.20.102:49161       ESTABLISHED:ESTABLISHED
   [2692516189 + 2507931648]  [2064909568 + 805175552]
   age 01:22:30, expires in 23:59:12, 204:151 pkts, 29971:18666 bytes, rule 77
   id: 6989996900000000 creatorid: 58075cf3
   origif: igc1
all tcp 31.30.119.249:64251 (192.168.20.102:49161) -> 52.48.138.63:8883       ESTABLISHED:ESTABLISHED
--
all tcp 192.168.20.98:443 (31.30.119.249:443) <- 178.213.45.35:57842       ESTABLISHED:ESTABLISHED
   [3732868659 + 2153971968] wscale 7  [2827927075 + 4260096] wscale 7
   age 01:22:23, expires in 23:59:56, 539:381 pkts, 38181:40169 bytes, rule 82
   id: fe89996900000000 creatorid: 58075cf3 reply-to: 10.26.202.187@pppoe1
   origif: pppoe1
all tcp 178.213.45.35:57842 -> 192.168.20.98:443       ESTABLISHED:ESTABLISHED
   [2827927075 + 4260096] wscale 7  [3732868659 + 2153971968] wscale 7
   age 01:22:23, expires in 23:59:56, 539:381 pkts, 38181:40169 bytes, rule 71, allow-opts
   id: ff89996900000000 creatorid: 58075cf3
   origif: igc1
all tcp 52.48.138.63:8883 <- 192.168.20.110:54473       ESTABLISHED:ESTABLISHED
   [3633481857 + 2097152]  [1538471680 + 4278190336]
   age 01:22:22, expires in 23:59:59, 423:363 pkts, 140333:27502 bytes, rule 77
   id: 068a996900000000 creatorid: 58075cf3
   origif: igc1
all tcp 31.30.119.249:31652 (192.168.20.110:54473) -> 52.48.138.63:8883       ESTABLISHED:ESTABLISHED
   [1538471680 + 4278190336]  [3633481857 + 2097152]
   age 01:22:22, expires in 23:59:59, 423:363 pkts, 140333:27502 bytes, rule 76, allow-opts
   id: 078a996900000000 creatorid: 58075cf3 route-to: 10.26.202.187@pppoe1
   origif: pppoe1
all tcp 192.168.20.98:443 (31.30.119.249:443) <- 80.251.254.246:33810       ESTABLISHED:ESTABLISHED
   [1197311905 + 2147680768] wscale 7  [4256380685 + 4283564544] wscale 7
   age 01:22:17, expires in 23:59:57, 3577:2927 pkts, 460251:724938 bytes, rule 82
   id: 6c8a996900000000 creatorid: 58075cf3 reply-to: 10.26.202.187@pppoe1
   origif: pppoe1
all tcp 80.251.254.246:33810 -> 192.168.20.98:443       ESTABLISHED:ESTABLISHED
```
  
</details>

<details>
  <summary>Packet capture filtering remote client address</summary>

```
tcpdump -ttt -nn -vvv -i igc4 'tcp and host 80.251.254.246 and port 443 and (tcp[tcpflags] & tcp-syn != 0)'
tcpdump: listening on igc4, link-type EN10MB (Ethernet), snapshot length 262144 bytes
 00:00:00.000000 IP (tos 0x0, ttl 55, id 56695, offset 0, flags [DF], proto TCP (6), length 60)
    80.251.254.246.51256 > 192.168.1.202.443: Flags [S], cksum 0x3a6b (correct), seq 2592237661, win 64240, options [mss 1460,sackOK,TS val 1019213484 ecr 0,nop,wscale 7], length 0
 00:00:00.000097 IP (tos 0x0, ttl 63, id 0, offset 0, flags [DF], proto TCP (6), length 60)
    192.168.1.202.443 > 80.251.254.246.51256: Flags [S.], cksum 0xaf0b (correct), seq 2318125330, ack 2592237662, win 64800, options [mss 1452,sackOK,TS val 1787480925 ecr 1019213484,nop,wscale 7], length 0
^C
2 packets captured
9181 packets received by filter
0 packets dropped by kernel
root@OPNsense:~ # tcpdump -ttt -nn -vvv -i pppoe1 'tcp and host 80.251.254.246 and port 443 and (tcp[tcpflags] & tcp-syn != 0)'
tcpdump: listening on pppoe1, link-type NULL (BSD loopback), snapshot length 262144 bytes
^C
0 packets captured
6046 packets received by filter
0 packets dropped by kernel
```

</details>

**Comment by AdSchellevis** [comment]
filtering `ip.src == 80.251.254.246` on the `igc4` capture doesn't offer any results, but does on `pppoe1`, so now I'm confused. Traffic looks normal in the capture for that part.

**Comment by Oriann** [comment]
Yeah but thats the problem I am talking about, traffic should flow via igc4 for client 80.251.254.246 not via pppoe1. See the ruleset I have made.

**Comment by AdSchellevis** [comment]
but then the client should reach out to the ip address configured on igc4, when contacts pppoe, reply-to is the feature that enforces it to stay there.... feels like you don't want reply-to but want default destination routing, in which case you should just disable `reply-to`

**Comment by Oriann** [comment]
Now its me who is confused. I need reply-to because I want traffic to egress and ingress to the same interface. But its not happening on 25.7 and 26.1.2. So disabling reply-to is not correct way I think. Just to remind you on 22.7 I didnt need to do some special settings.

EDIT:
Also disabling reply-to will result in non functional services, I think I would need more rules for this to work.

**Comment by AdSchellevis** [comment]
In order to stay on the same, it should arrive on it, if you let the client connect to an address of igc4, I would expect it to stay there (reply-to). The traffic just doesn't seem to show it arriving, which points to an issue elsewhere (all traffic in the conversation with 80.251.254.246 is on pppoe1) . 

I assume both interfaces have different public ip addresses the client can contact, so the question probably is, why does it try to connect to pppoe1 when trying to reach out to igc4? 

22.7 is ages ago, almost impossible to retrace what when different (and probably wrong) back then I'm afraid.

**Comment by Oriann** [comment]
> why does it try to connect to pppoe1 when trying to reach out to igc4?

And thats why I am here...funny is it only happens from 23.1 onwards, same ruleset, same DNAT, same settings. Isnt the problem that default gateway just forcing itself to routing table ?

When I switch gateway priority so WAN_Netdeluxe (for cloud) is default gateway it works like intended, if I make WAN_Vodafone (for normal traffic) default gateway it flows again through bad gateway:

<img width="797" height="223" alt="Image" src="https://github.com/user-attachments/assets/085b1c3e-6a33-4da0-8dc6-b072668ec82d" />

**Comment by AdSchellevis** [comment]
> And thats why I am here...funny is it only happens from 23.1 onwards, same ruleset, same DNAT, same settings. Isnt the problem that default gateway just forcing itself to routing table ?

That's how it works and should work indeed, (active) is default, how the two dhcp clients determined default priority might have shifted a bit over time,  but this doesn't influence source routing behavior (which was the claim here).  A good read on how default routes are being determined can be found in our documentation https://docs.opnsense.org/manual/gateways.html#default-gateways

To which interface the remote client sends the packet is not under the control of the firewall (it simply receives it), which, for `pppoe1 `, simply doesn't seem to happen right now.

If you don't want it to stick to where it came from (and revert back to regular destination routing), simply disable reply-to in the settings.

If your remote client determines the ip to connect to using something like dyndns, the only thing that is likely different between your two setups is your routing table. This would be easiest to assess using `netstat -nr4` on both versions. If priority was different between both, the preferred next hop could be different.

**Comment by tigodev** [comment]
Adding to this:
I migrated from the old-rules to the New Rules, and now, the reply-to is not respected.
LAN Single subnet, 
Last rule general default rules all traffic to exit on WAN2. 
Prior to the last rule, I have Client-IP-addresses specific rules to direct their traffic out via VPN-1. 
Prior to the last rule, I have Client-IP-addresses specific rules to direct their traffice out via VPN-2
Prior to the last rule, I have Client-IP-addresses specific rules to direct their traffice out via VPN-3

Client Traffic is exiting on the respective VPN, but the return path is broken, no-traffic is received when I have all 3 VPNs enabled. With a single VPN it is working, but with all 3 VPNs active, there's no return traffic.

This was not an issue with the old rules.

**Comment by Andrewprvrzv** [comment]
Issue: In a Multi-WAN setup with static IPs and different WAN priorities, incoming connections work correctly on the higher-priority WAN, but fail on the lower-priority WAN (go through default gateway). Tried forcing the gateway in firewall rules and disabling reply-to—no effect.

Solution/Workaround: Change the Destination NAT rule → Firewall rule setting to Manual. With separate firewall rules for each WAN incoming connection already configured, incoming traffic started flowing correctly, restoring pre-update behavior.

**Comment by Oriann** [comment]
> Solution/Workaround: Change the Destination NAT rule → Firewall rule setting to Manual. With separate firewall rules for each WAN incoming connection already configured, incoming traffic started flowing correctly, restoring pre-update behavior.

This workaround did not work for me in 26.1.2. I have tested several times. Whats your current version ?

**Comment by fichtner** [comment]
Did someone test on 26.1.5 actually?

**Comment by Andrewprvrzv** [comment]
> Did someone test on 26.1.5 actually?

OPNsense 26.1.5-amd64

<img width="186" height="58" alt="Image" src="https://github.com/user-attachments/assets/e73bb841-17e8-40c4-943c-2b5479b150db" />

Work!!!

**Comment by Oriann** [comment]
> > Did someone test on 26.1.5 actually?
> 
> OPNsense 26.1.5-amd64
> 
> Work!!!

New rules or old rules ?

**Comment by Andrewprvrzv** [comment]
> > > Did someone test on 26.1.5 actually?
> > 
> > 
> > OPNsense 26.1.5-amd64
> > Work!!!
> 
> New rules or old rules ?

New rules, migrated from old. (not clean install)

**Comment by vgdh** [comment]
After updating to OPNsense 26.1.4, I started experiencing an issue where the router receives requests on WAN-1 but sends responses out through WAN-2.

**Comment by Oriann** [comment]
> After updating to OPNsense 26.1.4, I started experiencing an issue where the router receives requests on WAN-1 but sends responses out through WAN-2.
> 
> Additionally, the system stopped fetching updates when using my PPTP connection, even though the connection itself appears healthy and functions correctly. Updates only work if I assign a lower priority to the PPTP WAN and a higher priority to the secondary WAN in the gateway configuration.

Can you reproduce it on 26.1.5 too ?

**Comment by vgdh** [comment]
> > After updating to OPNsense 26.1.4, I started experiencing an issue where the router receives requests on WAN-1 but sends responses out through WAN-2.
> > 
> > Additionally, the system stopped fetching updates when using my PPTP connection, even though the connection itself appears healthy and functions correctly. Updates only work if I assign a lower priority to the PPTP WAN and a higher priority to the secondary WAN in the gateway configuration.
> 
> Can you reproduce it on 26.1.5 too ? 

I am now on 26.1.5 and the issue is the same.

Even rule allow ping this router on all interfaces doesn't work as expected. ICMP arrived on pptp interface but respond goes through second wan (which gateway has higher priority).

**Comment by vgdh** [comment]
Looks like the automatic **Firewall rule** (that is created by D-NAT)  has disabled **reply-to** option by default.  
Because if I create a manual allow rule for this D-NAT rule in the **new rules**, the response starts to go to the right interface. 
Now I need to create a manual rule instead of automatic for every d-nat rule and check how it will work.
Also, LLM says I can't use multiple interfaces in the rule if I want **reply-to** to work correctly. But still, I tried automatic rules with one interface in the rule - result is the same **reply-to** doesn't work as expected. Only manual rules work.

<img width="1361" height="54" alt="Image" src="https://github.com/user-attachments/assets/1a9f355b-08f5-4afe-ae55-8aba32ee8545" />

**Comment by AdSchellevis** [comment]
> Looks like the automatic Firewall rule (that is created by D-NAT) has disabled reply-to option by default.

Only "Register rule" will add a gateway, "Pass", as before, is a nat feature which has no knowledge about any gateway.

**Comment by vgdh** [comment]
> Only "Register rule" will add a gateway, "Pass", as before, is a nat feature which has no knowledge about any gateway.

Thanks for the clarification. However, I did try using 'Add associated filter rule' (Register rule), but the behavior was the same: reply-to did not seem to work and traffic would not return via the correct gateway.

It only works correctly when I create a completely manual rule in Firewall -> Rules. Is there a difference in how reply-to is applied to an 'associated' rule versus a 'manual' rule, especially in a Multi-WAN environment?

**Comment by AdSchellevis** [comment]
> It only works correctly when I create a completely manual rule in Firewall -> Rules. Is there a difference in how reply-to is applied to an 'associated' rule versus a 'manual' rule, especially in a Multi-WAN environment?

On the latest version not really, their generated quite similar when using the exact same characteristics (single interface, no groups)

**Comment by fichtner** [comment]
I double checked when fixing the ports bug in 26.1.5 and the reply to is there. However, the rule is placed at the end of the ruleset. If you have a pass rule WITHOUT reply-to before it probably won’t work.

The ongoing reports here still still lack evidence and reproducibility which point to configuration issues as mentioned a number of times before.


Cheers,
Franco

**Comment by vgdh** [comment]
> On the latest version not really, their generated quite similar when using the exact same characteristics (single interface, no groups)

If I use multiple interfaces in the manual rule or automatic rule, will this rule use **reply-to** or it only work if the rule has one interface?

**Comment by vgdh** [comment]
> I double checked when fixing the ports bug in 26.1.5 and the reply to is there. However, the rule is placed at the end of the ruleset. If you have a pass rule WITHOUT reply-to before it probably won’t work.
> 
> The ongoing reports here still still lack evidence and reproducibility which point to configuration issues as mentioned a number of times before.
> 
> Cheers, Franco

Is this OK if I see this output on the rule, which has **Register rule** enabled?
```
root@OPNsense:~ # pfctl -sn | grep -E "192.168.200.(21)"
rdr pass on pptp0 inet proto tcp from any to any port = 56789 -> 192.168.200.21 port 56789
rdr pass on pptp0 inet proto udp from any to any port = 56789 -> 192.168.200.21 port 56789
```
If I choose the **Pass** mode in the rule, literally nothing changed in this rule on the CLI view.
Looks like it can only create pass mode.

**Comment by fichtner** [comment]
Nope, these are in explicit pass mode, not registered rule. The running configuration may be the old one if the rules are rejected. Check /tmp/rules.debug instead.

Cheers,
Franco

**Comment by vgdh** [comment]
> Nope, these are in explicit pass mode, not registered rule. The running configuration may be the old one if the rules are rejected. Check /tmp/rules.debug instead.
> 
> Cheers, Franco

**Register rule** is configured in this rule
```
root@OPNsense:~ # cat /tmp/rules.debug | grep -E "192.168.200.(21)"
rdr pass on pptp0 inet proto {tcp udp} from {any} to {any} port {56789} -> 192.168.200.21 port 56789 # torrent
pass in quick on vtnet2 route-to { ( pptp0 46.165.0.116 ) } inet from {192.168.200.21/32} to {any} keep state label "b9786e77-ba7a-4b2d-9d05-e9a9c3d45ff9" # torrent
pass in quick on pptp0 reply-to ( pptp0 46.165.0.116 ) inet proto {tcp udp} from {any} to {192.168.200.21} port {56789} label "076c9d778b6d638c2bf96c8a9d7dd84d" # torrent
```

**Comment by vgdh** [comment]
Hi @Oriann 
This looks like an issue in a new rule system.
If you choose **Register rule** in DNAT rule, OPNsense creates an incorrect rule that uses pass mode instead, and as a result, it uses the default gateway to egress for the response.
After I chose manual creation mode in DNAT rules and created these allow rules in the firewall, all issues are gone
Packets are going to the right interface again!
I hope the OPNsense team will fix this bug.

**Comment by Oriann** [comment]
@vgdh thanks for testing. I had an issue that if I even make a manual rule set it still went through higher priority gateway(or default), maybe thats enhanced on latest version. I will test in 1 week now I am overwhelmed with my work.

**Comment by vgdh** [comment]
> [@vgdh](https://github.com/vgdh) thanks for testing. I had an issue that if I even make a manual rule set it still went through higher priority gateway(or default), maybe thats enhanced on latest version. I will test in 1 week now I am overwhelmed with my work.

Make sure that you choose **manual rule** in the DNAT rule

**Comment by Oriann** [comment]
> > [@vgdh](https://github.com/vgdh) thanks for testing. I had an issue that if I even make a manual rule set it still went through higher priority gateway(or default), maybe thats enhanced on latest version. I will test in 1 week now I am overwhelmed with my work.
> 
> Make sure that you choose **manual rule** in the DNAT rule

I did, but still after 10 minutes of testing I came to same bug. Thats why I made this issue here. But i need to test the latest version.

**Comment by Oriann** [comment]
> > [@vgdh](https://github.com/vgdh) thanks for testing. I had an issue that if I even make a manual rule set it still went through higher priority gateway(or default), maybe thats enhanced on latest version. I will test in 1 week now I am overwhelmed with my work.
> 
> Make sure that you choose **manual rule** in the DNAT rule

Ok I am now on it. So nothing is fixed in 26.1.5. I set up rules again also with manual DNAT and rules so we are still at point zero.
I am downloading file from my server from remote location. Service is hosted on WAN2. Server upload to remote PC is running through WAN1 😆 Ridiculous

Reproducible like this:
1. Set up some sort of cloud php service (in my case nextcloud AIO) with reverse proxy on WAN2
2. Set up DNAT (manual rule) and firewall rule for WAN2 and WAN1 (I set up both because I have failover on OPNsense and Cloudflare DNS)
3. Set up PC in remote location
4. Prepare 1GB file on cloud
5. Set up WAN1 as default gateway, WAN2 as secondary (priority WAN1 - 199, WAN2 - 254)
6. Set up traffic shaper on WAN1 and choke it on 1Mbit/s using this - https://docs.opnsense.org/manual/how-tos/shaper_share_evenly.html
7. Share link for 1GB file from cloud to remote PC and start download
8. Now monitor download speed and choke and unchoke the WAN1 upload speed in shaper and see it does not working properly (upload/download traffic flows through WAN1 not WAN2 as expected)
Nslookup from remote PC to my cloud showing WAN2 tho...

Same config and setup work properly on pf

Guys cmon pls I cannot do this again I am not a donkey.... @AdSchellevis @fichtner

**Comment by fichtner** [comment]
Could be https://github.com/opnsense/core/commit/48eeef5b8203410863707e52a328edc31db66e3a but unsure.

**Comment by Oriann** [comment]
> Could be [48eeef5](https://github.com/opnsense/core/commit/48eeef5b8203410863707e52a328edc31db66e3a) but unsure.

Is there a way to apply this right now  so I can test ?

EDIT: nvm I found it, testing now

**Comment by Oriann** [comment]
Nope 

> Could be [48eeef5](https://github.com/opnsense/core/commit/48eeef5b8203410863707e52a328edc31db66e3a) but unsure.

So no that's not it. The symptoms are still the same..

**Comment by vgdh** [comment]
> > > [@vgdh](https://github.com/vgdh) thanks for testing. I had an issue that if I even make a manual rule set it still went through higher priority gateway(or default), maybe thats enhanced on latest version. I will test in 1 week now I am overwhelmed with my work.
> > 
> > 
> > Make sure that you choose **manual rule** in the DNAT rule
> 
> Ok I am now on it. So nothing is fixed in 26.1.5. I set up rules again also with manual DNAT and rules so we are still at point zero. I am downloading file from my server from remote location. Service is hosted on WAN2. Server upload to remote PC is running through WAN1 😆 Ridiculous
> 
> Reproducible like this:
> 
>     1. Set up some sort of cloud php service (in my case nextcloud AIO) with reverse proxy on WAN2
> 
>     2. Set up DNAT (manual rule) and firewall rule for WAN2 and WAN1 (I set up both because I have failover on OPNsense and Cloudflare DNS)
> 
>     3. Set up PC in remote location
> 
>     4. Prepare 1GB file on cloud
> 
>     5. Set up WAN1 as default gateway, WAN2 as secondary (priority WAN1 - 199, WAN2 - 254)
> 
>     6. Set up traffic shaper on WAN1 and choke it on 1Mbit/s using this - https://docs.opnsense.org/manual/how-tos/shaper_share_evenly.html
> 
>     7. Share link for 1GB file from cloud to remote PC and start download
> 
>     8. Now monitor download speed and choke and unchoke the WAN1 upload speed in shaper and see it does not working properly (upload/download traffic flows through WAN1 not WAN2 as expected)
>        Nslookup from remote PC to my cloud showing WAN2 tho...
> 
> 
> Same config and setup work properly on pf
> 
> Guys cmon pls I cannot do this again I am not a donkey.... [@AdSchellevis](https://github.com/AdSchellevis) [@fichtner](https://github.com/fichtner)


I'm not sure. Are you trying to download from the server behind OPNsense, or are you the client behind OPNsense?
If you apply a shaper to your WAN1 and try to use WAN2 (PPTP over your WAN1), I think WAN2 will be choked to the speed of the shaper of WAN1.

**Comment by Oriann** [comment]
> I'm not sure. Are you trying to download from the server behind OPNsense, or are you the client behind OPNsense? If you apply a shaper to your WAN1 and try to use WAN2 (PPTP over your WAN1), I think WAN2 will be choked to the speed of the shaper of WAN1.

@vgdh Does this help ? I am kinda exhausted..

<img width="672" height="676" alt="Image" src="https://github.com/user-attachments/assets/a25ce678-d38a-40d4-b748-8e413300d7fa" />

**Comment by Oriann** [comment]
@vgdh @fichtner is now clear where is the problem or you need more details ?

**Comment by AdSchellevis** [comment]
Although I don't want to discourage people looking at issues, but if the situation is still the same (client 1 expected to contact wan 2, where in reality the initiating traffic is never seen { https://github.com/opnsense/core/issues/9806#issuecomment-3939091407 }), I don't expect a lot of news coming out of this....

**Comment by Oriann** [comment]
Sorry but comment in link is completely wrong. Default gateway can NEVER override reply-to if I am correct. Reply-to must be always treated first. So the correct order for outgoing and incoming traffic is:
1.Router gets connection on WAN1 or WAN2
2.Checks reply-to for this traffic and push traffic to internal client
3.Client respond and send traffic to router
4.Router using reply-to for this state from previous connection, overriding default gateway and choosing the one saved in reply-to

If state/connection does not have reply-to default gateway takes precendece if not overrided by FW rule nad custom settings.

Because if your statement is true how I am supposed to hold default gateway priority and correct routing when connections are going through router randomly.

Manually setting reply to in FW rules also does not work as intended becasue default gateway is again taking precedence so the custom rule is completely useless. This is not how it should work for multiwan environment.

**Comment by AdSchellevis** [comment]
My point merely is that client connecting from outside didn't seem to arrive on the interface where you expected it to be (shows your earlier packet captures). Do with it what you want, but it all starts with traffic arriving at the right spot..

**Comment by Oriann** [comment]
So you still insist that it's my configuration error and my reproduce steps are useless here ?

**Comment by randyb77** [comment]
This is happening to me.  I just upgraded from a commercial firewall to OPNsense 26.1.6 with dual-WAN (Starlink CGNAT + SD Broadband).

Environment:
OPNsense 26.1.6 (amd64)
Advantech 6-NIC appliance (Intel X553 + I210 NICs)
WAN1: Starlink (CGNAT, ix1, 100.64.x.x)
WAN2: SD Broadband (public IP, ix3, 38.x.x.x)

Symptoms:
Policy routing via gateway groups works correctly — pfctl -sr shows proper route-to directives for both WAN interfaces
However pfctl -sr | grep reply-to shows NO reply-to rules for either WAN interface
Only exception is a manually-created WireGuard inbound rule which correctly generates reply-to
Result: asymmetric routing on Starlink WAN — outbound connections go out ix1 correctly but return traffic follows the system default route (ix3), causing TCP connection resets and timeouts
Affected clients cannot reliably browse — pages partially load or timeout
Hosts using the SDB (ix3/default route) WAN work flawlessly

Troubleshooting performed:
Confirmed route-to rules are correct in pf for both legacy and new rules engine
Tried rules in both legacy rules engine and Rules [new] — neither generates reply-to
Tried floating rules with gateway set — no reply-to generated
Tried manual pfctl anchor injection — broke connectivity
MSS clamping set to 1240 on Starlink interface — no improvement
Disabled hardware offloading — no improvement
UDP state timeout tuned — no improvement
Issue persists across reboots and is reproducible consistently

Expected:
pass in on ix1 reply-to (ix1 <gateway_ip>) should be automatically generated for any WAN interface with a gateway defined, matching the behavior of pfSense and pre-26.1 OPNsense.

Workaround:
None found. Currently running all traffic on single WAN (SDB) until this is resolved.

**Comment by Oriann** [comment]
Confirming that 26.1.6 did not bring any fixes about this issue...

**Comment by dwbrott** [comment]
I'm seeing something that very well may be related to this same issue: https://github.com/we-are-mono/opnsense-deps/issues/18
The platform I'm using is brand new, but everything else is working as one would expect.

I'm also using Multi-WAN, with Xfinity (WAN1) and Tmobile Home Internet (WAN2).
By default traffic flows over Xfinity100% of the time unless it fails and then switches to Tmobile.

I have a single client that I force through Tmobile for general testing and it stopped working properly.

**Observed behavior**

From my test client (via Tmobile), simple or very small traffic appears to work (e.g. http://ifconfig.me/), but larger traffic such as http://www.google.com/, returns only partial traffic.  I believe it is related to packet fragmentation.  If the request fits in a single packet and the response is small, it seems to all work, but it doesn't take long for something to not work.

Additionally, if I SSH in and manually set a route to my test URL (ifconfig.me for example), all data is returned.  It very much feels like policy-based routing is not fully working.  It too traced the behavior down a rabbit hole of setting MTUs, etc. but I'm pretty sure this is related to routes not being honored.

The platform that I am using is so new that I only received it in February and it's always been on a 26.1 branch.

I found this via strings in the images I'm using.  Hopefully this helps.  The diff is small and may not be related, but I don't have enough knowledge to know if it's helpful or not.

_Working version_

> src /usr/src 26.1.1_2 5c2ebd3ad stable/26.1

_Failing version_

> src /usr/src 26.1.1 c961e158e stable/26.1

**Comment by Oriann** [comment]
Can somebody elaborate on this ? I have again tested newest update and in firewall state is this completely nonsense.

The state appears to show my WAN2 public IP connecting to my WAN1 public IP, and then being DNATed to the LAN reverse proxy.

This does not look like a normal external inbound connection. It looks like traffic is leaving through WAN2, getting NATed to the WAN2 public IP, then coming back to the WAN1 public IP, where the WAN1 port-forward forwards it back into LAN. This is kinda strange sorcery and may explain why this happens.

<img width="1928" height="147" alt="Image" src="https://github.com/user-attachments/assets/8c30f811-b2e2-4d7b-ac01-f79fa6205861" />

**Comment by Oriann** [comment]
@fichtner pls just direct me what logs you want to give you a hint whats wrong because I have already wasted myself on this. Thanks

**Comment by dwbrott** [comment]
I'll add a little commentary to this that may or may not be helpful.  I'm not currently able to build / re-build to try and narrow this down on my device for a variety of reasons -- most notably it's new hardware in my case and I don't yet have the full build details.  However, I do believe what I am seeing is similar to what @Oriann  is seeing:

The below is me working with ChatGPT to analyze several logs and may be helpful from a traffic flow perspective.
For me, Force_Tmobile is a Firewall rule to force a specific IP to use my 2nd WAN interface by default when the normal default is the primary WAN pathway.  Both WANs are active (so no failover situation), just this forced firewall rule situation.

> In a policy-routed Multi-WAN flow, generated pf rules and NAT rules appear correct. The Force_Tmobile rule creates a route-to state for dtsec2/192.168.12.1, and NAT maps the LAN host to the dtsec2 address.
> 
> For a failing TCP flow, pf state shows ESTABLISHED:ESTABLISHED on both the LAN-side and NAT-side states. The state counters show packets in both directions, including 2 client-to-server packets, consistent with SYN + final ACK. However, packet captures show the final ACK entering on LAN but not leaving either WAN interface. The remote server retransmits SYN-ACK, indicating it never receives the final ACK.
> 
> This suggests the packet is accepted/accounted by pf state but is lost after pf state/NAT processing and before successful egress on dtsec2.

Additionally, even though I have my rules set to "keep state" the logs show the state to be "sloppy" - this may or may not matter but wanted to mention it.

Wish I could provide more, but that's what I have.

**Comment by sopex** [comment]
If you feel a bit adventurous:
opnsense-patch -a sopex 63ddc505272fe92857c25f852bc7a52d22a39554

**Comment by dwbrott** [comment]
> If you feel a bit adventurous: `opnsense-patch -a sopex 63ddc505272fe92857c25f852bc7a52d22a39554`

It's not easy for me to try this as the hardware I'm using is brand new and building isn't easily done.  That being said, I'll try to get to a point i can test it out and provide a response.  The patch is quite limited in scope.

**Comment by Oriann** [comment]
> If you feel a bit adventurous:
> `opnsense-patch -a sopex 63ddc505272fe92857c25f852bc7a52d22a39554`

Is there a way to review this patch before applying ?

**Comment by fichtner** [comment]
@dwbrott that's the weirdest response I've seen in quite a while.. it sounds fake... PHP doesn't compile but you found the reference to the commit that @Oriann did not? hmmm ;)

@Oriann https://github.com/sopex/core/commit/63ddc50527

@sopex if you see my opnsense-patch responses in the forum or github note that I always try to use a link or commit reference to avoid this particular question of what is going to happen on patching

**Comment by Oriann** [comment]
> [@dwbrott](https://github.com/dwbrott) that's the weirdest response I've seen in quite a while.. it sounds fake... PHP doesn't compile but you found the reference to the commit that [@Oriann](https://github.com/Oriann) did not? hmmm ;)
> 
> [@Oriann](https://github.com/Oriann) [sopex@63ddc50527](https://github.com/sopex/core/commit/63ddc50527)
> 
> [@sopex](https://github.com/sopex) if you see my opnsense-patch responses in the forum or github note that I always try to use a link or commit reference to avoid this particular question of what is going to happen on patching

@fichtner @sopex Thanks, will try this on weekend and report if that worked or not. It would be good what sort of debug you need from me so I can prepare for further review.

**Comment by Monviech** [comment]
@sopex 

https://github.com/opnsense/core/blob/3f78821cb0f91eacdfa0531c986b86b1d7780517/src/opnsense/mvc/app/models/OPNsense/Firewall/FieldTypes/FilterRuleField.php#L105

**Comment by sopex** [comment]
@fichtner @Oriann Sorry guys, for the past few weeks github automatically gets the commit hashes and links them to the commit automatically even if they are on a fork. Maybe it hasn't rolled out to everyone yet. My bad.

**Comment by Oriann** [comment]
So I have nuked everything and start again from scratch (26.1.8_5). I did not apply sopex patch just to give it a chance from scratch and it seems that rules are now working as intended. But whats another problem is that shaper not respecting binded interface. Everytime I set it up for WAN1 interface and apply it. Its shaping WAN2 too without any rules explicitly set up on WAN2. Could be another issue ? I have made it as my test tool but it looks like its broken.

**Comment by vgdh** [comment]
> So I have nuked everything and start again from scratch (26.1.8_5). I did not apply sopex patch just to give it a chance from scratch and it seems that rules are now working as intended. But whats another problem is that shaper not respecting binded interface. Everytime I set it up for WAN1 interface and apply it. Its shaping WAN2 too without any rules explicitly set up on WAN2. Could be another issue ? I have made it as my test tool but it looks like its broken.

Does WAN2 use the same physical media as WAN1. (eg WAN2 as PPTP can using WAN1 connection and get all its shapers)

**Comment by Oriann** [comment]
> > So I have nuked everything and start again from scratch (26.1.8_5). I did not apply sopex patch just to give it a chance from scratch and it seems that rules are now working as intended. But whats another problem is that shaper not respecting binded interface. Everytime I set it up for WAN1 interface and apply it. Its shaping WAN2 too without any rules explicitly set up on WAN2. Could be another issue ? I have made it as my test tool but it looks like its broken.
> 
> Does WAN2 use the same physical media as WAN1. (eg WAN2 as PPTP can using WAN1 connection and get all its shapers)

WAN2 is standard WAN DHCP, WAN1 is pppoe1 does it make problems is this config ?

**Comment by vgdh** [comment]
> > > So I have nuked everything and start again from scratch (26.1.8_5). I did not apply sopex patch just to give it a chance from scratch and it seems that rules are now working as intended. But whats another problem is that shaper not respecting binded interface. Everytime I set it up for WAN1 interface and apply it. Its shaping WAN2 too without any rules explicitly set up on WAN2. Could be another issue ? I have made it as my test tool but it looks like its broken.
> > 
> > 
> > Does WAN2 use the same physical media as WAN1. (eg WAN2 as PPTP can using WAN1 connection and get all its shapers)
> 
> WAN2 is standard WAN DHCP, WAN1 is pppoe1 does it make problems is this config ?

Because the actual, physical packets for both connections end up traversing the exact same underlying network interface or driver queue, the shaper on the parent interface catches everything. When WAN1 encapsulates a packet into PPPoE, it hands it down to the physical interface to be sent out (WAN2). The shaper looks at that physical egress and says, "Traffic is leaving this interface, apply the pipes!"—completely ignoring whether it's native DHCP traffic or PPPoE-encapsulated traffic.
But maybe I am wrong. Only devs know for sure )).

**Comment by Oriann** [comment]
> Because the actual, physical packets for both connections end up traversing the exact same underlying network interface or driver queue, the shaper on the parent interface catches everything. When WAN1 encapsulates a packet into PPPoE, it hands it down to the physical interface to be sent out (WAN2). The shaper looks at that physical egress and says, "Traffic is leaving this interface, apply the pipes!"—completely ignoring whether it's native DHCP traffic or PPPoE-encapsulated traffic. But maybe I am wrong. Only devs know for sure )).

Ok but how to fix this or how to make workaround ? I need to have 2 things working on firewall - Shaper/Limiter and Multiwan. Otherwise its useless for me. @fichtner any hints why this does not work in combination PPPOE and DHCP WAN ? Assuming I have nuked everything and started from scratch...

EDIT: Shared forwarding in checked

**Comment by dwbrott** [comment]
Following up on my earlier comments -- for some reason things are working better now.  Stuff that wasn't working is now working, but there is still at least one site that is throwing problems.  I try to connect to https://ifconfig.me and it doesn't complete, but if I do http://ifconfig.me it works.  Basically packets get lost somewhere in the network.  Most (perhaps all) other links are having zero issues now.  The overall problem is not critical to me, just desirable to work correctly.  I can work around my problem if I absolutely must, so I'm going to pause my testing for now.

I did try the sopex patch, but I backed it out.  I don't think that really made a difference either way.

I still think there is something wrong, but I'm not able to pinpoint what the actual problem is and it's very intermittent at this point.  I'll chime in again if it becomes more prominent.

Thanks @fichtner for helping me understand the workings of OPNsense even more since I'm so new to the system.

**Comment by Oriann** [comment]
> > > > So I have nuked everything and start again from scratch (26.1.8_5). I did not apply sopex patch just to give it a chance from scratch and it seems that rules are now working as intended. But whats another problem is that shaper not respecting binded interface. Everytime I set it up for WAN1 interface and apply it. Its shaping WAN2 too without any rules explicitly set up on WAN2. Could be another issue ? I have made it as my test tool but it looks like its broken.
> > > 
> > > 
> > > Does WAN2 use the same physical media as WAN1. (eg WAN2 as PPTP can using WAN1 connection and get all its shapers)
> > 
> > 
> > WAN2 is standard WAN DHCP, WAN1 is pppoe1 does it make problems is this config ?
> 
**Because the actual, physical packets for both connections end up traversing the exact same underlying network interface or driver queue, the shaper on the parent interface catches everything. When WAN1 encapsulates a packet into PPPoE, it hands it down to the physical interface to be sent out (WAN2). The shaper looks at that physical egress and says, "Traffic is leaving this interface, apply the pipes!"—completely ignoring whether it's native DHCP traffic or PPPoE-encapsulated traffic**. But maybe I am wrong. Only devs know for sure )).

@fichtner can you elaborate if this could be problem ? Or should I make a new issue on this ? Thx

**Comment by djordje-acimovic** [comment]
**Confirmed in OPNsense 26.1.9, dual PPPoE WAN (T-Mobile CZ)**

**Setup:**
- pppoe0 = WAN1 (78.80.44.33) — inbound SMTP
- pppoe1 = WAN2 (78.80.44.32) — system default route
- Rule: `pass in on pppoe0 reply-to (pppoe0 62.141.5.8) inet proto tcp from any to any port smtp keep state`

**Symptom:**

tcpdump on **pppoe1** (WAN2): SYN-ACK exits through WAN2 despite `reply-to` specifying WAN1.
tcpdump on **pppoe0** (WAN1): only inbound SYNs visible — no SYN-ACK outbound.

Reverse NAT IS applied correctly (source IP shows WAN1 IP `78.80.44.33`), but interface selection ignores `reply-to` and follows the kernel default route instead.

**Evidence from tcpdump:**
```
# pppoe0 (WAN1) — only inbound SYNs:
13:21:04 IP 77.93.219.240.35369 > 78.80.44.33.25: Flags [S]

# pppoe1 (WAN2) — SYN-ACK exits here instead:
13:25:56 IP 78.80.44.33.25 > 77.93.219.243.52391: Flags [S.]
```

Note: NAT reverse translation is correct (source IP = WAN1), but the egress interface is WAN2.

**Workaround:**
Adding a static default route `0.0.0.0/0 via WAN1_PPPOE` via System → Routes → Configuration forces the correct behavior. When the default route matches the `reply-to` interface, routing works correctly.

**Conclusion:**
`reply-to` is applied for NAT translation but ignored for interface/egress selection. Falls back to kernel default route instead of the interface specified in `reply-to`.

**Comment by AdSchellevis** [comment]
> pppoe0 = WAN1 (78.80.44.33) — inbound SMTP
> pppoe1 = WAN2 (78.80.44.32) — system default route

That specific routing scenario isn't reliably possible as the same gateway exists on two different networks.

**Comment by Oriann** [comment]
> > pppoe0 = WAN1 (78.80.44.33) — inbound SMTP
> > pppoe1 = WAN2 (78.80.44.32) — system default route
> 
> That specific routing scenario isn't reliably possible as the same gateway exists on two different networks.

Thats not true. Its not classic multiwan but reply to MUST always respect inbound and outbound connection for unique WAN IP even they have same gateway on ISP side. And also its not true that this scenario not working realiably. Thats only on firewall if it can handle that and OPNsense **should** because similair firewall solutions do that.

**Comment by djordje-acimovic** [comment]
Thank you for the quick response, AdSchellevis — that clarifies things perfectly.

Once we understood that the scenario is inherently unreliable with two PPPoE interfaces sharing a gateway network, the solution was straightforward: we added a **static default route `0.0.0.0/0` via WAN1** through System → Routes → Configuration. This makes WAN1 the permanent system default gateway, so `reply-to` and the routing table are always consistent.

Result: inbound SMTP on WAN1 works correctly, return traffic (SYN-ACK) exits through the correct interface, and the setup survives reboots and gateway events.

For anyone hitting the same issue with dual PPPoE WAN where inbound NAT is on a different interface than the default route — the fix is simply to make the inbound NAT interface the system default gateway via a static route.

Thanks again for maintaining OPNsense — great project!

**Comment by fichtner** [comment]
Can we stop extrapolating? I'm missing the fact what the gateway IPs for pppoe1 actually are. For pppoe0 it's 62.141.5.8 but for the other? That's what @AdSchellevis was hinting at. It might be a completely different issue from reply-to.

**Comment by djordje-acimovic** [comment]
@fichtner — gateway IPs for our setup (T-Mobile CZ, dual PPPoE):

- pppoe0 (WAN1): `62.141.5.8`
- pppoe1 (WAN2): `62.141.11.116`

The two gateway IPs are **different**, so this is not the "same gateway on two networks" scenario @AdSchellevis described.

Routing table confirming both:
```
default     62.141.5.8    UGS  pppoe0
1.1.1.1     62.141.11.116 UGHS pppoe1
62.141.5.8  link#11       UH   pppoe0
62.141.11.116 link#12     UH   pppoe1
```

So in our case, with distinct gateway IPs on separate PPPoE sessions, `reply-to` still ignored the specified interface and fell back to the kernel default route. The static default route workaround fixed it.

**Comment by fichtner** [comment]
Ok thanks have you enalbed logging on that rule to confirm it's hitting (or checking eval/hit counters with inspect)?

**Comment by fichtner** [comment]
the other question would be if a local proxy is involved for that traffic

**Comment by ramonbouckaert** [comment]
I’ve already discussed this elsewhere: https://github.com/we-are-mono/opnsense-deps/issues/18, but I might be having the same problem. In my case, instead of genuine multi-WAN, I am attempting to using policy routing to send traffic from some hosts over a VPN tunnel, while all other traffic uses the WAN default gateway.

Steps to reproduce:
* Install OPNsense 26.1.9 and configure WAN and LAN as normal
* Follow all the instructions here to implement policy routing through a VPN tunnel: https://docs.opnsense.org/manual/how-tos/wireguard-selective-routing.html
* In Firewall -> Aliases, put one host on the local network against the new `WG_VPN_Hosts` alias - on my network, I have a raspberry pi for testing reachable at `192.168.1.110`, so I put `192.168.1.110` against that alias.
* On that host, send a small request that is unlikely to result in TCP packet fragmentation, such as `curl -4 -v http://ifconfig.me/`. You should observe that the request resolves correctly, and the egress IP returned by ifconfig.me confirms the traffic is routed through the tunnel.
* On the same host, now send a large request that is likely to result in TCP packet fragmentation, such as `curl -4 -v http://www.google.com/`. The request will only resolve partially, eventually a packet is dropped or something and the response will hang.
* In Firewall -> Aliases, remove the host from `WG_VPN_Hosts`.
* Back on the host, confirm that now both `curl -4 -v http://ifconfig.me/` and `curl -4 -v http://www.google.com/` work as expected (with ifconfig.me reporting the non-VPN egress IP).

Observations:
* Simple or very small traffic appears to work (e.g. http://ifconfig.me/), but larger traffic such as http://www.google.com/, returns only partial traffic. HTTPS requests almost always fail.
* If I hardcode the route to the remote host in the FreeBSD shell, or register a static route in the Opnsense UI, the problem goes away. As soon as I remove the manual route and rely on the reply-to feature of policy routing, the failing behavior above returns. This convinces me it is not an MTU problem or similar, but an issue with policy routing specifically.
* Looking at packet captures (/ having AI look at them for me), the problem seems to affect any request that is policy-routed through a non-default gateway, and where a TCP packet for the response is fragmented and split into multiple packets.

Take what I am saying with a pinch of salt, as I am running OPNsense on unusual hardware - the Mono Gateway Development Kit - on a branch of OPNsense modified for that hardware: https://github.com/we-are-mono/opnsense-src. Because of this, I’ve been reticent to raise the issue here. However, it’s possible that the problem is not Mono Gateway specific - especially given the similar experience reported by others in this thread - so I thought my repro steps and observations might be worth sharing.

**Comment by djordje-acimovic** [comment]
@fichtner — here are the findings from logging and rule inspection:

**1. Logging on the rule:**

The filter rule for SMTP has `log` enabled (`pass in log quick on pppoe0 reply-to (pppoe0 62.141.5.8) ... port = smtp`), but it has **never matched a single packet** (`Packets: 0`, `Evaluations: 21,546`).

The reason: there is a NAT rule that fires before it:

```
@16 rdr pass on pppoe0 inet proto tcp from any to (pppoe0) port = smtp -> <ms_exchange> port 25
    Packets: 18570   States: 277
```

The `rdr pass` keyword causes pf to create the state and pass the packet **without evaluating filter rules**. The `reply-to` filter rule is never reached — it is dead code for all inbound NATed traffic.

This means: states created by `rdr pass` have **no `reply-to` binding**, so replies follow the system default route — which was `pppoe1` before our workaround.

**2. No local proxy** is involved. Traffic flows directly: external mail server → pppoe0 → Exchange (192.168.2.7).

**Current state after workaround:**

Static default route `0.0.0.0/0 via WAN1_PPPOE` → `default 62.141.5.8 UGS pppoe0`

SMTP inbound now works because even without `reply-to`, the SYN-ACK follows the default route which is now pppoe0.

**Summary:** `reply-to` in filter rules cannot function for inbound NATed traffic when OPNsense generates `rdr pass` NAT rules — the filter rule is bypassed entirely. The static default route is the only effective workaround in this configuration.

**Comment by AdSchellevis** [comment]
@djordje-acimovic you need to remove the `pass` in the ui as that creates a rule that supersedes the default one (without reply-to set). At some point, our software accidentally enabled that for all, but recent versions have fixed that omission.
