### ISSUE TITLE
Deleayed responses on ICMP6 neighbor solicitation packets

### ISSUE THREAD

**Issue by wergit** [opnsense/core#7795]
After upgrading to 24.7, we experienced hangs (about 10s) in SSH sessions using IPv6.
IPv4 is not affected, so we were able to rule out a general network problem.

I was able to trace the problem to the interface on the WAN side.
A TCP dump showed that the Cisco is sending ICMP6 neighbour solicitations, which are answered by the opnsense with a large delay.
The cisco switch looses it's IPv6 neighbour.

tcpdump -n -i ix0 icmp6 and host fe80::86b8:2ff:fe1a:c67f

07:34:42.764553 IP6 fe80::86b8:2ff:fe1a:c67f > 2001:xxxx:x:x::x:2: ICMP6, neighbor solicitation, who has 2001:xxxx:x:x::x:2, length 32
07:34:43.852542 IP6 fe80::86b8:2ff:fe1a:c67f > 2001:xxxx:x:x::x:2: ICMP6, neighbor solicitation, who has 2001:xxxx:x:x::x:2, length 32
07:34:44.940525 IP6 fe80::86b8:2ff:fe1a:c67f > 2001:xxxx:x:x::x:2: ICMP6, neighbor solicitation, who has 2001:xxxx:x:x::x:2, length 32
07:34:46.094207 IP6 fe80::86b8:2ff:fe1a:c67f > ff02::1:ff56:2: ICMP6, neighbor solicitation, who has 2001:xxxx:x:x::x:2, length 32
07:34:47.120778 IP6 fe80::86b8:2ff:fe1a:c67f > ff02::1:ff56:2: ICMP6, neighbor solicitation, who has 2001:xxxx:x:x::x:2, length 32
07:34:48.201460 IP6 fe80::86b8:2ff:fe1a:c67f > ff02::1:ff56:2: ICMP6, neighbor solicitation, who has 2001:xxxx:x:x::x:2, length 32
07:34:49.336747 IP6 fe80::86b8:2ff:fe1a:c67f > ff02::1:ff56:2: ICMP6, neighbor solicitation, who has 2001:xxxx:x:x::x:2, length 32
07:34:50.360952 IP6 fe80::86b8:2ff:fe1a:c67f > ff02::1:ff56:2: ICMP6, neighbor solicitation, who has 2001:xxxx:x:x::x:2, length 32
07:34:51.385618 IP6 fe80::86b8:2ff:fe1a:c67f > ff02::1:ff56:2: ICMP6, neighbor solicitation, who has 2001:xxxx:x:x::x:2, length 32
07:34:52.436467 IP6 fe80::86b8:2ff:fe1a:c67f > ff02::1:ff56:2: ICMP6, neighbor solicitation, who has 2001:xxxx:x:x::x:2, length 32
07:34:53.529962 IP6 fe80::86b8:2ff:fe1a:c67f > ff02::1:ff56:2: ICMP6, neighbor solicitation, who has 2001:xxxx:x:x::x:2, length 32
07:34:54.617082 IP6 fe80::86b8:2ff:fe1a:c67f > ff02::1:ff56:2: ICMP6, neighbor solicitation, who has 2001:xxxx:x:x::x:2, length 32
07:34:55.717592 IP6 fe80::86b8:2ff:fe1a:c67f > ff02::1:ff56:2: ICMP6, neighbor solicitation, who has 2001:xxxx:x:x::x:2, length 32
07:34:56.765964 IP6 fe80::86b8:2ff:fe1a:c67f > ff02::1:ff56:2: ICMP6, neighbor solicitation, who has 2001:xxxx:x:x::x:2, length 32
07:34:57.796680 IP6 fe80::86b8:2ff:fe1a:c67f > ff02::1:ff56:2: ICMP6, neighbor solicitation, who has 2001:xxxx:x:x::x:2, length 32
07:34:58.888994 IP6 fe80::86b8:2ff:fe1a:c67f > ff02::1:ff56:2: ICMP6, neighbor solicitation, who has 2001:xxxx:x:x::x:2, length 32
07:34:58.889051 IP6 fe80::3eec:efff:fe70:7326 > fe80::86b8:2ff:fe1a:c67f: ICMP6, neighbor advertisement, tgt is 2001:xxxx:x:x::x:2, length 32

2001:xxxx:x:x::x:2 is a CARP IPv6 address of the 2 firewall system, but the problem also exists on the real interface IP of the firewall.

Workaround:
Add: "ipv6 nd nud retry 1 1000 100" to the VLAN interface of the Cisco switch solved the problem for the users.
(nud = Neighbor Unreachability Detection)

OPNsense 24.7.1-amd64
Intel® Xeon™ E3-1225V5 3.3Ghz Quad Core
Network Intel® I210-AT (SFP+)

**Comment by fichtner** [comment]
Same as https://github.com/opnsense/src/issues/216 most likely, see https://forum.opnsense.org/index.php?topic=42270.msg209064#msg209064
