### ISSUE TITLE
Gateway groups and NAT : Incorrect NAT IP used on interface when Shared Forwarding is enabled

### ISSUE THREAD

**Issue by namezero111111** [opnsense/core#2376]
Good morning, I am afraid there may be another issue related to shared forwarding and MultiWAN. The original issue was posted here: https://forum.opnsense.org/index.php?topic=7803.0

Essentially, packets are sent out one interface originating from the IP of another. 

The issue occurs regardless of:
1. Source tracking timeout
2. Firewall tracking normal or conservative
3. Whether the NAT IP is CARP or interface address

The issue does NOT occur if:
1. Shared forwarding is disabled.

**Comment by fichtner** [comment]
no work would be boring :)

let me see how we could debug this further....

**Comment by namezero111111** [comment]
Please don't hate on me for bringing shared forwarding up again :}

This fellow has an issue that could be related, too: https://forum.opnsense.org/index.php?topic=7860

Some notes with less scientific insight that might give some clues:

1. The initial states captured on the wrong source interface (or IP, let's just call them mismatched) appear to always be in the SYN_SENT:CLOSED state (at least when checking the stae table right after the connection appears in the dump)
2. 1) seems to create a new stickiness with the mismatched IP/interface

If I find more relevant, verifiable information I will update again.

**Comment by namezero111111** [comment]
Well hello :}

This probably won't make it to 18.7 eh?

**Comment by fichtner** [comment]
@namezero111111 hello, let's take a stab at this...

Sticky outbound NAT disable "helps" with this --- this is still true? That's a good place to start.

**Comment by fichtner** [comment]
@namezero111111 also, does this happen all the time or do some connections work fine? like 50% ok and %50 not ok?

**Comment by namezero111111** [comment]
Yes, disabling sticky will bypass/"resolve" this. Source tracking timeout seems to have no effect on this *.

The initial connection(s) "work", since data is actually being transferred, and as long as there is an active association (presumably before the last association for the client expires) there is no problem. 
However, after that, new connections stall in this state.
*Source tracking will play a role here because it can delay this issue by keeping the association longer.

I will run some tests tomorrow to see if there is something more deterministic about it.


Should I try with 18.1 or would you prefer the 18.7 dev version?

**Comment by fichtner** [comment]
I can't test this very well but I found a candidate. https://github.com/opnsense/src/commit/6aad8285a4

It unlikely to panic but I also can't vouch for not making it worse that it was.

Can provide this as a test kernel.

**Comment by fichtner** [comment]
Whoopsie, better patch at https://github.com/opnsense/src/commit/ddb08b18

**Comment by namezero111111** [comment]
Absolutely i have a test environment still set up for this!

Sent from Touch. Excuse terseness.

Mit freundlichen Grüßen / With best regards

Andreas Iwanowski - IT Administrator / Software Developer
www.awato.de<http://www.awato.de> | namezero@afim.info
T: +49 2133 26031 55 | F: +49 (0)2133 26031 01
awato Software GmbH | Salm Reifferscheidt Allee 37 | D-41540 Dormagen

avisor-Support | T: +49 (0)621 6094 043 | F: +49 (0)621 6071 447

[awato Software GmbH]
Geschäftsführer: Ursula Iwanowski | HRB: Neuss 7208 | VAT-no.: DE 122796158

________________________________
Od: Franco Fichtner <notifications@github.com>
Wysłano: wtorek, 19 czerwca 2018 21:36
Do: opnsense/core
DW: Andreas M. Iwanowski; Mention
Temat: Re: [opnsense/core] Gateway groups and NAT : Incorrect NAT IP used on interface when Shared Forwarding is enabled (#2376)


I can't test this very well but I found a candidate. opnsense/src@6aad828<https://github.com/opnsense/src/commit/6aad8285a4>

It unlikely to panic but I also can't vouch for not making it worse that it was.

Can provide this as a test kernel.

**Comment by fichtner** [comment]
Perfect, kernel update via:

    # opnsense-update -kr 18.1.9-sticky
    # /usr/local/etc/rc.reboot


Cheers,
Franco

**Comment by namezero111111** [comment]
Juat to update, I somehow couldn't reproduce this today on the same test system. I had this before; I'll keep trying and then try the new kernel


Sent from Touch. Excuse terseness.
________________________________
Od: Franco Fichtner <notifications@github.com>
Wysłano: wtorek, 19 czerwca 2018 21:42
Do: opnsense/core
DW: Andreas M. Iwanowski; Mention
Temat: Re: [opnsense/core] Gateway groups and NAT : Incorrect NAT IP used on interface when Shared Forwarding is enabled (#2376)


Whoopsie, better patch at opnsense/src@ddb08b1<https://github.com/opnsense/src/commit/ddb08b18>

**Comment by namezero111111** [comment]
Franco, I am sorry to report that for the life of me I cannot reproduce this on the original test system I used to report this.
I tried all the original combinations with gateways online and partially offline, etc...

If nothing has changed on the kernel, there must be another variable at play here.

Currently I cannot think of anything else to try.
Can we put this on hold for now until then?

**Comment by namezero111111** [comment]
Fwiw, the patched kernel does no harm in that regard either :/

**Comment by fichtner** [comment]
@namezero111111 do you have any news or should we close this ticket?

**Comment by namezero111111** [comment]
@fichtner 
Hi, unfortunately not been able to reproduce under the previous circumstance. I agree, we should close this.

**Comment by fichtner** [comment]
Ok, you know where to find me. Thanks for all your help! :)

**Comment by Malunke** [comment]
Dear all,
it seems, I have the same issue on opnsense 19.1.6.

Just to make it short - I configured 2 WAN interfaces (VLAN) according to wiki.

I have the same problems as mentioned above and they disappear
- when unplug Gateway 1 (unplug from switch)
or
- when unplug Gateway 2
or
- when disabling sticky connections.

How can I help to analyze the problem and find a patch?

**Comment by mimugmail** [comment]
Disable Force Gateway in Firewall : Settings : Advanced enabled?

Malunke <notifications@github.com> schrieb am So., 28. Apr. 2019, 19:52:

**Comment by Malunke** [comment]
no, it is disabled (standard?)
![ForceGateway](https://user-images.githubusercontent.com/22231986/56868293-b8806300-69f0-11e9-9b94-81ee5b4640ba.PNG)

**Comment by Malunke** [comment]
![ForceGateway](https://user-images.githubusercontent.com/22231986/56868305-d948b880-69f0-11e9-9406-1e1078b9bba6.PNG)

**Comment by mimugmail** [comment]
Please enable and retry

Malunke <notifications@github.com> schrieb am So., 28. Apr. 2019, 20:04:

**Comment by namezero111111** [comment]
Oh joy if this rears it head again.
Are you using shared forwarding?
The packets go out the other gateway using an incorrect NAT IP?
If so, are you able to provide a dump verifying the NAT IP of WAN1 is used sending packages out WAN2 when WAN1 is disabled/disconnected AND shared forwarding is enabled?

**Comment by fichtner** [comment]
In particular, I'd say if disabling shared forwarding fixes it please use this workaround.

In general if such a bug is encountered there's a lot that needs to be reported in order to make any sense of the setup at hand: firewall rules with policy, gateway group settings, IPv4 or IPv6 evaluated separately, switch conditions.

**Comment by fichtner** [comment]
Oh and also aux functionality used that is supposed to be addressed by shared forwarding: captive portal, traffic shaping, transparent web proxy use.

**Comment by Malunke** [comment]
It seems, that disabling shared forwarding won't help.

I try to provide logs as mentioned by namezero.

**Comment by Malunke** [comment]
![A](https://user-images.githubusercontent.com/22231986/56868781-79a1db80-69f7-11e9-8c85-1fe31676c5c4.PNG)
![B](https://user-images.githubusercontent.com/22231986/56868782-79a1db80-69f7-11e9-914d-276a96aef71f.PNG)
![C](https://user-images.githubusercontent.com/22231986/56868783-79a1db80-69f7-11e9-9600-a68cafa92b26.PNG)
![D](https://user-images.githubusercontent.com/22231986/56868784-79a1db80-69f7-11e9-9d10-92075efa0330.PNG)

**Comment by Malunke** [comment]
Gateway 1 is offline because I unplugged it :-)

**Comment by Malunke** [comment]
Yes, I have alse these NAT issues. A packet-log shows for example the following entries on Interface V200:

17:54:24.284702 IP 10.28.253.3.25721 > 54.243.161.26.443: tcp 1
17:54:24.285421 IP 10.4.0.143.2816 > 213.239.241.182.443: tcp 0
17:54:24.285840 IP 10.4.0.143.34473 > 213.239.241.182.443: tcp 0
17:54:24.291151 IP 23.52.60.236.443 > 10.28.253.3.8047: tcp 0

The IP 10.4.0.143 belongs to interface V201 - so it seems it is exactly the same issue as described by nemazero111111

Please fix this issue.

I will assist with troubleshooting, just tell me, what you need.

**Comment by Malunke** [comment]
It seems, disabling shared forwarding will reduce the problem (I could not determine it after short test any more)
But there is also no traffic going out of interface V201.

When disabling sticky connections everything works fine - there is the right traffic leaves the right interface) - but I will get problems with online sessions (after login on websites).

Please help - you can also open a new ticket instead of using this old one
opnsense 19.1.6

**Comment by namezero111111** [comment]
We have **sticky connections **off and **shared forwarding on** (we need it for shaping).

The session-aware problem was solved by redirecting different clients through different gateway groups configured as failover rather than load balancing (Gateways on different tiers). 

Not sure if the problem reappears if sticky connections is enabled again; but I'm sure as hell not gonna find out if it makes this nightmare reappear.

I could not recreate this with an imported config on a test system no matter how I tried to provoke it - it _seemed_ sticky was working then, too - (see_ comment from Aug 9th 2018), so I assumed some unknown circumstance changed.

**Comment by Malunke** [comment]
Thanks for your answer, but I need sticky connections and want to use load balancing.

Question to the fichtner and the other members - do I have to open a separate bug report rahter than following this one to get help and the Bug re-opened again?

Okay - in my case it is Gateway-Group and sticky connection which causes the problem.

**Comment by namezero111111** [comment]
> It seems, that disabling shared forwarding won't help.

If this is true (your post from 2019-04-28) then we had been down the wrong route all along or you're experiencing this under different circumstances. Did you verify this after a reboot? Just in case some stale connections or whatever are hanging around. Sure you can do it on the fly but conditionally disabling and enabling kernel firewall code at runtime raises a flag with me nonetheless.
That said:

Disabling shared forwarding should fix this because it disables the glue code between pf and ipfw.
If what you are saying is true and verified, then this problem does not relate to the shared forwarding code as assumed before.

**Comment by Malunke** [comment]
I checked the last days. I have now enabled sticky connections and disabled shared forwarding. It seems to work.

I set the above settings and rebooted the firewall. I also can confirm the bug exists with sticky connections on and shared forwarding on.

I hope, this issue will be fixed in the next release?

Thanks a lot.
