### ISSUE TITLE
Other devices cannot get IPv6 from IPv6 PD

### ISSUE THREAD

**Issue by RinCat** [opnsense/core#6749]
**Important notices**

Before you add a new report, we ask you kindly to acknowledge the following:

- [x] I have read the contributing guide lines at https://github.com/opnsense/core/blob/master/CONTRIBUTING.md
- [x] I am convinced that my issue is new after having checked both open and closed issues at https://github.com/opnsense/core/issues?q=is%3Aissue

**Describe the bug**

My ISP gives /56 IPv6 PD from DHCPv6, where I successful assign it to the local links using "Track IPv6 on WAN"

WAN:
IPv6 link-local | fe80::X:X:X:4ee4/64
IPv6 address | 2605:59c8:Y:Y:X:X:X:X/64 (not in the same range as prefix)
IPv6 prefix | 2605:59c8:X:0000::/56
IPv6 gateway | auto-detected: fe80::X:X:X:X

LAN:
IPv6 link-local | fe80::X:X:X:bfff/64
IPv6 address | 2605:59c8:X:0002:X:X:X:bfff/64

Hinting is 2

LAN is a VLAN, I also tried put it on a bridge.

However, no device in the network got IPv6. 

I've searched for similar issues, but none that are exactly the same, and their solutions don't work.

I also noticed radvd report `Can't assign requested address`.

**To Reproduce**

N/A

**Expected behavior**

Other device should able to get IPv6 from SLAAC or DHCPv6

**Describe alternatives you considered**

N/A

**Relevant log files**
```
radvd (48175): polling for 0 second(s), next iface is bridge1
radvd (48175): timer_handler called for bridge1
radvd (48175): ioctl(SIOCGIFFLAGS) succeeded on bridge1
radvd (48175): bridge1 is up
radvd (48175): bridge1 is running
radvd (48175): bridge1 supports multicast or is point-to-point
radvd (48175): mtu for bridge1 is 1500
radvd (48175): link layer token length for bridge1 is 48
radvd (48175): prefix length for bridge1 is 64
radvd (48175): checking ipv6 forwarding of interface not supported
radvd (48175): bridge1 linklocal address: fe80::A:B:C:D
radvd (48175): bridge1 address: 2605:59c8:E:F:G:H:I:J
radvd (48175): bridge1 address: fe80::5a9c:K:L:M
radvd (48175): bridge1 is ready
radvd (48175): checking ipv6 forwarding not supported
radvd (48175): sending RA to ff02::1 on bridge1 (fe80::5a9c:K:L:M), 5 options (using 120/1210 bytes)
radvd (48175): sendmsg: Can't assign requested address
radvd (48175): send_ra_forall failed on interface bridge1
radvd (48175): bridge1 next scheduled RA in 370.664 second(s)

```

**Additional context**

**Environment**

OPNsense 23.7.1_3-amd64
FreeBSD 13.2-RELEASE-p2
OpenSSL 1.1.1v  1 Aug 2023
Intel(R) Xeon(R) CPU E3-1225 v5 @ 3.30GHz (4 cores, 4 threads)

**Comment by fichtner** [comment]
It's pretty difficult to give advice here... what clients are attached and if IPv4 works... in general IPv6 link-local ping should just work between devices. If not you need to see where these are being dropped.


Cheers,
Franco

**Comment by RinCat** [comment]
It connected to a 10G switch with different VLANs. All IPv4 works without any issue. I just tested IPv6 link-local and it seems not working, `Destination unreachable: Address unreachable`

**Comment by fichtner** [comment]
This sounds like a packet capture task to see where IPv6 packets are dropped/filtered.

**Comment by RinCat** [comment]
```
15:45:22.135266 IP6 fe80::48d4:6dff:fee5:d2f6 > ff02::16: HBH ICMP6, multicast listener report v2, 1 group record(s), length 28
15:45:22.135397 IP6 fe80::48d4:6dff:fee5:d2f6 > ff02::2: ICMP6, router solicitation, length 16
15:45:22.318213 IP6 fe80::48d4:6dff:fee5:d2f6 > ff02::16: HBH ICMP6, multicast listener report v2, 1 group record(s), length 28
15:45:26.133104 IP6 fe80::48d4:6dff:fee5:d2f6 > ff02::2: ICMP6, router solicitation, length 16
15:45:34.094232 IP6 fe80::48d4:6dff:fee5:d2f6 > ff02::2: ICMP6, router solicitation, length 16
```
```
radvd (56723): bridge1 recvmsg len=16
radvd (56723): bridge1 received a packet
radvd (56723): bridge1 received RS from: fe80::48d4:6dff:fee5:d2f6
radvd (56723): ioctl(SIOCGIFFLAGS) succeeded on bridge1
radvd (56723): bridge1 is up
radvd (56723): bridge1 is running
radvd (56723): bridge1 supports multicast or is point-to-point
radvd (56723): mtu for bridge1 is 1500
radvd (56723): link layer token length for bridge1 is 48
radvd (56723): prefix length for bridge1 is 64
radvd (56723): checking ipv6 forwarding of interface not supported
radvd (56723): bridge1 linklocal address: fe80::5a9c:fcff:fe00:692b
radvd (56723): bridge1 address: 2605:59c8:A:B:C:D:E:F
radvd (56723): bridge1 address: fe80::5a9c:fcff:fe00:692b
radvd (56723): bridge1 is ready
radvd (56723): checking ipv6 forwarding not supported
radvd (56723): sending RA to fe80::48d4:6dff:fee5:d2f6 on bridge1 (fe80::5a9c:fcff:fe00:692b), 3 options (using 64/1210 bytes)
radvd (56723): sendmsg: Can't assign requested address
radvd (56723): bridge1 processed an RS

```

OPNsense received the RS just fine, but radvd failed to send RA somehow.

**Comment by fichtner** [comment]
Since jamming LAN on a bridge (mostly discouraged) seems to be a recurring theme here have you made sure to set "Enable link-local address" for it? It looks like a configuration issue to be honest:

> sendmsg: Can't assign requested address

**Comment by RinCat** [comment]
I did enabled `Enable link-local address` in the bridge. But do I need to do anything on the VLAN?

```
bridge1: flags=8843<UP,BROADCAST,RUNNING,SIMPLEX,MULTICAST> metric 0 mtu 1500
        description: Guest (opt7)
        ether 58:9c:fc:X:X:X
        inet 10.1.X.1 netmask 0xffffff00 broadcast 10.1.50.255
        inet6 fe80::5a9c:fcff:fe00:692b%bridge1 prefixlen 64 tentative scopeid 0x13
        inet6 2605:59c8:A:B:C:D:E:F prefixlen 64 tentative
        id 00:00:00:00:00:00 priority 32768 hellotime 2 fwddelay 15
        maxage 20 holdcnt 6 proto rstp maxaddr 2000 timeout 1200
        root id 00:00:00:00:00:00 priority 32768 ifcost 0 port 0
        member: mce1_vlan10 flags=143<LEARNING,DISCOVER,AUTOEDGE,AUTOPTP>
                ifmaxaddr 0 port 13 priority 128 path cost 2000
        groups: bridge
        nd6 options=21<PERFORMNUD,AUTO_LINKLOCAL>
```

**Comment by fichtner** [comment]
Does this resulting line ever go away?

    # ifconfig bridge1 | grep tentative

If it sticks there is your issue: a tentative address cannot be used. DAD fails to execute for one reason or another.

**Comment by RinCat** [comment]
I mean it is already enabled when I post above logs.

I just rebooted it, and looks same:
```
# ifconfig bridge1 | grep tentative
```
```
        inet6 fe80::5a9c:fcff:fe00:692b%bridge1 prefixlen 64 tentative scopeid 0x13
        inet6 2605:59c8:A:B:C:D:E:F prefixlen 64 tentative
```

But thanks point out tentative and DAD, I will check that.

**Comment by fichtner** [comment]
If tentative sticks there is something very nasty going on. Perhaps the same address(es) already exist in the network or DAD is being blocked. The DAD timer is just 1 second and then "tentative" disappears...

**Comment by RinCat** [comment]
```
        inet6 fe80::1%lo0 prefixlen 64 scopeid 0x7
        inet6 fe80::5a9c:fcff:fe00:692b%bridge1 prefixlen 64 tentative scopeid 0x13
        inet6 fe80::5a9c:fcff:fe10:ffaa%bridge2 prefixlen 64 tentative scopeid 0x14
        inet6 fe80::5a9c:fcff:fe00:602a%bridge0 prefixlen 64 tentative scopeid 0x16
        inet6 fe80::5a9c:fcff:fe10:fff1%bridge5 prefixlen 64 tentative scopeid 0x17
        inet6 fe80::5a9c:fcff:fe10:ff9a%bridge6 prefixlen 64 tentative scopeid 0x18
```
There are not the same address, and I set firewall to allow IPv6 ANY * to *.
All bridge IPv6 are in the tentative state. Except WAN, and its IPv6 works fine.

```
root@OPNsense:~ # ping -I igb0 ipv6.google.com
PING6(56=40+8+8 bytes) 2605:59c8:A:B:C:D:E:F --> 2607:f8b0:4006:817::200e
16 bytes from 2607:f8b0:4006:817::200e, icmp_seq=0 hlim=118 time=70.559 ms
16 bytes from 2607:f8b0:4006:817::200e, icmp_seq=1 hlim=118 time=93.949 ms
16 bytes from 2607:f8b0:4006:817::200e, icmp_seq=2 hlim=118 time=41.312 ms
16 bytes from 2607:f8b0:4006:817::200e, icmp_seq=3 hlim=118 time=65.770 ms
16 bytes from 2607:f8b0:4006:817::200e, icmp_seq=4 hlim=118 time=94.663 ms
16 bytes from 2607:f8b0:4006:817::200e, icmp_seq=5 hlim=118 time=71.950 ms
^C
--- ipv6.l.google.com ping6 statistics ---
6 packets transmitted, 6 packets received, 0.0% packet loss
```

**Comment by RinCat** [comment]
OK I found something in logs:
 `a looped back NS message is detected during DAD for fe80:XXXXX.  Another DAD probes are being sent.`

https://bugs.freebsd.org/bugzilla/show_bug.cgi?id=270859

Looks like Mellanox driver bug...

**Comment by RinCat** [comment]
After set `net.inet6.ip6.dad_count=0`, all IPv6 start working.

**Comment by fichtner** [comment]
Ok I subscribed to that bug report and will add the kernel patch when  it comes available.
