### ISSUE TITLE
dnsmasq custom conf file

### ISSUE THREAD

**Issue by lokomass** [opnsense/core#9129]
**Important notices**

Before you add a new report, we ask you kindly to acknowledge the following:

- [x] I have read the contributing guide lines at https://github.com/opnsense/core/blob/master/CONTRIBUTING.md
- [x] I am convinced that my issue is new after having checked both open and closed issues at https://github.com/opnsense/core/issues?q=is%3Aissue

**Describe the bug**

Hi,
Refer to the documentation, I can add some configuration in `/usr/local/etc/dnsmasq.d/custom.conf` to add custom config : `https://docs.opnsense.org/manual/dnsmasq.html#advanced-settings`
It seems to don't work as excepted....
I just want push a config file into the folder and restart dnsmasq to enjoy (no use gui).

*Tip*: to validate your setup was working with the previous version, use opnsense-revert (https://docs.opnsense.org/manual/opnsense_tools.html#opnsense-revert)

**To Reproduce**

I'm trying to push this working configuration (validated with dnsmasq on debian 13) : 

```
dhcp-mac=set:vm,BC:24:11:*:*:*
dhcp-mac=set:vm,08:00:27:*:*:*

dhcp-range=set:dhcp,192.168.10.1,192.168.10.9
dhcp-range=tag:vm,192.168.10.10,192.168.10.20

dhcp-option=tag:vm,6,1.1.1.1,192.168.10.254
dhcp-option=tag:dhcp,6,192.168.10.240,192.168.10.254

dhcp-host=08:00:27:b5:ab:38,set:dhcp,192.168.10.111,infinite
```

**Expected behavior**

For example, all mac clients started with BC:24:11 could be tagged with vm, and be in the vm's pool (10-20)

**Describe alternatives you considered**

I have tried with official package dnsmasq on debian, and this worked

**Screenshots**

If I start dnsmasq, no error, only ranges are visibles, and no tags
But none of my clients receive an ip.

**Relevant log files**

```
root@OPNsense:/var/log # service dnsmasq restart
Performing sanity check on dnsmasq configuration.
dnsmasq: syntax check OK.
Performing sanity check on dnsmasq configuration.
dnsmasq: syntax check OK.
Stopping dnsmasq.
Waiting for PIDS: 60814.
Starting dnsmasq.
```

```
<30>1 2025-08-24T18:23:09+02:00 OPNsense.home dnsmasq 60814 - [meta sequenceId="6"] exiting on receipt of SIGTERM
<30>1 2025-08-24T18:23:09+02:00 OPNsense.home dnsmasq 72823 - [meta sequenceId="7"] started, version 2.91 DNS disabled
<30>1 2025-08-24T18:23:09+02:00 OPNsense.home dnsmasq 72823 - [meta sequenceId="8"] compile time options: IPv6 GNU-getopt no-DBus no-UBus no-i18n no-IDN DHCP DHCPv6 no-Lua TFTP no-conntrack ipset no-nftset auth DNSSEC loop-detect no-inotify dumpfile
<30>1 2025-08-24T18:23:09+02:00 OPNsense.home dnsmasq-dhcp 72823 - [meta sequenceId="9"] DHCP, IP range 192.168.10.10 -- 192.168.10.20, lease time 1h
<30>1 2025-08-24T18:23:09+02:00 OPNsense.home dnsmasq-dhcp 72823 - [meta sequenceId="10"] DHCP, IP range 192.168.10.1 -- 192.168.10.9, lease time 1h

```

**Additional context**

I have spend hours to understand why this doesn't work... the only thing I see, It's not the same dsnmasq than debian package, and can't be used like I want...

**Environment**

Software version used and hardware type if relevant, e.g.:

```
root@OPNsense:/var/log # opnsense-version
OPNsense 25.7 (amd64)
```

**Comment by Monviech** [comment]
Can you do a simple sanity check if the import works in general?

```
host-record=laptop,192.168.1.1
```

Then restart dnsmasq, use nslookup or dig to ask dnsmasq for "laptop". If it returns nothing then this means the file is not loaded.

**Comment by lokomass** [comment]
Here is my custom.conf file : 

```
root@OPNsense:/usr/local/etc/dnsmasq.conf.d # cat custom.conf
host-record=laptop,192.168.10.1

```

I have created a range with gui to get an ip and check it. Reload dnsmasq.
Once ip received, I do : 

<img width="386" height="217" alt="Image" src="https://github.com/user-attachments/assets/be1c4e0e-ddae-46ff-bdeb-d5335a7e9bd0" />

I think file is not loaded ? But, I can see ranges in log file in my first message...

**Comment by Monviech** [comment]
I cannot reproduce, file gets loaded:

```
root@opn-dev-02:/usr/local/etc/dnsmasq.conf.d # cat test.conf 
host-record=laptop,192.168.10.1
```
```
root@opn-dev-02:/usr/local/etc/dnsmasq.conf.d # sockstat -l | grep -i dnsmasq
nobody   dnsmasq    30269 4   udp4   *:67                  *:*
nobody   dnsmasq    30269 8   udp4   *:53                  *:*
nobody   dnsmasq    30269 9   tcp4   *:53                  *:*
nobody   dnsmasq    30269 10  udp6   *:53                  *:*
nobody   dnsmasq    30269 11  tcp6   *:53                  *:*
```
```
root@opn-dev-02:/usr/local/etc/dnsmasq.conf.d # dig @127.0.0.1 laptop

; <<>> DiG 9.20.11 <<>> @127.0.0.1 laptop
; (1 server found)
;; global options: +cmd
;; Got answer:
;; ->>HEADER<<- opcode: QUERY, status: NOERROR, id: 55633
;; flags: qr aa rd ra; QUERY: 1, ANSWER: 1, AUTHORITY: 0, ADDITIONAL: 1

;; OPT PSEUDOSECTION:
; EDNS: version: 0, flags:; udp: 1232
;; QUESTION SECTION:
;laptop.				IN	A

;; ANSWER SECTION:
laptop.			1	IN	A	192.168.10.1

;; Query time: 0 msec
;; SERVER: 127.0.0.1#53(127.0.0.1) (UDP)
;; WHEN: Tue Aug 26 10:31:17 CEST 2025
;; MSG SIZE  rcvd: 51
```

**Comment by lokomass** [comment]
I think it's because I haven't any 53 port opened...

```
root@OPNsense:/usr/local/etc/dnsmasq.conf.d # sockstat -l | grep -i dnsmasq
nobody   dnsmasq     3242 4   udp4   *:67                  *:*
```

But for dnsmasq options it's not required ?

**Comment by Monviech** [comment]
Just for the dhcp features its indeed not required, this is just a test case to see if the file gets imported and the configuration works.

If it does, you have a different issue, e.g. missing DHCP firewall rules.

**Comment by lokomass** [comment]
If I just put into custom.conf a range, this is not work (I can't get an ip from opnsense), but in started log, I can see declared range...

```
root@OPNsense:/usr/local/etc/dnsmasq.conf.d # cat custom.conf
dhcp-range=192.168.10.100,192.168.10.120
root@OPNsense:/usr/local/etc/dnsmasq.conf.d # service dnsmasq restart
Performing sanity check on dnsmasq configuration.
dnsmasq: syntax check OK.
Performing sanity check on dnsmasq configuration.
dnsmasq: syntax check OK.
Stopping dnsmasq.
Waiting for PIDS: 44871.
Starting dnsmasq.
root@OPNsense:/usr/local/etc/dnsmasq.conf.d # tail -n 4 /var/log/dnsmasq/latest.log
<30>1 2025-08-26T11:29:12+02:00 OPNsense.home dnsmasq 44871 - [meta sequenceId="5"] exiting on receipt of SIGTERM
<30>1 2025-08-26T11:29:12+02:00 OPNsense.home dnsmasq 72309 - [meta sequenceId="6"] started, version 2.91 DNS disabled
<30>1 2025-08-26T11:29:12+02:00 OPNsense.home dnsmasq 72309 - [meta sequenceId="7"] compile time options: IPv6 GNU-getopt no-DBus no-UBus no-i18n no-IDN DHCP DHCPv6 no-Lua TFTP no-conntrack ipset no-nftset auth DNSSEC loop-detect no-inotify dumpfile
<30>1 2025-08-26T11:29:12+02:00 OPNsense.home dnsmasq-dhcp 72309 - [meta sequenceId="8"] DHCP, IP range 192.168.10.100 -- 192.168.10.120, lease time 1h
root@OPNsense:/usr/local/etc/dnsmasq.conf.d #
```

Trying to get an ip from client : 

<img width="520" height="318" alt="Image" src="https://github.com/user-attachments/assets/1052df1e-c7b6-4f8d-befa-4351caef2eb4" />

```
root@OPNsense:/usr/local/etc/dnsmasq.conf.d # tcpdump -i em2 port 67 or port 68 -n
tcpdump: verbose output suppressed, use -v[v]... for full protocol decode
listening on em2, link-type EN10MB (Ethernet), snapshot length 262144 bytes
11:31:01.642745 IP 0.0.0.0.68 > 255.255.255.255.67: BOOTP/DHCP, Request from 08:00:27:b5:ab:38, length 300
11:31:05.098937 IP 0.0.0.0.68 > 255.255.255.255.67: BOOTP/DHCP, Request from 08:00:27:b5:ab:38, length 300
11:31:13.366049 IP 0.0.0.0.68 > 255.255.255.255.67: BOOTP/DHCP, Request from 08:00:27:b5:ab:38, length 300

```

**Comment by Monviech** [comment]
If you want to fully manage the dnsmasq configuration manually, you must also take care of the firewalling to be correct.

Select the Interfaces you want to use for DHCP in the Dnsmasq general settings and apply once, it will auto create the firewall rules.

If you dont want that, set them manually.

**Comment by lokomass** [comment]
I'm sorry for my English, I'm a opnsense noob :)

That I want, is completly manage dnsmasq in a custom config file (no via gui) with dhcp-mac, dhcp-option, dhcp-range etc... like I could be done with dnsmasq on a debian server : 

```
dhcp-mac=set:vm,BC:24:11:*:*:*
dhcp-mac=set:vm,08:00:27:*:*:*

dhcp-range=set:dhcp,192.168.10.1,192.168.10.9
dhcp-range=tag:vm,192.168.10.10,192.168.10.20

dhcp-option=tag:vm,6,1.1.1.1,192.168.10.254
dhcp-option=tag:dhcp,6,192.168.10.240,192.168.10.254

dhcp-host=08:00:27:b5:ab:38,set:dhcp,192.168.10.111,infinite
```


I have already enable "Dnsmasq DNS & DHCP" in services via gui, on LAN interface.

Here is my /usr/local/etc/dnsmasq.conf file : 

```
root@OPNsense:/usr/local/etc/dnsmasq.conf.d # cat ../dnsmasq.conf
# DO NOT EDIT THIS FILE -- OPNsense auto-generated file
#

rebind-localhost-ok
stop-dns-rebind

port=0

# If you want dnsmasq to listen for DHCP and DNS requests only on
# specified interfaces (and the loopback) give the name of the
# interface (eg eth0) here.
# Repeat the line for more than one interface.
interface=em2


dhcp-fqdn
domain=home

dhcp-authoritative


# If you don't want dnsmasq to read /etc/hosts, uncomment the
# following line.
no-hosts

# host entries flushed via dnsmasq_watcher.py [isc] and a dump of the static reservations
addn-hosts=/var/etc/dnsmasq-hosts
addn-hosts=/var/etc/dnsmasq-leases

dns-forward-max=5000
cache-size=10000
local-ttl=1

conf-dir=/usr/local/etc/dnsmasq.conf.d,*.conf


# default dns mapped to this server (0.0.0.0)
dhcp-option=6,0.0.0.0


no-ident

```

How can I do what I want please ? Thanks again

**Comment by lokomass** [comment]
Please, I'm going to migrate my old router ER605 to OPNsense, it's last blocking point for me...

**Comment by Monviech** [comment]
Maybe try to use the dnsmaqs GUI then, there the scope is clear if something does not work.

**Comment by lokomass** [comment]
But, what I trying to do is possible ? Add dhcp-mac for example, to set a range only for client which mac adress started with BC:24:11 ? In /usr/local/etc/dnsmasq.conf.d folder ?
Or I'm trying to do an impossible things ?

**Comment by Monviech** [comment]
We have established that files are indeed loaded from the conf folder. What you do in there is your responsibility.

**Comment by lokomass** [comment]
I find it quite unfortunate not to receive more support on this matter. Instead of purchasing dedicated hardware and migrating to OPNsense, I’ve decided to abandon the idea and move on to something else. At the very least, the documentation should be updated, as it is not accurate — none of the directives I added to this file work. Alternatively, it should be clearly stated that it is not compatible with a real Dnsmasq configuration file. This would help prevent others from wasting their time as well.

**Comment by AdSchellevis** [comment]
let's close the issue in that case, nothing to do here. Which options you can or can't import using dnsmasq's `conf-dir` directory you have to figure out from the upstream documentation, the options we offer are quite thoroughly documented on our end. 

Community support has it's limits for obvious reasons.
