### ISSUE TITLE
Feature request: Configurable Interval for IPv6 Router Advertisements (per interface)

### ISSUE THREAD

**Issue by module0x90** [opnsense/core#945]
Hi,

is there a way of configuring the interval for multicast IPv6 RAs? I cannot find this in the web UI anywhere, I suspect it should be under DHCPv6 server/Router Advertisment. Is that right?

It seems that the time for multicast IPv6 RAs is fixed according to its config in /var/etc/radvd.conf:

	MinRtrAdvInterval 5;
	MaxRtrAdvInterval 20;

I get the same settings for all IPv6 enabled interfaces. When I do a "tcpdump -i $IF -nn host ff02::1" I get

13:09:32.141034 IP6 $IPV6ADDR > ff02::1: ICMP6, router advertisement, length 136
13:09:42.523147 IP6 $IPV6ADDR > ff02::1: ICMP6, router advertisement, length 136
13:09:56.983100 IP6 $IPV6ADDR > ff02::1: ICMP6, router advertisement, length 136
13:10:05.406065 IP6 $IPV6ADDR > ff02::1: ICMP6, router advertisement, length 136
13:10:15.265488 IP6 $IPV6ADDR > ff02::1: ICMP6, router advertisement, length 136
13:10:28.812057 IP6 $IPV6ADDR > ff02::1: ICMP6, router advertisement, length 136
13:10:45.395065 IP6 $IPV6ADDR > ff02::1: ICMP6, router advertisement, length 136
13:10:58.207042 IP6 $IPV6ADDR > ff02::1: ICMP6, router advertisement, length 136
13:11:03.576067 IP6 $IPV6ADDR > ff02::1: ICMP6, router advertisement, length 136

which is about between 6 and 20 seconds difference on each RA.
The reason I would like to configure this is because of 

https://www.rfc-editor.org/rfc/rfc7772.txt
and
http://news.softpedia.com/news/ietf-s-tips-for-network-admins-on-how-to-avoid-draining-smartphone-batteries-500480.shtml

ie, this default short RA interval could cause problems on large networks, ie. that it could drain the batteries unnecessary. They recommend maximum 7 multicast RAs per hour, whereas I have 7 already in about 1 minute.

Cheers

Tom

**Comment by fichtner** [comment]
Hi Tom,

I remember we talked about this in the forum...

https://forum.opnsense.org/index.php?topic=2206

I'd like to make the defaults better before we make them configurable. The suggestion back then was 225 and 300. Still a little too high?


Cheers,
Franco

**Comment by module0x90** [comment]
Considering the recommendation in RFC 7772 that's too low still.
That would give me at least 12 RAs per hour. But this would still be better than
the current 'default'.

In my case (static IPv6 network), ~10+ battery driven devices, I would even go for lesser
RAs than 7 RAs/h, technically I could actually switch it off, as my topology never changes anyway.

--
www​.​preissler​.​co​.​uk | Twitter: @module0x90

May 17 2016 2:22 PM, "Franco Fichtner"  wrote:
	Hi Tom,

	I remember we talked about this in the forum...

	https://forum.opnsense.org/index.php?topic=2206 (https://forum.opnsense.org/index.php?topic=2206)

	I'd like to make the defaults better before we make them configurable. The suggestion back then was 225 and 300. Still a little too high?

	Cheers,
Franco

**Comment by fichtner** [comment]
Values are now 200, 600 as described in the manual. One can now also completely disable advertisement sending and solicitation responding.

**Comment by fichtner** [comment]
PS: Yes, defaults are that but you can tweak both values per interface. :)

**Comment by fichtner** [comment]
This will ship in 16.1.17 today.

**Comment by module0x90** [comment]
Just saw this ... awesome, many thanks.
