### ISSUE TITLE
Blocking return FTP ports

### ISSUE THREAD

**Issue by matiasduartee** [opnsense/core#7331]
**Important notices**

Our forum is located at https://forum.opnsense.org , please consider joining discussions there in stead of using GitHub for these matters.

Before you ask a new question, we ask you kindly to acknowledge the following:

- [x] I have read the contributing guide lines at https://github.com/opnsense/core/blob/master/CONTRIBUTING.md
- [x] I am convinced that my issue is new after having checked both open and closed issues at https://github.com/opnsense/core/issues?q=is%3Aissue

Hello, is there a way to clear all the rules that come by default in OPNSense?

**Comment by AdSchellevis** [comment]
Some you can disable, but not all. Adding toggles to disable specific (quick) rules might be discussable if there's a good reason to do so. non-quick rules can always be overwritten, which makes it less relevant to disable those. 

Just disabling all automatic rules is not something we're considering to prevent a flood of support cases.

**Comment by matiasduartee** [comment]
@AdSchellevis 

So, the problem is the following, when a certain program "X" does not work through OPNSense, and when taking the computer off the OPNSense firewall network and connecting it directly to the internet, program X works correctly.

Detail that OPNSense has no problem rules, it is by default after installation, the only rule that has been added is to release all WAN traffic.

It seems to me that program "X" uses FTP to attach payment receipts to the system, because when monitoring the firewall it shows an FTP connection with a certain IP, and when trying to open the payment receipt it arrives corrupted.

**Comment by matiasduartee** [comment]
@AdSchellevis Monitoring through tcpdump, identify these issues when trying to attach the PDF file for upload to program "X".

Could anyone tell me how I can accept these returns from random FTP ports, could it be something in NAT?

root@OPNsense:~ # tcpdump -penti hn1 host 192.168.1.100

tcpdump: verbose output suppressed, use -v or -vv for full protocol decode
listening on hn1, link-type EN10MB (Ethernet), capture size 262144 bytes
00:24:54:4a:91:5f > 00:15:5d:5d:92:01, ethertype IPv4 (0x0800), length 66: 192.168.1.100.57465 > 18.230.135.171.21: Flags [S], seq 864932946, win 65535, options [mss 1460,nop,wscale 8,nop,nop,sackOK], length 0
00:15:5d:5d:92:01 > 00:24:54:4a:91:5f, ethertype IPv4 (0x0800), length 66: 18.230.135.171.21 > 192.168.1.100.57465: Flags [S.], seq 270126894, ack 864932947, win 62727, options [mss 1412,nop,nop,sackOK,nop,wscale 7], length 0
00:24:54:4a:91:5f > 00:15:5d:5d:92:01, ethertype IPv4 (0x0800), length 60: 192.168.1.100.57465 > 18.230.135.171.21: Flags [.], ack 1, win 1024, length 0
00:15:5d:5d:92:01 > 00:24:54:4a:91:5f, ethertype IPv4 (0x0800), length 122: 18.230.135.171.21 > 192.168.1.100.57465: Flags [P.], seq 1:69, ack 1, win 491, length 68: FTP: 220 ProFTPD Server (ProFTPD Default Installation) [18.230.135.171]
00:24:54:4a:91:5f > 00:15:5d:5d:92:01, ethertype IPv4 (0x0800), length 60: 192.168.1.100.57465 > 18.230.135.171.21: Flags [.], ack 69, win 1023, length 0
00:24:54:4a:91:5f > 00:15:5d:5d:92:01, ethertype IPv4 (0x0800), length 102: 192.168.1.100.57465 > 18.230.135.171.21: Flags [P.], seq 1:49, ack 69, win 1023, length 48: FTP: USER confiancacriador@confiancacriador
00:15:5d:5d:92:01 > 00:24:54:4a:91:5f, ethertype IPv4 (0x0800), length 54: 18.230.135.171.21 > 192.168.1.100.57465: Flags [.], ack 49, win 491, length 0
00:15:5d:5d:92:01 > 00:24:54:4a:91:5f, ethertype IPv4 (0x0800), length 123: 18.230.135.171.21 > 192.168.1.100.57465: Flags [P.], seq 69:138, ack 49, win 491, length 69: FTP: 331 Password required for confiancacriador@confiancacriador
00:24:54:4a:91:5f > 00:15:5d:5d:92:01, ethertype IPv4 (0x0800), length 60: 192.168.1.100.57465 > 18.230.135.171.21: Flags [.], ack 138, win 1023, length 0
00:24:54:4a:91:5f > 00:15:5d:5d:92:01, ethertype IPv4 (0x0800), length 73: 192.168.1.100.57465 > 18.230.135.171.21: Flags [P.], seq 49:68, ack 138, win 1023, length 19: FTP: PASS Sih78Khslag
00:15:5d:5d:92:01 > 00:24:54:4a:91:5f, ethertype IPv4 (0x0800), length 116: 18.230.135.171.21 > 192.168.1.100.57465: Flags [P.], seq 138:200, ack 68, win 491, length 62: FTP: 230 User confiancacriador@confiancacriador logged in
00:24:54:4a:91:5f > 00:15:5d:5d:92:01, ethertype IPv4 (0x0800), length 60: 192.168.1.100.57465 > 18.230.135.171.21: Flags [.], ack 200, win 1023, length 0
00:24:54:4a:91:5f > 00:15:5d:5d:92:01, ethertype IPv4 (0x0800), length 62: 192.168.1.100.57465 > 18.230.135.171.21: Flags [P.], seq 68:76, ack 200, win 1023, length 8: FTP: TYPE I
00:15:5d:5d:92:01 > 00:24:54:4a:91:5f, ethertype IPv4 (0x0800), length 73: 18.230.135.171.21 > 192.168.1.100.57465: Flags [P.], seq 200:219, ack 76, win 491, length 19: FTP: 200 Type set to I
00:24:54:4a:91:5f > 00:15:5d:5d:92:01, ethertype IPv4 (0x0800), length 60: 192.168.1.100.57465 > 18.230.135.171.21: Flags [.], ack 219, win 1023, length 0
00:24:54:4a:91:5f > 00:15:5d:5d:92:01, ethertype IPv4 (0x0800), length 82: 192.168.1.100.57465 > 18.230.135.171.21: Flags [P.], seq 76:104, ack 219, win 1023, length 28: FTP: PORT 192,168,1,100,224,122
00:15:5d:5d:92:01 > 00:24:54:4a:91:5f, ethertype IPv4 (0x0800), length 83: 18.230.135.171.21 > 192.168.1.100.57465: Flags [P.], seq 219:248, ack 104, win 491, length 29: FTP: 200 PORT command successful
00:24:54:4a:91:5f > 00:15:5d:5d:92:01, ethertype IPv4 (0x0800), length 60: 192.168.1.100.57465 > 18.230.135.171.21: Flags [.], ack 248, win 1023, length 0
00:24:54:4a:91:5f > 00:15:5d:5d:92:01, ethertype IPv4 (0x0800), length 144: 192.168.1.100.57465 > 18.230.135.171.21: Flags [P.], seq 104:194, ack 248, win 1023, length 90: FTP: STOR /arquivos/documentos_financeiros/doc_19277_adalberto_lopes_pereira_-_copia_0580.pdf
00:15:5d:5d:92:01 > 00:24:54:4a:91:5f, ethertype IPv4 (0x0800), length 54: 18.230.135.171.21 > 192.168.1.100.57465: Flags [.], ack 194, win 491, length 0
00:15:5d:5d:92:01 > 00:24:54:4a:91:5f, ethertype IPv4 (0x0800), length 111: 18.230.135.171.21 > 192.168.1.100.57465: Flags [P.], seq 248:305, ack 194, win 491, length 57: FTP: 425 Unable to build data connection: Connection refused
00:24:54:4a:91:5f > 00:15:5d:5d:92:01, ethertype IPv4 (0x0800), length 60: 192.168.1.100.57465 > 18.230.135.171.21: Flags [.], ack 305, win 1022, length 0
00:24:54:4a:91:5f > 00:15:5d:5d:92:01, ethertype IPv4 (0x0800), length 60: 192.168.1.100.57465 > 18.230.135.171.21: Flags [F.], seq 194, ack 305, win 1022, length 0
00:24:54:4a:91:5f > 00:15:5d:5d:92:01, ethertype IPv4 (0x0800), length 80: 192.168.1.100.57436 > 18.230.135.171.3306: Flags [P.], seq 3438117997:3438118023, ack 4250669121, win 1020, length 26
00:15:5d:5d:92:01 > 00:24:54:4a:91:5f, ethertype IPv4 (0x0800), length 54: 18.230.135.171.21 > 192.168.1.100.57465: Flags [F.], seq 305, ack 195, win 491, length 0
00:24:54:4a:91:5f > 00:15:5d:5d:92:01, ethertype IPv4 (0x0800), length 60: 192.168.1.100.57465 > 18.230.135.171.21: Flags [.], ack 306, win 1022, length 0

**Comment by AdSchellevis** [comment]
our forum is a better place to discuss network topics. active mode ftp usually requires a proxy in between, but ftp is hardly used nowadays.

**Comment by mimugmail** [comment]
Yep, you can install ftp-proxy plugin, portforward to localhost and be happy :)

**Comment by KDGundermann** [comment]
> but ftp is hardly used nowadays.

Hi Ad, sorry to disagree but in B2B business FTP/SFTP/OFTP is still in use for EDI transfers
