### ISSUE TITLE
IPv6 link local routes on WAN interface are being broadcast on LAN interface

### ISSUE THREAD

**Issue by alandsidel** [opnsense/core#6010]
**Important notices**

Before you add a new report, we ask you kindly to acknowledge the following:

- [x] I have read the contributing guide lines at https://github.com/opnsense/core/blob/master/CONTRIBUTING.md
- [x] I am convinced that my issue is new after having checked both open and closed issues at https://github.com/opnsense/core/issues?q=is%3Aissue

**Describe the bug**

My cable ISP repeatedly sends 8 RAs for a default route (::/0) to the connected CPE, opnSense's WAN interface in this case.  These RAs are all for link local addresses in the fe80::/64 block.  Every one of these is reachable from the opnsense machine and suitable for routing.

However these advertisements are also being passed along by opnSense to the LAN interface somehow, and picked up by clients.  Those clients cannot reach the addresses, since they are link-local addresses on opnSense's WAN interface.  This results in very spotty ipv6 network connectivity for SLAAC LAN clients.

Note: It's possible this is in fact normal and expected behavior, and that I've configured something wrong or misunderstood something, but it seems like a bug to me at present.

**To Reproduce**

1. Enable DHCPv6 on WAN interface (using an ISP which uses this type of routing)
2. Enable Prefix Delegation requesting a prefix.
3. Enable "Track Interface" of WAN for IPv6 on LAN interface, prefix ID 0x0.
4. Set LAN router advertisement service to "Unmanaged".
5. Connect SLAAC client on LAN interface segment.

**Expected behavior**

SLAAC clients should receive a /64 delegation from opnsense, and a default route of *only* opnsense's LAN link-local fe80::/64 address.  They should not be given routes to an upstream link-local address they cannot reach.

**Describe alternatives you considered**

Turning off "advertise default gateway" prevents the correct LAN link-local address from being advertised to clients, but does not stop opnsense from passing the unreachable link-local addresses it receives from the WAN upstream.

**Relevant log files**

WAN interface tcpdump output:

```
root@wanfirewall:~ # tcpdump -ni vmx0 icmp6 and 'ip6[40] = 134'    
tcpdump: verbose output suppressed, use -v or -vv for full protocol decode
listening on vmx0, link-type EN10MB (Ethernet), capture size 262144 bytes
21:58:43.707390 IP6 fe80::dead:beef:4:1 > ff02::1: ICMP6, router advertisement, length 24
21:58:43.850804 IP6 fe80::dead:beef:3:1 > ff02::1: ICMP6, router advertisement, length 24
21:58:43.898575 IP6 fe80::dead:beef:1:1 > ff02::1: ICMP6, router advertisement, length 24
21:58:43.947052 IP6 fe80::dead:beef:2:1 > ff02::1: ICMP6, router advertisement, length 24
21:58:44.018638 IP6 fe80::dead:beef:5:1 > ff02::1: ICMP6, router advertisement, length 24
21:58:44.114489 IP6 fe80::dead:beef:80:1 > ff02::1: ICMP6, router advertisement, length 24
21:58:44.171078 IP6 fe80::dead:beef:6:1 > ff02::1: ICMP6, router advertisement, length 24
21:58:44.338511 IP6 fe80::dead:beef:70:1 > ff02::1: ICMP6, router advertisement, length 24
21:58:46.907154 IP6 fe80::dead:beef:3:1 > ff02::1: ICMP6, router advertisement, length 24
21:58:47.010280 IP6 fe80::dead:beef:4:1 > ff02::1: ICMP6, router advertisement, length 24
21:58:47.178516 IP6 fe80::dead:beef:2:1 > ff02::1: ICMP6, router advertisement, length 24
21:58:47.211428 IP6 fe80::dead:beef:1:1 > ff02::1: ICMP6, router advertisement, length 24
21:58:47.346970 IP6 fe80::dead:beef:6:1 > ff02::1: ICMP6, router advertisement, length 24
21:58:47.483377 IP6 fe80::dead:beef:5:1 > ff02::1: ICMP6, router advertisement, length 24
21:58:47.483476 IP6 fe80::dead:beef:80:1 > ff02::1: ICMP6, router advertisement, length 24
21:58:47.538631 IP6 fe80::dead:beef:70:1 > ff02::1: ICMP6, router advertisement, length 24
```

Windows 10 SLAAC client `netstat -anr` output:

```
IPv6 Route Table
===========================================================================
Active Routes:
 If Metric Network Destination      Gateway
  3    281 ::/0                     fe80::20c:29ff:fe21:25a6
  3    281 ::/0                     fe80::dead:beef:4:1
  3    281 ::/0                     fe80::dead:beef:1:1
  3    281 ::/0                     fe80::dead:beef:3:1
  3    281 ::/0                     fe80::dead:beef:70:1
  3    281 ::/0                     fe80::dead:beef:80:1
  3    281 ::/0                     fe80::dead:beef:2:1
  3    281 ::/0                     fe80::dead:beef:6:1
  3    281 ::/0                     fe80::dead:beef:5:1
```

The first route in this list is the correct route, the link local address of opnsense.  All the others are those being sent from the ISP and should not (I believe) be promulgated onto a different ethernet segment by opnsense unless it's going to respond on their behalf, which it does not.

**Environment**

Software version used and hardware type if relevant, e.g.:

OPNsense 22.7.3_2-amd64
Core i5-8259U CPU
VMware virtual NICs (hosted on ESXi 7.0)

**Comment by alandsidel** [comment]
I've also tried manually deleting the problematic routes on the client but they reappear almost instantly, though I don't see any RAs going over the LAN interface.  I did see a bunch of neighbor solicitations for those addresses, however.

**Comment by fichtner** [comment]
Hi @alandsidel,

I've never seen that before, slightly considering ISP behaviour seems odd. It would indicate this is a radvd-internal at play here since that is the only thing propagating the routes received.

Mind sharing your radvd.conf -- although I think it doesn't have any visible additions to the standard one.

    # cat /var/etc/radvd.conf

CC my favourite IPv6 expert @maurice-w 


Cheers,
Franco

**Comment by alandsidel** [comment]
Thanks @fichtner 

Haven't ever seen it myself.  Conf file looks normal to me.

```
root@wanfirewall:~ # cat /var/etc/radvd.conf 
# Automatically generated, do not edit
# Generated for DHCPv6 server lan
interface vmx1 {
        AdvSendAdvert on;
        MinRtrAdvInterval 200;
        MaxRtrAdvInterval 600;
        AdvLinkMTU 1500;
        AdvDefaultPreference medium;
        prefix 2601:18c:8a80:b40::/64 {
                DeprecatePrefix on;
                AdvOnLink on;
                AdvAutonomous on;
        };
        RDNSS 2601:18c:8a80:b40:20c:29ff:fe21:25a6 {
        };
        DNSSL localdomain {
        };
};
```

**Comment by fichtner** [comment]
Reddit poster thought that maybe a switch might be to blame allowing multicast from WAN to LAN port(s).

https://www.reddit.com/r/opnsense/comments/x7ps49/comment/infrdly/?context=3

**Comment by alandsidel** [comment]
That was exactly it, thanks.
