### ISSUE TITLE
Outbound NAT with interface groups rotates between *source* addresses

### ISSUE THREAD

**Issue by GottemHams** [opnsense/core#4334]
[X] I have read the contributing guide lines at https://github.com/opnsense/core/blob/master/CONTRIBUTING.md
[X] I have searched the existing issues and I'm convinced that mine is new.

**Describe the bug**
When you use an __Outbound NAT__ rule with an interface group for __Interface__ and __NAT Address__ set to __Interface address__, OPN rotates between all interface IPs it has in that particular group. So the first request has interface 1's IP as its source, the second has interface 2's IP, etc. In my case both the original source and destination belong to the network routed via interface 1, but the destination receives packets with a source IP from an entirely different network. It doesn't matter if the interfaces in the group are plain LANs or VLANs, but in the latter case it will __not__ add a VLAN tag to the outgoing traffic.

I noticed by running `pfctl -snat` that OPN is set to use a round-robin algorithm, but no matter what __Pool Options__ I pick within the rules, it will be "stuck" on round-robin. I can't think of a valid reason why using such an algorithm would apply to the __source address__ anyways, for destination it could be used for load balancing purposes however.

You can also read some discussion about this [in my thread on the forums](https://forum.opnsense.org/index.php?topic=18982.0). Perhaps using outbound NAT is not the proper way to achieve what I want, but as far as I know it's the only way.

I'm not sure if this worked on any previous version, this is the first time I started messing with it.

**To Reproduce**
1. Add an interface group.
2. Add multiple (LAN) interfaces to it. In my case I have igb1, igb2_vlan2 and igb2_vlan13 as members. The original client and destination are both part of the network on __igb1__.
3. Add an __Outbound NAT__ rule and specify the interface group as __Interface__, then for __NAT Address__ pick __Interface address__.
4. Run a tcpdump on the destination host.
5. Send a couple requests.
6. Notice how the first request has the interface IP of igb1 as source, the second will have igb2_vlan2 as source (__without__ a VLAN tag) and the third has igb2_vlan13 as source. The fourth will go back to using igb1 and it'll keep rotating like that.

**Expected behavior**
OPN should use the interface IP that belongs to the network it will route the packet to.

**Relevant log files**
Not really logs but some output from `pfctl`:
```
rdr on AnyExternal inet proto tcp from any to <Home_WAN> port = http -> <DBWSRV> port 80 round-robin
nat on AnyLAN inet from (AnyLAN:network) to (AnyLAN:network) -> (AnyLAN:0) port 1024:65535 round-robin
```

Note that this includes a port forward rule, but I don't think it's necessary to use it in order to reproduce the issue. __AnyExternal__ is an interface group with my external interfaces (only 1 at the moment though) and __AnyLAN__ contains all LAN interfaces, including VLANs.

Also some tcpdump output from the destination host (x.x.x.254 is OPN, 133.15 is the destination host):
```
 00:00:25.804853 rule 67/0(match): pass out on igb1: (tos 0x0, ttl 63, id 17932, offset 0, flags [DF], proto TCP (6), length 64)
    192.168.133.254.56187 > 192.168.133.15.80: Flags [S], cksum 0xb0d9 (correct), seq 3257882122, win 65535, options [mss 1460,nop,wscale 5,nop,nop,TS val 430335001 ecr 0,sackOK,eol], length 0
 00:00:10.103923 rule 67/0(match): pass out on igb1: (tos 0x0, ttl 63, id 30909, offset 0, flags [DF], proto TCP (6), length 64)
    192.168.2.254.41260 > 192.168.133.15.80: Flags [S], cksum 0x2b58 (correct), seq 437821942, win 65535, options [mss 1460,nop,wscale 5,nop,nop,TS val 430344981 ecr 0,sackOK,eol], length 0
 00:00:01.608988 rule 67/0(match): pass out on igb1: (tos 0x0, ttl 63, id 33367, offset 0, flags [DF], proto TCP (6), length 64)
    192.168.13.254.51866 > 192.168.133.15.80: Flags [S], cksum 0x8455 (correct), seq 1655293395, win 65535, options [mss 1460,nop,wscale 5,nop,nop,TS val 430346555 ecr 0,sackOK,eol], length 0
```

192.168.133.x is my primary LAN (VLAN-less, routed via __igb1__), the others have the VLAN ID as the third octet (VLANs are attached to __igb2__).

**Environment**
OPNsense: 20.7.1, amd64, OpenSSL (running off an apu4c4)
CPU: AMD GX-412TC quad-core (1.0 GHz base, boost of 1.4)
RAM: 4 GB DDR3-1333 DRAM
Network: 4x Intel i211AT
