### ISSUE TITLE
Bug Report: Hybrid Outbound NAT rule with `protocol=any` and `interface-address` translation does not persist across reboots — OPNsense 26.1.2_5

### ISSUE THREAD

**Issue by pps11476462** [opnsense/core#10023]
# Bug Report: Hybrid Outbound NAT rule with `protocol=any` and `interface-address` translation does not persist across reboots — OPNsense 26.1.2_5

## Checklist

- [x] I have read the contributing guidelines at https://github.com/opnsense/core/blob/master/CONTRIBUTING.md
- [x] I have searched existing open and closed issues and I am convinced this is a new report
- [x] I have verified the issue persists after a clean reboot (not just a reload)
- [x] I have included the exact OPNsense version and commit hash

---

## Environment

| Field | Value |
|---|---|
| **OPNsense version** | 26.1.2_5 |
| **Architecture** | amd64 |
| **Commit** | 685ed6be1 |
| **FreeBSD base** | 14 |
| **Repository mirror** | https://pkg.opnsense.org/FreeBSD:14:amd64/26.1 |
| **Last updated** | Tue Feb 17 10:19:28 CET 2026 |
| **Last checked** | Tue Mar 17 01:22:26 CET 2026 |
| **Deployment** | GNS3 virtual machine (VirtIO NIC, vtnet interfaces) |

---

## Summary

A manual Outbound NAT (Source NAT) rule created in **Hybrid mode** with `protocol = any` and `translation = Interface address` is saved correctly to the XML configuration and displayed correctly in the WebGUI after creation and apply, but **does not generate the corresponding `pfctl` rule after a system reboot**. As a result, traffic from the configured source network exits the WAN interface with its original private IP address unmasked, causing all return traffic to be dropped by upstream routers.

---

## Topology Context

The setup involves a **point-to-point link** between OPNsense (`vtnet2`, `172.16.0.1/30`) and a Mikrotik RouterOS backend firewall (`172.16.0.2/30`). The Mikrotik applies its own internal masquerade for LAN clients before forwarding traffic to OPNsense. OPNsense must then apply its own NAT to translate the Mikrotik's WAN-facing IP (`172.16.0.2`) to the OPNsense WAN IP before the packet exits to the internet.

The automatic outbound NAT rules generated by OPNsense only cover interfaces directly connected to the firewall with standard port-based masquerade (`port 1024:65535`). ICMP and other non-port-based protocols from the `172.16.0.0/30` network are not covered by the automatic rules, making a manual rule necessary.

```
[LAN clients 192.168.20.0/24]
        |
   [Mikrotik Backend - masquerade]
        | 172.16.0.2
        |
   [OPNsense vtnet2 - 172.16.0.1/30]  <-- Manual NAT rule needed here
        |
   [OPNsense vtnet0 - WAN DHCP 192.168.250.180]
        |
   [Internet]
```

---

## Steps to Reproduce

1. Install OPNsense 26.1.2_5 and configure a **point-to-point interface** (e.g., `vtnet2`) with a `/30` private address (`172.16.0.1/30`). Do NOT set a gateway on this interface.

2. Navigate to **Firewall → NAT → Outbound** and switch the mode to **Hybrid**.

3. Click **Add** and create a rule with the following settings:
   - Interface: `WAN`
   - Protocol: `any`
   - Source network: `172.16.0.0/30`
   - Destination: `any`
   - Translation / Target: `Interface address`
   - Description: `Manual NAT for backend link`

4. Click **Save** and then **Apply changes**. The rule appears correctly in the WebGUI.

5. Verify the rule is active by checking `pfctl -s nat` — at this point the rule **may or may not appear** depending on the apply mechanism (see notes below).

6. **Reboot** the OPNsense system.

7. After the reboot, run `pfctl -s nat` — the manual rule is **not present**.

8. Generate traffic from `172.16.0.2` toward the internet (e.g., ICMP ping to `8.8.8.8`).

9. Run `tcpdump -i vtnet0 host 8.8.8.8` on OPNsense — observe the packet exits **without NAT translation**.

---

### `pfctl -s nat` output after reboot (relevant section only)

The manual rule for `172.16.0.0/30` is completely absent. Only the automatically generated rules appear:

```
nat log on vtnet0 inet from (vtnet2:network) to any port 500 -> (vtnet0:0) static-port
nat log on vtnet0 inet from (lo0:network) to any port 500 -> (vtnet0:0) static-port
nat log on vtnet0 inet from (vlan01:network) to any port 500 -> (vtnet0:0) static-port
nat log on vtnet0 inet from (vlan04:network) to any port 500 -> (vtnet0:0) static-port
nat log on vtnet0 inet from 127.0.0.0/8 to any port 500 -> (vtnet0:0) static-port
nat log on vtnet0 inet from (vtnet2:network) to any -> (vtnet0:0) port 1024:65535
nat log on vtnet0 inet from (lo0:network) to any -> (vtnet0:0) port 1024:65535
nat log on vtnet0 inet from (vlan01:network) to any -> (vtnet0:0) port 1024:65535
nat log on vtnet0 inet from (vlan04:network) to any -> (vtnet0:0) port 1024:65535
nat log on vtnet0 inet from 127.0.0.0/8 to any -> (vtnet0:0) port 1024:65535
```

Note that `(vtnet2:network)` resolves to `172.16.0.0/30`, so the automatic rule covers it — **but only for TCP/UDP with destination ports `1024:65535`**. ICMP and protocols without ports are NOT covered by this automatic rule, which is exactly why the manual `protocol=any` rule is required.

### `tcpdump -i vtnet0 host 8.8.8.8` — packet exits WITHOUT NAT

```
14:10:37.933916 IP 172.16.0.2 > dns.google: ICMP echo request, id 41216, seq 0, length 36
14:10:38.939998 IP 172.16.0.2 > dns.google: ICMP echo request, id 41216, seq 256, length 36
14:10:39.941357 IP 172.16.0.2 > dns.google: ICMP echo request, id 41216, seq 512, length 36
14:10:40.942473 IP 172.16.0.2 > dns.google: ICMP echo request, id 41216, seq 768, length 36
14:10:41.943758 IP 172.16.0.2 > dns.google: ICMP echo request, id 41216, seq 1024, length 36
```

The source IP `172.16.0.2` (private, RFC 1918) is visible on the WAN interface. Google DNS receives the packet but cannot route the reply back to a private address, so all pings time out.

### Mikrotik ping result (no replies)

```
[admin@MikroTik] > /ping 8.8.8.8 count=5
  SEQ HOST                     SIZE TTL TIME       STATUS
    0 8.8.8.8                                      timeout
    1 8.8.8.8                                      timeout
    2 8.8.8.8                                      timeout
    3 8.8.8.8                                      timeout
    4 8.8.8.8                                      timeout
    sent=5 received=0 packet-loss=100%
```

---

## Expected Behavior

After a system reboot, the manually created Outbound NAT rule should persist and be loaded into `pfctl`. The `pfctl -s nat` output should include a rule equivalent to:

```
nat on vtnet0 inet from 172.16.0.0/30 to any -> (vtnet0:0)
```

Traffic from `172.16.0.2` should exit the WAN interface with the OPNsense WAN IP as source, and replies should be received correctly.

### `tcpdump -i vtnet0 host 8.8.8.8` — EXPECTED (with NAT active)

```
14:12:59.563012 IP 192.168.250.180 > dns.google: ICMP echo request, id 16369, seq 1280, length 36
14:12:59.569400 IP dns.google > 192.168.250.180: ICMP echo reply, id 16369, seq 1280, length 36
14:13:00.560965 IP 192.168.250.180 > dns.google: ICMP echo request, id 16369, seq 1536, length 36
14:13:00.567536 IP dns.google > 192.168.250.180: ICMP echo reply, id 16369, seq 1536, length 36
```

Source IP correctly translated to `192.168.250.180` (OPNsense WAN IP). Replies received successfully.

### Mikrotik ping result (with NAT active, after manual pfctl load)

```
[admin@MikroTik] > /ping 8.8.8.8 count=5
  SEQ HOST                     SIZE TTL TIME       STATUS
    0 8.8.8.8                   56 115 6ms791us
    1 8.8.8.8                   56 115 7ms40us
    2 8.8.8.8                   56 115 7ms289us
    3 8.8.8.8                   56 115 7ms259us
    4 8.8.8.8                   56 115 7ms109us
    sent=5 received=5 packet-loss=0% min-rtt=6ms791us avg-rtt=7ms97us max-rtt=7ms289us
```

---

### XML configuration — rule is present and correctly formed

The rule is present in `/conf/config.xml` under the `<outbound>` section with mode `hybrid`:

```xml
<outbound>
  <mode>hybrid</mode>
  <rule>
    <source>
      <network>172.16.0.0/30</network>
    </source>
    <destination>
      <any>1</any>
    </destination>
    <descr>Manual NAT for backend link</descr>
    <interface>wan</interface>
    <ipprotocol>inet</ipprotocol>
    <protocol>any</protocol>
    <target>interface-address</target>
    <targetip_subnet>0</targetip_subnet>
    <sourceport/>
  </rule>
</outbound>
```

The XML value `<target>interface-address</target>` appears to NOT be correctly translated into the pfctl rule generator. When this value is set, the rule is silently dropped during the NAT rule compilation phase.

### Manual `pfctl` load works correctly

When the rule is loaded manually using `pfctl -N -f`, it works as expected:

```bash
echo "nat on vtnet0 inet from 172.16.0.0/30 to any -> (vtnet0)" > /tmp/nat_test.conf
pfctl -N -f /tmp/nat_test.conf
```

After this, `tcpdump -i vtnet0` confirms NAT is applied and traffic flows correctly. This confirms the pfctl engine itself is functioning correctly — the issue is specifically in the translation from the XML/WebGUI configuration to pfctl rules during system startup.

### `pfctl -f /tmp/rules.debug` loads without errors

The main rules debug file loads cleanly:

```
root@firewall:~ # pfctl -f /tmp/rules.debug 2>&1
root@firewall:~ #
```

However, `pfctl -s rules` and `pfctl -s nat` return empty output in OPNsense 26.1, which appears to be related to the internal rule management engine introduced in this version series. This makes direct verification via `pfctl -s nat` unreliable as a diagnostic tool in 26.1.

## Workaround

A custom `rc.d` script has been implemented to load the NAT rule directly via `pfctl` on every boot, bypassing the OPNsense XML-to-pfctl translation layer:

**`/usr/local/etc/nat_custom.conf`:**
```
nat on vtnet0 inet from 172.16.0.0/30 to any -> (vtnet0)
```

**`/usr/local/etc/rc.d/nat_custom.sh`:**
```sh
#!/bin/sh
# PROVIDE: nat_custom
# REQUIRE: pf
# KEYWORD: shutdown

. /etc/rc.subr

name="nat_custom"
rcvar="nat_custom_enable"
start_cmd="nat_custom_start"
stop_cmd=":"

nat_custom_start()
{
    pfctl -N -f /usr/local/etc/nat_custom.conf
}

load_rc_config $name
: ${nat_custom_enable:=YES}
run_rc_command "$1"
```

**`/etc/rc.conf.local`:**
```
nat_custom_enable="YES"
```

This workaround is functional and survives reboots, but is not a proper fix — it bypasses the OPNsense configuration management entirely and will not survive a full configuration restore from the WebGUI.

---

## Possible Root Cause (hypothesis)

The value `interface-address` in `<target>` within the XML outbound NAT rule may not be handled correctly by the NAT rule generator in OPNsense 26.1. The generator likely expects a specific internal token or IP alias reference instead of the literal string `interface-address`. When this token is encountered during boot-time rule compilation, the rule may be silently skipped rather than generating an error.

This could be related to the NAT subsystem refactoring introduced in the 26.1 series, where **Outbound NAT** was renamed to **Source NAT** in the menu structure and the underlying MVC implementation was updated.

---

## Related Issues

- https://github.com/opnsense/core/issues/5381 — Outbound NAT changes not applied after "Apply" (21.7.5, different trigger, possibly same root cause)
- https://github.com/opnsense/core/issues/5368 — Similar report from the same OPNsense version range

---

## Impact

Any deployment where:
- A **backend firewall or router** is connected to OPNsense via a point-to-point link
- The backend device sends traffic using **ICMP or other non-port protocols**
- A **manual hybrid outbound NAT rule** with `protocol=any` is required to cover this traffic

...will silently lose NAT translation after every reboot, causing internet connectivity failures for all devices behind the backend firewall. The failure is not obvious because the WebGUI shows the rule as correctly configured and no error is logged.
