### ISSUE TITLE
Port forwarding problem with asterisk OPTIONS ping

### ISSUE THREAD

**Issue by pazifi** [opnsense/core#5506]
**Environment**
OPNsense 21.7.7 (There was the same problem in older versions)
On Proxmox 7.0-9

**Describe the bug**

There is an external asterisk server with public IP, this server send OPTION ping all 10'000 mS in direction of OPNsense.
The OPNsense server has an public IP and should forward this request over portforwarding to an sip gateway with an private IP.

DMZ       Ethernet 10Gbase-T <full-duplex>    192.168.2.151
LAN       Ethernet 10Gbase-T <full-duplex>    172.16.0.1
WAN       Ethernet 10Gbase-T <full-duplex>    X.X.X.X (PublicIP)

asterisk server (public IP Z.Z.Z.Z) ->  opnsense ( WAN public IP X.X.X.X -> NAT port forwarding -> LAN private IP  172.16.0.1 ) -> sip gateway 172.16.0.18 (private IP).

If i test it with sipsak by hand, it works every time. (sipsak -vv -s sip:pazifi@X.X.X.X -H Z.Z.Z.Z)

If i start the asterisk server, it works one time to 10 minutes. After this time OPNsense don't forward this package longer.
If OPNsense forward this package, i see it in the live log and with tcpdump an WAN and LAN interace.
If not, the package is not seen in the live log. Only with tcpdump on WAN interface (not LAN interface).

Because the ping is sent all 10'000 mS i think this is not a penetration problem and because it works sometime i don't think this is a configuration problem.

**To Reproduce**

I'm not sure how easy it is to reproduce but:

1. asterisk 11 server with public IP, send OPTION pings zu OPNsense WAN interface
2. On OPNsense Firewall -> NAT -> Port forward -> 
Interface: WAN
Proto: UDP
Address: *
Ports: *
Address: WAN adress
Ports: 5060 (SIP)
NAT: 172.16.0.18
Ports: 5060 (SIP)
3. Sip Gateway with private IP, that receice and answer the pings.

**Expected behavior**

Portforwarding of OPTION pings are permanently working.

**Relevant log files**

I don't see anything blocking in the log but an tcpdump:

If it working, trace on WAN interface:

14:17:24.291022 IP Z.Z.Z.Z.5069 > X.X.X.X.5060: SIP: OPTIONS sip:X.X.X.X SIP/2.0
E`.+s...7.+..7..M;........S.OPTIONS sip:X.X.X.X SIP/2.0
Via: SIP/2.0/UDP Z.Z.Z.Z:5069;branch=z9hG4bK4003658a
Max-Forwards: 70
From: "asterisk" <sip:asterisk@Z.Z.Z.Z:5069>;tag=as7d17e2fc
To: <sip:X.X.X.X>
Contact: <sip:asterisk@Z.Z.Z.Z:5069>
Call-ID: 0b9fd7ef14da563f33b2bb100cae4d07@Z.Z.Z.Z:5069
CSeq: 102 OPTIONS
User-Agent: e-fon
Date: Wed, 26 Jan 2022 13:17:24 GMT
Allow: INVITE, ACK, CANCEL, OPTIONS, BYE, REFER, SUBSCRIBE, NOTIFY, INFO, PUBLISH, MESSAGE
Supported: replaces, timer
Content-Length: 0

14:17:24.293105 IP X.X.X.X.5060 > Z.Z.Z.Z.5069: SIP: SIP/2.0 200 OK
E..)G.@.>...M;...7.........\SIP/2.0 200 OK
Contact:<sip:sipgw@172.16.0.18:5060>
Accept:application/sdp
Allow:INVITE,ACK,OPTIONS,BYE,CANCEL,REGISTER,INFO,COMET,UPDATE,PRACK,REFER,SUBSCRIBE,NOTIFY,MESSAGE,PUBLISH
Supported:100rel,timer,join
From:"asterisk"<sip:asterisk@Z.Z.Z.Z:5069>;tag=as7d17e2fc
To:<sip:X.X.X.X>;tag=D430324131353641341D8A2300000000
Call-ID:0b9fd7ef14da563f33b2bb100cae4d07@Z.Z.Z.Z:5069
CSeq:102 OPTIONS
Via:SIP/2.0/UDP Z.Z.Z.Z:5069;branch=z9hG4bK4003658a;received=Z.Z.Z.Z
Content-Length:0

If it no working, trace on WAN interface:

14:29:34.342958 IP Z.Z.Z.Z.5069 > X.X.X.X.5060: SIP: OPTIONS sip:X.X.X.X SIP/2.0
E`.+s...7.+v.7..M;..........OPTIONS sip:X.X.X.X SIP/2.0
Via: SIP/2.0/UDP Z.Z.Z.Z:5069;branch=z9hG4bK5349030e
Max-Forwards: 70
From: "asterisk" <sip:asterisk@Z.Z.Z.Z:5069>;tag=as12b4a6b1
To: <sip:X.X.X.X>
Contact: <sip:asterisk@Z.Z.Z.Z:5069>
Call-ID: 5941d7862b0f98075e14bba14d479aeb@Z.Z.Z.Z:5069
CSeq: 102 OPTIONS
User-Agent: e-fon
Date: Wed, 26 Jan 2022 13:29:24 GMT
Allow: INVITE, ACK, CANCEL, OPTIONS, BYE, REFER, SUBSCRIBE, NOTIFY, INFO, PUBLISH, MESSAGE
Supported: replaces, timer
Content-Length: 0

**Additional context**

I think this is a bug because i don't get an anwser in the forum and the behavior is not consistent.

**Comment by TheNec** [comment]
I dont know if this helps but SIP can be UDP and TCP and you will probably need an additional outbound NAT rule because this looks like a problem many people stumble across when configuring VoIP stuff:

Interface: WAN
Protocol: TCP/UDP
Source Address: "SIP Gateway"
Source Port: 5060 (and maybe 5061 if using TLS)
Destination Address: any or "Asterisk Server"
Destination Port: 5060 (and maybe 5061 if using TLS)
Static Port: [x] (Important!)

This rule needs to be priorised over (above) other rules that this port(s) may may trigger.

**Comment by pazifi** [comment]
I upgradet yesterday to: OPNsense 22.1.
Now it has been working for over a day without any problems.

I think the last new version from weekend fixed this issue, but i don't know the reason.
