### ISSUE TITLE
LDAP fallback to secondary too long. timeout issue ?

### ISSUE THREAD

**Issue by lleblond** [opnsense/core#5932]
Hello,

Problem : 
When the primary(172.16.2.91) LDAP goes down for maintenance, the timeout to the second (172.16.1.91) is too long and the end-user can't authenticate. This can be reproduced filtering with iptables on the primary LDAP.

Here's a trace.
root@opnsrv01:~ # tcpdump -ni vmx0 host 172.16.2.91 or host 172.16.1.91
tcpdump: verbose output suppressed, use -v or -vv for full protocol decode
listening on vmx0, link-type EN10MB (Ethernet), capture size 262144 bytes
15:14:47.522958 ARP, Request who-has 172.16.2.91 tell 172.16.2.30, length 46
15:14:49.946129 IP 172.16.2.98.46266 > 172.16.2.91.389: Flags [S], seq 1822792339, win 65228, options [mss 1460,nop,wscale 7,sackOK,TS val 3111997228 ecr 0], length 0
15:14:50.950467 IP 172.16.2.98.46266 > 172.16.2.91.389: Flags [S], seq 1822792339, win 65228, options [mss 1460,nop,wscale 7,sackOK,TS val 3111998234 ecr 0], length 0
15:14:53.171359 IP 172.16.2.98.46266 > 172.16.2.91.389: Flags [S], seq 1822792339, win 65228, options [mss 1460,nop,wscale 7,sackOK,TS val 3112000455 ecr 0], length 0
15:14:57.390542 IP 172.16.2.98.46266 > 172.16.2.91.389: Flags [S], seq 1822792339, win 65228, options [mss 1460,nop,wscale 7,sackOK,TS val 3112004674 ecr 0], length 0
15:15:05.604221 IP 172.16.2.98.46266 > 172.16.2.91.389: Flags [S], seq 1822792339, win 65228, options [mss 1460,nop,wscale 7,sackOK,TS val 3112012888 ecr 0], length 0

...Then nothing to the back-up LDAP.

ICMP work just fine.
15:15:51.348251 IP 172.16.2.98.8322 > 172.16.2.91.389: Flags [S], seq 4185531030, win 65228, options [mss 1460,nop,wscale 7,sackOK,TS val 640369545 ecr 0], length 0
15:15:52.350436 IP 172.16.2.98.8322 > 172.16.2.91.389: Flags [S], seq 4185531030, win 65228, options [mss 1460,nop,wscale 7,sackOK,TS val 640370551 ecr 0], length 0
15:15:54.562960 IP 172.16.2.98.8322 > 172.16.2.91.389: Flags [S], seq 4185531030, win 65228, options [mss 1460,nop,wscale 7,sackOK,TS val 640372763 ecr 0], length 0
15:15:58.762673 IP 172.16.2.98.8322 > 172.16.2.91.389: Flags [S], seq 4185531030, win 65228, options [mss 1460,nop,wscale 7,sackOK,TS val 640376963 ecr 0], length 0
15:16:06.962777 IP 172.16.2.98.8322 > 172.16.2.91.389: Flags [S], seq 4185531030, win 65228, options [mss 1460,nop,wscale 7,sackOK,TS val 640385163 ecr 0], length 0

The port/network works all good when we test it directly on the back-up LDAP.

Anyone has seeing this issue before ?

Release: 
OPNsense 22.7_4-amd64
FreeBSD 13.1-RELEASE
OpenSSL 1.1.1q 5 Jul 2022

TIA,
-Luc
