### ISSUE TITLE
The Captive Portal idle timeout works the same as the hard timeout (ignores activity)

### ISSUE THREAD

**Issue by ToonvdPas** [opnsense/core#9115]
**Important notices**

Before you add a new report, we ask you kindly to acknowledge the following:

- [ v] I have read the contributing guide lines at https://github.com/opnsense/core/blob/master/CONTRIBUTING.md
- [ v] I am convinced that my issue is new after having checked both open and closed issues at https://github.com/opnsense/core/issues?q=is%3Aissue

**Describe the bug**

Summary:
I use Captive Portal for Wireguard.
In the Captive Portal I configured an idle timeout of 30 minutes.
The whole setup works wonderfully (thank you!), but the idle timeout always fires after 30 minutes.
Before filing this issue, I first reported it in the forum (https://forum.opnsense.org/index.php?msg=245143).
I am running OPNsense 25.7-amd64.
In reply to my report, Franco from Germany came with a very interesting observation.  [He wrote:](https://forum.opnsense.org/index.php?msg=245170)
"Maybe this is an issue with routing protocols not using a layer 2 underneath?
So no ethernet layer no ethernet rule accounting?"

Details:
I use a Captive Portal on top of Wireguard.
The Captive Portal works with HTTPS and a Let's Encrypt certificate.
In the Captive Portal, the automatic generation of firewall rules is turned off.
All required firewall rules have been manually added conform the documentation.

On the client, Wireguard is configured as a full tunnel, with the kill switch active.

It all works like a charm.
The only problem is the activity time-out not working as advertised.
It times out while data is actively streaming through the tunnel with the client.

When the client is NOT in session, the output of the requested pfctl command is:
# pfctl -vs ether -a captiveportal_zone_0
No ALTQ support in kernel
ALTQ related functions disabled

When the client is IN session, the output is:
# pfctl -vs ether -a captiveportal_zone_0
No ALTQ support in kernel
ALTQ related functions disabled
ether pass in quick proto 0x0800 l3 from 192.168.100.2 to any label "192.168.100.2-in"
  [ Evaluations: 0         Packets: 0         Bytes: 0         ]
ether pass out quick proto 0x0800 l3 from any to 192.168.100.2 label "192.168.100.2-out"
  [ Evaluations: 0         Packets: 0         Bytes: 0         ]

With the client in session and playing a YT video, the Interface counters for In4/Pass and Out4Pass increase, while the Block counter remain constant (do not increase):
root@opnsense:/var/log # pfctl -s Interfaces -i wg0 -vv
No ALTQ support in kernel
ALTQ related functions disabled
wg0
        Cleared:     Sat Aug  9 21:13:55 2025
        References:  26               
        In4/Pass:    [ Packets: 340608             Bytes: 40581595           ]
        In4/Block:   [ Packets: 13235              Bytes: 1607356            ]
        Out4/Pass:   [ Packets: 1921721            Bytes: 2551070890         ]
        Out4/Block:  [ Packets: 0                  Bytes: 0                  ]
        In6/Pass:    [ Packets: 0                  Bytes: 0                  ]
        In6/Block:   [ Packets: 0                  Bytes: 0                  ]
        Out6/Pass:   [ Packets: 0                  Bytes: 0                  ]
        Out6/Block:  [ Packets: 0                  Bytes: 0                  ]

In the Web GUI I can request the value of the alias __captive_portal_zone_0.
With the client NOT in session, it is empty.
With the client IN session it contains the Wireguard IP address of the client (192.168.100.2).

*Tip*: to validate your setup was working with the previous version, use opnsense-revert (https://docs.opnsense.org/manual/opnsense_tools.html#opnsense-revert)

**To Reproduce**

1. Configure a Captive Portal in front of Wireguard.
2. Configure it with an idle timeout.
3. Observe that the timeout always fires, even while active communication is ongoing.
4. The Captive Portal log file contains this notification:
"Notice  captiveportal  session qa9txxl3LgiYEWMmI2mbDQ== hit idletimeout"

**Expected behavior**

Expected behaviour would be that the idle timeout doesn't fire while traffic is still flowing.

**Describe alternatives you considered**

None.

**Screenshots**

None

**Relevant log files**

Se above under "Steps to reproduce"

**Additional context**

None

**Environment**

Software version used and hardware type if relevant, e.g.:

OPNsense: 25.7-amd64
CPU: Intel® N100 quad core
Network: 4x Intel® 2.5GbE I226-V

**Comment by AdSchellevis** [comment]
@ToonvdPas can you dump the output of the following statement?

```
grep anchor /tmp/rules.debug
```

**Comment by ToonvdPas** [comment]
root@opnsense:~ # grep anchor /tmp/rules.debug
ether anchor "captiveportal_zone_0" on {wg0}

**Comment by AdSchellevis** [comment]
ok, that looks normal. next question is if the session in question is being updated in the zone database, what does "Services: Captive Portal: Sessions" show for the address in question?

Also, is traffic actually originating from `192.168.100.2`? a packet capture for that address should help to determine that.

**Comment by ToonvdPas** [comment]
Okay, I logged in from my client (the laptop) before checking Services->Captive Portal-> Sessions.
This is the output:
`toon   192.168.100.2   Aug 19, 2025 9:44 PM   Aug 19, 2025 9:44 PM`

Packet capture:
`tcpdump: listening on wg0, link-type NULL (BSD loopback), snapshot length 262144 bytes
21:48:25.016775 IP (tos 0x0, ttl 128, id 41677, offset 0, flags [DF], proto TCP (6), length 41)
    192.168.100.2.65513 > 104.18.10.47.443: Flags [.], cksum 0xdd42 (correct), seq 31188851:31188852, ack 858921344, win 1023, length 1
21:48:25.016800 IP (tos 0x0, ttl 128, id 41678, offset 0, flags [DF], proto TCP (6), length 41)
    192.168.100.2.65514 > 104.18.10.47.443: Flags [.], cksum 0xb15f (correct), seq 1828124991:1828124992, ack 3598657325, win 511, length 1
21:48:25.016810 IP (tos 0x0, ttl 128, id 45664, offset 0, flags [DF], proto TCP (6), length 41)
    192.168.100.2.65519 > 18.239.50.114.443: Flags [.], cksum 0x47c0 (correct), seq 2865298058:2865298059, ack 1718676633, win 1023, length 1
21:48:25.016820 IP (tos 0x0, ttl 128, id 41679, offset 0, flags [DF], proto TCP (6), length 41)
    192.168.100.2.65515 > 104.18.10.47.443: Flags [.], cksum 0x3f4c (correct), seq 4073208658:4073208659, ack 326276200, win 511, length 1
21:48:25.016827 IP (tos 0x0, ttl 128, id 45665, offset 0, flags [DF], proto TCP (6), length 41)
    192.168.100.2.65518 > 18.239.50.114.443: Flags [.], cksum 0xd9b3 (correct), seq 2622388013:2622388014, ack 832185173, win 511, length 1
21:48:25.017064 IP (tos 0x0, ttl 128, id 45666, offset 0, flags [DF], proto TCP (6), length 41)
    192.168.100.2.65517 > 18.239.50.114.443: Flags [.], cksum 0x5d7b (correct), seq 979066863:979066864, ack 526265340, win 255, length 1
21:48:25.018668 IP (tos 0x0, ttl 58, id 26524, offset 0, flags [DF], proto TCP (6), length 52)
    104.18.10.47.443 > 192.168.100.2.65513: Flags [.], cksum 0xd87b (correct), seq 1, ack 1, win 16, options [nop,nop,sack 1 {0:1}], length 0
21:48:25.018701 IP (tos 0x0, ttl 58, id 14027, offset 0, flags [DF], proto TCP (6), length 52)
    104.18.10.47.443 > 192.168.100.2.65515: Flags [.], cksum 0xaeec (correct), seq 1, ack 1, win 16, options [nop,nop,sack 1 {0:1}], length 0
21:48:25.018713 IP (tos 0x0, ttl 58, id 30901, offset 0, flags [DF], proto TCP (6), length 52)
    104.18.10.47.443 > 192.168.100.2.65514: Flags [.], cksum 0xb0c9 (correct), seq 1, ack 1, win 16, options [nop,nop,sack 1 {0:1}], length 0
21:48:25.018830 IP (tos 0x0, ttl 247, id 38660, offset 0, flags [none], proto TCP (6), length 52)
    18.239.50.114.443 > 192.168.100.2.65519: Flags [.], cksum 0xca7a (correct), seq 1, ack 1, win 133, options [nop,nop,sack 1 {0:1}], length 0
21:48:25.018914 IP (tos 0x0, ttl 247, id 50396, offset 0, flags [none], proto TCP (6), length 52)
    18.239.50.114.443 > 192.168.100.2.65518: Flags [.], cksum 0x7e1d (correct), seq 1, ack 1, win 133, options [nop,nop,sack 1 {0:1}], length 0
21:48:25.019291 IP (tos 0x0, ttl 247, id 17322, offset 0, flags [none], proto TCP (6), length 52)
    18.239.50.114.443 > 192.168.100.2.65517: Flags [.], cksum 0xf347 (correct), seq 1, ack 1, win 133, options [nop,nop,sack 1 {0:1}], length 0
`

**Comment by ToonvdPas** [comment]
My God, that looks horrible.
Can I do better?  Like doing a Quote or something?

**Comment by ToonvdPas** [comment]
Is this better?
```
root@opnsense:~ # tcpdump -i wg0 -nn -vvv 
tcpdump: listening on wg0, link-type NULL (BSD loopback), snapshot length 262144 bytes
21:48:25.016775 IP (tos 0x0, ttl 128, id 41677, offset 0, flags [DF], proto TCP (6), length 41)
    192.168.100.2.65513 > 104.18.10.47.443: Flags [.], cksum 0xdd42 (correct), seq 31188851:31188852, ack 858921344, win 1023, length 1
21:48:25.016800 IP (tos 0x0, ttl 128, id 41678, offset 0, flags [DF], proto TCP (6), length 41)
    192.168.100.2.65514 > 104.18.10.47.443: Flags [.], cksum 0xb15f (correct), seq 1828124991:1828124992, ack 3598657325, win 511, length 1
21:48:25.016810 IP (tos 0x0, ttl 128, id 45664, offset 0, flags [DF], proto TCP (6), length 41)
    192.168.100.2.65519 > 18.239.50.114.443: Flags [.], cksum 0x47c0 (correct), seq 2865298058:2865298059, ack 1718676633, win 1023, length 1
21:48:25.016820 IP (tos 0x0, ttl 128, id 41679, offset 0, flags [DF], proto TCP (6), length 41)
    192.168.100.2.65515 > 104.18.10.47.443: Flags [.], cksum 0x3f4c (correct), seq 4073208658:4073208659, ack 326276200, win 511, length 1
21:48:25.016827 IP (tos 0x0, ttl 128, id 45665, offset 0, flags [DF], proto TCP (6), length 41)
    192.168.100.2.65518 > 18.239.50.114.443: Flags [.], cksum 0xd9b3 (correct), seq 2622388013:2622388014, ack 832185173, win 511, length 1
21:48:25.017064 IP (tos 0x0, ttl 128, id 45666, offset 0, flags [DF], proto TCP (6), length 41)
    192.168.100.2.65517 > 18.239.50.114.443: Flags [.], cksum 0x5d7b (correct), seq 979066863:979066864, ack 526265340, win 255, length 1
21:48:25.018668 IP (tos 0x0, ttl 58, id 26524, offset 0, flags [DF], proto TCP (6), length 52)
    104.18.10.47.443 > 192.168.100.2.65513: Flags [.], cksum 0xd87b (correct), seq 1, ack 1, win 16, options [nop,nop,sack 1 {0:1}], length 0
21:48:25.018701 IP (tos 0x0, ttl 58, id 14027, offset 0, flags [DF], proto TCP (6), length 52)
    104.18.10.47.443 > 192.168.100.2.65515: Flags [.], cksum 0xaeec (correct), seq 1, ack 1, win 16, options [nop,nop,sack 1 {0:1}], length 0
21:48:25.018713 IP (tos 0x0, ttl 58, id 30901, offset 0, flags [DF], proto TCP (6), length 52)
    104.18.10.47.443 > 192.168.100.2.65514: Flags [.], cksum 0xb0c9 (correct), seq 1, ack 1, win 16, options [nop,nop,sack 1 {0:1}], length 0
21:48:25.018830 IP (tos 0x0, ttl 247, id 38660, offset 0, flags [none], proto TCP (6), length 52)
    18.239.50.114.443 > 192.168.100.2.65519: Flags [.], cksum 0xca7a (correct), seq 1, ack 1, win 133, options [nop,nop,sack 1 {0:1}], length 0
21:48:25.018914 IP (tos 0x0, ttl 247, id 50396, offset 0, flags [none], proto TCP (6), length 52)
    18.239.50.114.443 > 192.168.100.2.65518: Flags [.], cksum 0x7e1d (correct), seq 1, ack 1, win 133, options [nop,nop,sack 1 {0:1}], length 0
21:48:25.019291 IP (tos 0x0, ttl 247, id 17322, offset 0, flags [none], proto TCP (6), length 52)
    18.239.50.114.443 > 192.168.100.2.65517: Flags [.], cksum 0xf347 (correct), seq 1, ack 1, win 133, options [nop,nop,sack 1 {0:1}], length 0
```

**Comment by AdSchellevis** [comment]
on reload of the rules, they flush to zero, but should be recorded in the sessions as well. can you check the byte counters (if not visible, select them with the 

<img width="59" height="53" alt="Image" src="https://github.com/user-attachments/assets/bb5e237c-84ab-4d45-b055-f7679cc1bae7" /> button )


on my end they do seem to act normal (also increasing the "last seen stamp" over time)

**Comment by ToonvdPas** [comment]
By 'rules' you refer to Firewall->Rules I assume?
I deactivated and activated a rule and subsequently pressed 'Apply Changes'.

Then I started a session from the client laptop and started a video.
This generated lots of traffic with 192.168.100.2 on the wg0 interface.  (checked with tcpdump)

However, the counters on captiveportal_zone_0 remain zero:
````
# pfctl -vs ether -a captiveportal_zone_0
No ALTQ support in kernel
ALTQ related functions disabled
ether pass in quick proto 0x0800 l3 from 192.168.100.2 to any label "192.168.100.2-in"
  [ Evaluations: 0         Packets: 0         Bytes: 0         ]
ether pass out quick proto 0x0800 l3 from any to 192.168.100.2 label "192.168.100.2-out"
  [ Evaluations: 0         Packets: 0         Bytes: 0         ]
````
In the view Services->Captive Portal-> Sessions I don't see a field 'last seen stamp'.
However, there is a field 'Last Accessed'.  Is that what you referred to?
Anyway, 'Last Accessed' doesn't change; is stays pinned on the same value as 'Connected Since'.

I also decided to reboot the OPNsense machine and test again.  Same results.

As extra data point I give you a screenshot of the counters of the firewall rules on WG0 (the assigned alias for wg0) during session:
<img width="1482" height="392" alt="Image" src="https://github.com/user-attachments/assets/832ffe3a-9048-4b09-8379-98d6c9ade0a6" />

And here a screenshot of the interface assignments:

<img width="1184" height="486" alt="Image" src="https://github.com/user-attachments/assets/9df657f3-f24d-40e6-a6a9-4e8f2421f9d7" />

**Comment by AdSchellevis** [comment]
@ToonvdPas I double checked on my end with a wireguard tunnel, it looks like @fichtner is right, ether rules don't match on wireguard interfaces, which means we currently can only add a note in the documentation for these types of interfaces.

**Comment by ToonvdPas** [comment]
Hi Ad, nice to know that the issue is confirmed.
Would it make sense to enter a feature request for this?

Dankjewel!

**Comment by AdSchellevis** [comment]
I'm not sure about the proper solution to be honest, we experimented with a couple of different options while implementing this, but all seem to have disadvantages.  Using table stats might be better in these cases (without l2 math), but adds more strict requirements when creating custom rules. 

I'll mark this ticket as feature request, the are enough details in it to understand the ask.

**Comment by swhite2** [comment]
This should be fixed with https://github.com/opnsense/core/commit/84c4b43b49fa8feb9ea8be28c5633a52b2ecac1c

**Comment by ssarkar-phew** [comment]
Captive portal sessions on OPNsense 26.4 drop at exactly the configured idle timeout interval even when clients are actively generating traffic. A user connected to a captive portal zone will be disconnected and forced to re-authenticate after 30 minutes regardless of whether they have been browsing, transferring files, or maintaining active SSH sessions throughout that period.

**Comment by fichtner** [comment]
I think it's https://github.com/opnsense/core/commit/d42916446

     # opnsense-patch d42916446

This will be part of 26.4.1p1 later today.


Cheers,
Franco
