### ISSUE TITLE
ntpd: configured server peer on directly-connected subnet never reaches sync; pool-resolved peers on the same daemon work fine

### ISSUE THREAD

**Issue by lloydaviation** [opnsense/core#10262]
Environment
OPNsense 26.1.6
Default ntpd (ISC) via Services → Network Time
Multi-VLAN setup; multiple interface listen bindings
ntpd running as PID 4933, bound to interface IPs across all configured VLANs
Summary
A manually configured server entry pointing at a stratum-1 NTP server on a directly-connected LAN subnet never reaches sync. The same ntpd instance, with the same restrict default flags, successfully syncs to internet pool servers. The local ntpdate -q against the same server works perfectly. tcpdump confirms NTP query/response packets flow correctly on the wire. The packets reach the right interface and the right listening socket but never advance the configured association.

Configuration
/var/etc/ntpd.conf (relevant lines):

server 172.16.42.7 iburst maxpoll 9 prefer
pool 0.pool.ntp.org maxpoll 9
pool 1.pool.ntp.org maxpoll 9
pool 2.ntp.pool.org maxpoll 9
172.16.42.7 is a stratum-1 GPS-disciplined NTP server on VLAN 42 (172.16.42.0/24), directly connected to OPNsense via vlan03. OPNsense's interface IP on that VLAN is 172.16.42.1.

Expected
ntpd queries 172.16.42.7 (mode 3 client), receives mode 4 server responses, advances the association, reach builds up to 377, peer becomes selectable.

Observed
ntpq -c as after several poll cycles:

ind assid status  conf reach auth condition  last_event cnt
  1 26023  8011   yes    no  none    reject    mobilize  1   <-- 172.16.42.7
  2 26024  8811   yes  none  none    reject    mobilize  1   <-- pool driver
  3 26025  8811   yes  none  none    reject    mobilize  1   <-- pool driver
  4 26026  8811   yes  none  none    reject    mobilize  1   <-- pool driver
  5 26027  1024    no   yes  none    reject   reachable  2   <-- pool-resolved
  ... (28 pool-resolved peers, all reach `reachable`)
All 4 configured (conf=yes) peers stuck at mobilize; all 28 pool-resolved (conf=no) peers reach reachable.

ntpq -c "rv 26023" (the 172.16.42.7 association):

associd=26023 status=8011 conf, sel_reject, 1 event, mobilize,
srcadr=ntp-server.lloyd.aero, srcport=123, dstadr=172.16.42.1,
dstport=123, leap=11, stratum=16, precision=-24, rootdelay=0.000,
rootdisp=0.000, refid=STEP, reftime=(no time),
rec=..., reach=000, unreach=6, hmode=3, pmode=0, hpoll=6, ppoll=9,
headway=40, flash=1600 peer_stratum, peer_dist, peer_unreach, keyid=0,
...
flash=0x1600 contains only symptomatic bits (peer_stratum, peer_dist, peer_unreach) — no actual rejection bits set (no TEST2 bogus/origin-timestamp-mismatch 0x0002, no TEST4 access-denied 0x0008, no TEST5 auth-failure 0x0010, no TEST6 peer-mode-error 0x0020). The bits that are lit are the kind that get marked because no valid response has been processed, not because a response was specifically rejected.

pmode=0 (peer mode never advanced from uninitialized) confirms ntpd has never accepted a packet against this association.

Diagnostic data: packets flow correctly on the wire
tcpdump -i vlan03 -nn 'host 172.16.42.7 and udp port 123':

15:53:26.860080 IP 172.16.42.1.123 > 172.16.42.7.123: NTPv4, Client, length 48
15:53:26.860732 IP 172.16.42.7.123 > 172.16.42.1.123: NTPv4, Server, length 48
15:54:24.531834 IP 172.16.42.1.123 > 172.16.42.7.123: NTPv4, Client, length 48
15:54:24.532676 IP 172.16.42.7.123 > 172.16.42.1.123: NTPv4, Server, length 48
Sub-millisecond RTT. Outbound mode 3 client queries from 172.16.42.1:123, inbound mode 4 server responses from 172.16.42.7:123, both 48-byte standard NTP packets.

Diagnostic data: pf is not blocking
tcpdump -i pflog0 -nn 'host 172.16.42.7' shows only outbound queries logged (matching a pass log rule for self-traffic). Inbound responses are not in pflog0 — they're matching pf state from outbound queries and pass without re-evaluation.

pfctl -sn | grep 123 — no NAT rules touching port 123.

Diagnostic data: ntpd has the right socket bound
sockstat -4 -P udp | grep 123:

root  ntpd 4933 20  udp4  172.16.48.1:123    *:*
root  ntpd 4933 23  udp4  127.0.0.1:123      *:*
root  ntpd 4933 24  udp4  172.16.10.1:123    *:*
root  ntpd 4933 25  udp4  172.16.42.1:123    *:*
root  ntpd 4933 28  udp4  172.16.50.1:123    *:*
fd=25 is bound to 172.16.42.1:123. Inbound responses (dst 172.16.42.1:123) should be delivered to this socket.

ntpdate against the same server works perfectly
# ntpdate -q 172.16.42.7
server 172.16.42.7, stratum 1, offset -0.000124, delay 0.02577
 5 May 16:27:04 ntpdate[71671]: adjust time server 172.16.42.7 offset -0.000124 sec
The mechanical difference between ntpdate and ntpd as clients: ntpdate uses an ephemeral source port; ntpd uses UDP/123 as source (NTP symmetric port behavior).

Eliminated as cause
Network reachability: ping works from clients and from OPNsense shell.
DNS: server entry is the literal IP, not a hostname.
Authentication: keyid=0 on the association.
NAT: pfctl -sn shows no rules touching port 123.
Firewall blocks: pflog0 shows no inbound blocks; pf state-tracking lets responses through.
Socket binding: ntpd is bound to 172.16.42.1:123 (sockstat confirms).
Config syntax: directive is server, not peer.
Restrict default flags: OPNsense defaults (kod limited nomodify noquery nopeer notrap) — none of which should affect server responses to client queries; nopeer would only affect new symmetric-mode association attempts and shouldn't apply to configured server peers.
ntpd is not crashing or restarting (single PID stable across observation).
Hypothesis
Likely specific to ntpd's source-interface selection or association-matching logic for configured server peers on a directly-connected subnet when ntpd has multiple interface listen bindings. Pool-resolved peers spawn ephemeral associations through a different internal code path and work correctly under identical environment conditions.

The signature — flash bits showing only symptomatic flags (no rejection bits), pmode never advancing from 0, packets visibly arriving at the bound socket — points at the inbound reaching userspace but not being matched to the configured association.

Reproduction
Configure any local stratum-1 (or stratum-2) NTP server on a directly-connected LAN subnet via Services → Network Time → Time Servers.
Use iburst and prefer to surface the issue faster.
Compare reach behavior between the configured local peer and the default pool entries over 5–10 minutes.
Pool peers reach reachable and accumulate reach=377; the configured local peer remains stuck at mobilize/reach=0.
