### ISSUE TITLE
Single gateway monitoring IP

### ISSUE THREAD

**Issue by alruben** [opnsense/core#9844]
About ten years ago, someone posted this:

https://forum.opnsense.org/index.php?topic=3974.msg14153#msg14153

Essentially, they asked why you couldn't specify the same IP on multiple gateway monitors. I've always wondered this too. The answer given in that post isn't entirely accurate. dpinger can definitely do this, with the -B command (which is already used). Here is my proofs:

In two different windows, I run:

```
window 1: tcpdump -i ix1 host 8.8.8.8
window 2: tcpdump -i igb0 host 8.8.8.8


```
then I run the following:

`root@fw1:~ # dpinger -f -B 100.91.121.144 8.8.8.8`

and

`root@fw1:~ # dpinger -f -B 216.220.92.80 8.8.8.8`

this is the result I see in the tcpdump windows

window 1: 

```
root@fw1:~ # tcpdump -i ix1 host 8.8.8.8
tcpdump: verbose output suppressed, use -v[v]... for full protocol decode
listening on ix1, link-type EN10MB (Ethernet), snapshot length 262144 bytes
10:02:01.129175 IP 216.220.92.80 > dns.google: ICMP echo request, id 8483, seq 15, length 8
10:02:01.131229 IP dns.google > 216.220.92.80: ICMP echo reply, id 8483, seq 15, length 8
10:02:01.629594 IP 216.220.92.80 > dns.google: ICMP echo request, id 8483, seq 16, length 8
10:02:01.631648 IP dns.google > 216.220.92.80: ICMP echo reply, id 8483, seq 16, length 8
10:02:02.715829 IP 216.220.92.80 > dns.google: ICMP echo request, id 27100, seq 0, length 32
10:02:02.717876 IP dns.google > 216.220.92.80: ICMP echo reply, id 27100, seq 0, length 32

```
window 2:

```
root@fw1:~ # tcpdump -i igb0 host 8.8.8.8
tcpdump: verbose output suppressed, use -v[v]... for full protocol decode
listening on igb0, link-type EN10MB (Ethernet), snapshot length 262144 bytes
10:02:06.750199 IP 100.91.121.144 > dns.google: ICMP echo request, id 13418, seq 0, length 8
10:02:06.796505 IP dns.google > 100.91.121.144: ICMP echo reply, id 13418, seq 0, length 8
10:02:07.250663 IP 100.91.121.144 > dns.google: ICMP echo request, id 13418, seq 1, length 8
10:02:07.300514 IP dns.google > 100.91.121.144: ICMP echo reply, id 13418, seq 1, length 8
10:02:07.752011 IP 100.91.121.144 > dns.google: ICMP echo request, id 13418, seq 2, length 8
10:02:07.813853 IP dns.google > 100.91.121.144: ICMP echo reply, id 13418, seq 2, length 8

```

So, in essence, it would seem this work just fine if the UI would allow it.

In my opinion, I'd rather dpinger / gateway monitoring be monitoring the same IP I specify "out on the net" to test gateway viability, rather than just the other end of the connection or whatever. This doesn't really test internet reachibility.

Can this change be considered?  A further enhancement would be the ability to set more than one IP to monitor, which is a common feature on other firewalls.

Thanks for your consideration!

**Comment by fichtner** [comment]
Well, we're using -B and we're allowing it when you uncheck host route creation for the gateway monitor. It's just that you need to make sure your DNS servers don't use that IP address you want to monitor because they also create a host route and this can prevent such a setup from working easily.


Cheers,
Franco

**Comment by alreuben3** [comment]
OK, A few things - i've tried disabling host route for the monitors - still doesn't work. Error, "This monitor IP address already exists."

Also, I don't see host routes for my nameservers, but I am attempting to use a different IP for the monitor anyway.

**Comment by fichtner** [comment]
Ok sure I thought this was part of the change when we added the no-route option. 1156fae should do the trick:

    # opnsense-patch 1156fae

Not sure it matters too much in your case but for reference host routes can be emitted using:

    # pluginctl -r host_routes

If you don't have any that's ok.


Cheers,
Franco

**Comment by fichtner** [comment]
@alruben so you got any feedback on this?

**Comment by alreuben3** [comment]
Sorry, I missed the previous comment. I will try it out shortly!

**Comment by alreuben3** [comment]
I have applied this patch and it seems to be working swimmingly. I am able to configure the same IP in the UI, and confirmed via tcpdump that it is working as it should. Thanks!

**Comment by fichtner** [comment]
Thanks, in that case I'll queue it up for 26.1.5.


Cheers,
Franco
