### ISSUE TITLE
UDP NAT translation source won't update when upstream IP address changed

### ISSUE THREAD

**Issue by t123yh** [opnsense/core#3052]
For example, I have a remote server with address 5.5.5.5. My router (192.168.1.1) got an IP address 4.4.4.4 by PPPoE from ISP. One of my internal machine (192.168.1.3) send a UDP packet per second to 5.5.5.5:1234 with source port 4567. The translation will look like this:

192.168.1.3:4567 (4.4.4.4.3456) --> 5.5.5.5:1234

And if you run `tcpdump -i pppoe0` on OPNsense router, you will get the result below:
```
12:59:33.039365 IP 4.4.4.4.3456 > 5.5.5.5.1234: UDP, length 112
```

Now assume the PPPoE is disconnected and connected again. Now we got a different address (4.4.4.5) from ISP. But the translation won't change, and the packet will be sent using the same source address (4.4.4.4) despite the IP change.

```
13:30:23.239483 IP 4.4.4.4.3456 > 5.5.5.5.1234: UDP, length 112
```

But now the PPPoE interface IP address has changed to 4.4.4.5, and obviously the packet will be simply dropped by ISP.

Other packets (e.g. a UDP packet with a new source port) will be sent out like this, and will arrive the target:
```
13:31:40.382847 IP 4.4.4.5.5678 > 5.5.5.5.1234: UDP, length 112
```

I wonder if it's a bug.

**Comment by fichtner** [comment]
Looks like persistent state tracking applies to NAT as well. It's not really a bug, more like a feature since the connection never times out due to it being kept alive.

Under Firewall: Settings: Advanced "Dynamic state reset" option should do what you want?

**Comment by t123yh** [comment]
@fichtner That's just what I want. Thank you very much!

**Comment by fichtner** [comment]
yay, no problem :)
