### ISSUE TITLE
system: gateway monitors started before firewall rules are in place

### ISSUE THREAD

**Issue by Daggolin** [opnsense/core#6862]
**Important notices**

Before you add a new report, we ask you kindly to acknowledge the following:

- [X] I have read the contributing guide lines at https://github.com/opnsense/core/blob/master/CONTRIBUTING.md
- [X] I am convinced that my issue is new after having checked both open and closed issues at https://github.com/opnsense/core/issues?q=is%3Aissue

**Describe the bug**

 The gateway monitoring on our test instance shows a gateway as up that is not even connected to the system.

Our system usually has 4 uplinks configured:
 - igb5: static public IP 
 - igb4_vlan7: PPPoE via VLAN (gets assigned a public IP)
 - igb3: static private IP (acts as exposed host behind another system; indirectly reachable via public IP)
 - igb2: DHCP private IP (not publicly reachable)

The upstream gateways are usually configured like this (for ipv4 only, ignoring ipv6 here; different monitoring IPs set for each):
 - priority: 190: GW_1: fixed public gateway IP (igb5)
 - priority: 200: GW_2: dynamic gateway IP (igb4_vlan7)
 - priority: 230: GW_3: fixed private gateway IP (igb3)
 - priority: 254: GW_4: dynamic gateway IP (igb2)

The gateway monitoring IPs on the test instance are currently set like this:
 - igb5: 9.9.9.9
 - igb4_vlan7: 8.8.8.8
 - igb3: 1.1.1.1
 - igb2: none set

We have only plugged in the network cables for the igb2 uplink (GW_4) and a single client on igb0. In theory the system should use the gateway of igb2 as it should be the only available gateway. However, the gateway for igb3 is also shown as `Online` and we can even see values for `RTT` `RTTd` and `Loss`. Those values are not cached static values, they update when refreshing the page. We have speculated that the monitor may be sending the pings from the incorrect interface, but we do not know.

Checking the routes of the system we can see that the routes for the monitoring IPs 1.1.1.1 and 9.9.9.9 are set to use the IPs of the corresponding gateway. The default route is set to the gateway of igb3, because the system believes the gateway to be usable. The relevant routes (redacted the IP of a public gateway):
```bash
$ netstat -rn
Routing tables

Internet:
Destination        Gateway            Flags     Netif Expire
default            192.168.180.1      UGS        igb3
1.1.1.1            192.168.180.1      UGHS       igb3
9.9.9.9                  x.x.x.x      UGHS       igb5
```

When grepping for the ip of the used gateway in `ifconfig` it correctly shows that the interface configured for that network has no carrier (mac redacted): 
```bash
$ ifconfig | grep -A3 -B4 192.168.180.
igb3: flags=8863<UP,BROADCAST,RUNNING,SIMPLEX,MULTICAST> metric 0 mtu 1500
	description: UPLINK_3 (opt6)
	options=48500b8<VLAN_MTU,VLAN_HWTAGGING,JUMBO_MTU,VLAN_HWCSUM,VLAN_HWFILTER,VLAN_HWTSO,NOMAP>
	ether xx:xx:xx:xx:xx:xx
	inet 192.168.180.10 netmask 0xffffff00 broadcast 192.168.180.255
	media: Ethernet autoselect
	status: no carrier
	nd6 options=29<PERFORMNUD,IFDISABLED,AUTO_LINKLOCAL>
``` 

Trying to ping the gateway we get the error that the network is not reachable (which makes sense, considering the cable is not even plugged in):
```bash
$ ping 192.168.180.1
PING 192.168.180.1 (192.168.180.1): 56 data bytes
ping: sendto: Network is down
ping: sendto: Network is down
^C
--- 192.168.180.1 ping statistics ---
2 packets transmitted, 0 packets received, 100.0% packet loss
```

Trying to ping 1.1.1.1 from the terminal also shows the network is unreachable: 
```bash 
$ ping 1.1.1.1
PING 1.1.1.1 (1.1.1.1): 56 data bytes
ping: sendto: Network is down
ping: sendto: Network is down
^C
--- 1.1.1.1 ping statistics ---
2 packets transmitted, 0 packets received, 100.0% packet loss
```

Despite the very clear situation on the terminal the gateway monitoring on the Web UI claims that 1.1.1.1 is reachable via 192.168.180.1 and concludes the gateway is `Online`, making it the default gateway due to its priority.

**Expected behavior**

Gateway monitoring should report real data and make decisions based on real data.

**Environment**

Software version used and hardware type if relevant, e.g.:

Versions:
 - OPNsense 23.7.4-amd64
 - FreeBSD 13.2-RELEASE-p3
 - OpenSSL 1.1.1v 1 Aug 2023

CPU type:
 - Intel(R) Xeon(R) CPU D-1518 @ 2.20GHz (4 cores, 8 threads)

We noticed the same behaviour on 23.7.3 when updating our test instance failed due to this issue. We temporarily disabled the incorrect gateway to perform the update and enabled it again afterwards to see if the issue persists, which it does.

**Comment by fichtner** [comment]
I'm guessing it does what it was configured to do. Have no reason to doubt dpinger status output so the key point is to see what dpinger settings/addresses are used:

    # ps auxwww | grep dpinger

It has probably found a loophole in your configuration or the host route is not present allowing it to switch over.


Cheers,
Franco

**Comment by Daggolin** [comment]
I have cleaned up and renamed the gateways on the system. The issue still occurs, but I can provide a screenshot of the web UI and the interfaces now (there is a couple of disabled gateways below the end of the screenshot; same for interfaces; public IP redacted):
![image](https://github.com/opnsense/core/assets/11301096/64771216-c38c-4e4a-a788-5df369b3820e)
![image](https://github.com/opnsense/core/assets/11301096/3f433cb7-98c1-45d6-b3b3-b564cc838d5e)


The dpinger processes you asked for (run as root, public IP redacted):
```bash
$ ps auxwww | grep dpinger
root    55294   0.0  0.0   17568   2580  -  Is   11:54    0:00.02 /usr/local/bin/dpinger -f -S -r 0 -i GW_1 -B x.x.x.x -p /var/run/dpinger_GW_1.pid -u /var/run/dpinger_GW_1.sock -s 1s -l 4s -t 60s -d 0 9.9.9.9
root    56719   0.0  0.0   13340   2500  -  Is   11:54    0:00.01 /usr/local/bin/dpinger -f -S -r 0 -i GW_3 -B 192.168.180.10 -p /var/run/dpinger_GW_3.pid -u /var/run/dpinger_GW_3.sock -s 1s -l 4s -t 60s -d 0 1.1.1.1
root    79074   0.0  0.0   12720   2244  1  S+   11:56    0:00.00 grep dpinger
```

Removing the network cable from UPLINK_4 and plugging it back in resolves the issue: GW_3 is correctly shown as `Offline` (due to packet loss) and the UPLINK_4_DHCP gateway is used. The dpinger processes stay the same. After rebooting the OPNsense instance the issue reappears.

**Comment by fichtner** [comment]
@Daggolin can you also provide output for the follow? # configctl system list nameservers debug

For a moment dpinger seems to be able to use 192.168.180.10 -> 1.1.1.1 which means when the cable is unplugged during boot it uses a different connection. It could indicate a missing host route.

But what I find stranger is that your igc3 has 192.168.180.10 assigned with the "no carrier" status which I can't reproduce on my end. rc.linkup should take all addresses down forcing dpinger binding on 192.168.180.10 to fail unless the address remove doesn't work because dpinger is bound to it? that would be a bit silly.


Cheers,
Franco

**Comment by fichtner** [comment]
Nope, my address is correctly stripped even though dpinger is running. dpinger monitoring keeps running but correctly reports "down".

**Comment by Daggolin** [comment]
> @Daggolin can you also provide output for the follow? # configctl system list nameservers debug

```
$ configctl system list nameservers debug
[]
```

> For a moment dpinger seems to be able to use 192.168.180.10 -> 1.1.1.1 which means when the cable is unplugged during boot it uses a different connection. It could indicate a missing host route.

The strangest thing about this is that the shown `RTT`, etc. on the Web UI keep updating. The above `netstat -rn` and `ping` commands clearly show that there is no way to reach 192.168.180.1 nor 1.1.1.1, but the Web UI keeps reporting new values for `RTT`, etc. anyway. This almost sounds as if the pings are sent from the incorrect interface and source IP, despite the routes and the dpinger arguments.

> But what I find stranger is that your igc3 has 192.168.180.10 assigned with the "no carrier" status which I can't reproduce on my end. rc.linkup should take all addresses down forcing dpinger binding on 192.168.180.10 to fail unless the address remove doesn't work because dpinger is bound to it? that would be a bit silly.

The interface igb3 / UPLINK_3 is not a DHCP interface. The IP is configured statically on the Web UI. Maybe that is somehow relevant here?

**Comment by fichtner** [comment]
It looks like this part is missing for a proper multi-WAN setup: https://docs.opnsense.org/manual/how-tos/multiwan.html#step-3-configure-dns-for-each-gateway

**Comment by Daggolin** [comment]
I honestly doubt this has anything to do with DNS. For testing purposes we are pinging public DNS resolvers on the test instance to monitor if gateways are working, but we do not use them for DNS. The unbound instance does not use upstream recursive resolvers, it resolves queries on its own, using the current default gateway. This has worked fine for multi WAN on several OPNsense instances for years.

The issue described on here occurs long before DNS becomes relevant. I have not verified it in the dpinger source, but the pings should be ICMP packets, not UDP or TCP. The gateway monitoring IPs are specified as IPs, so there is no reason those addresses should need resolving. So I honestly do not see how DNS would be involved in this in any way.

**Comment by Daggolin** [comment]
I am still going to post additional info here if you don’t mind. After all it seems to be a nasty bug that potentially breaks gateway monitoring and failovers. Additional info might help whomever looks into this (or related issues) in the future.

It seems that, despite the routes, the pings are indeed sent from the wrong interface: 
```bash $ tcpdump icmp -i igb2
tcpdump: verbose output suppressed, use -v or -vv for full protocol decode
listening on igb2, link-type EN10MB (Ethernet), capture size 262144 bytes
14:48:12.000130 IP 192.168.178.40 > 1.1.1.1: ICMP echo request, id 21472, seq 483, length 8
14:48:12.012101 IP 1.1.1.1 > 192.168.178.40: ICMP echo reply, id 21472, seq 483, length 8
14:48:13.062893 IP 192.168.178.40 > 1.1.1.1: ICMP echo request, id 21472, seq 484, length 8
14:48:13.077421 IP 1.1.1.1 > 192.168.178.40: ICMP echo reply, id 21472, seq 484, length 8
14:48:14.126465 IP 192.168.178.40 > 1.1.1.1: ICMP echo request, id 21472, seq 485, length 8
14:48:14.140314 IP 1.1.1.1 > 192.168.178.40: ICMP echo reply, id 21472, seq 485, length 8
14:48:15.144683 IP 192.168.178.40 > 1.1.1.1: ICMP echo request, id 21472, seq 486, length 8
14:48:15.168231 IP 1.1.1.1 > 192.168.178.40: ICMP echo reply, id 21472, seq 486, length 8
14:48:16.173483 IP 192.168.178.40 > 1.1.1.1: ICMP echo request, id 21472, seq 487, length 8
14:48:16.191402 IP 1.1.1.1 > 192.168.178.40: ICMP echo reply, id 21472, seq 487, length 8
14:48:17.236997 IP 192.168.178.40 > 1.1.1.1: ICMP echo request, id 21472, seq 488, length 8
14:48:17.251216 IP 1.1.1.1 > 192.168.178.40: ICMP echo reply, id 21472, seq 488, length 8
14:48:18.299773 IP 192.168.178.40 > 1.1.1.1: ICMP echo request, id 21472, seq 489, length 8
14:48:18.312156 IP 1.1.1.1 > 192.168.178.40: ICMP echo reply, id 21472, seq 489, length 8
14:48:19.363240 IP 192.168.178.40 > 1.1.1.1: ICMP echo request, id 21472, seq 490, length 8
14:48:19.382917 IP 1.1.1.1 > 192.168.178.40: ICMP echo reply, id 21472, seq 490, length 8
^C
16 packets captured
28 packets received by filter
0 packets dropped by kernel
```

The packet dump clearly shows that pings to 1.1.1.1 are heading out of igb2 using 192.168.178.40 as source address. I am not familiar with FreeBSD under the hood, so I do not know what exactly happens to running applications that keep sending data to the same remote system using the same socket when routes change. However a few manual tests on the terminal indicate that a running instance of dpinger keeps using the routes that existed when it was started. So this indicates that the routes are not properly set up when OPNsense spawns the dpinger processes. Sadly this does not explain why a dpinger instance that is explicitly bound to 192.168.180.10 would end up sending pings from another source address on another interface.

Experimenting with outbound nat rules I was able to artificially create a setup where dpinger would end up using a different source address and interface than specified. Just like changes to the route any changes made to the nat rules did not affect the running instance of dpinger. Thus my current guess is that during boot OPNsense might start dpinger at a time with incorrect routes and rules set, causing the bound address of dpinger to be ignored and traffic to pass through whatever route was active at that time, leading to incorrect results.

**Comment by fichtner** [comment]
Instances might be missing a hook since they are integrated differently but a separate ticket with all the relevant info (OpenVPN client settings, interface assignment, gateway settings) would be beneficial.

**Comment by Daggolin** [comment]
I have found a workaround/solution for the issue. As I previously mentioned I was able to artificially recreate the incorrect behaviour of `dpinger` using NAT rules. This lead me to the assumption that the `dpinger` instances are spawned before the correct routes/rules are set up.

Looking at `src/etc/rc.bootup` one can see the `monitor` plugin is configured before the last call to `filter_configure_sync`, which implies the relevant rules might change after the `dpinger` instances of the monitor plugin have been started: https://github.com/opnsense/core/blob/bca764d307f65068cd15fd65c0b8e6445fa752a1/src/etc/rc.bootup#L101-L105

To test if this might be the issue I have tried two different modifications of `rc.bootup`.

1. Variation - swaps the order of the two calls:
```diff
diff --git a/src/etc/rc.bootup b/src/etc/rc.bootup
index 5d20dfcba..e5ed547bc 100755
--- a/src/etc/rc.bootup
+++ b/src/etc/rc.bootup
@@ -98,8 +98,8 @@ plugins_configure('dhcp', true);
 plugins_configure('dhcrelay', true);
 plugins_configure('dns', true);
 
-plugins_configure('monitor', true, [null, true]);
 filter_configure_sync(true);
+plugins_configure('monitor', true, [null, true]);
 plugins_configure('vpn', true);
 plugins_configure('bootup', true);
 rrd_configure(true, true);
```

2. Variations - configures monitor a second time after the filter call:
```diff
diff --git a/src/etc/rc.bootup b/src/etc/rc.bootup
index 5d20dfcba..001dc9530 100755
--- a/src/etc/rc.bootup
+++ b/src/etc/rc.bootup
@@ -100,6 +100,7 @@ plugins_configure('dns', true);
 
 plugins_configure('monitor', true, [null, true]);
 filter_configure_sync(true);
+plugins_configure('monitor', true, [null, true]);
 plugins_configure('vpn', true);
 plugins_configure('bootup', true);
 rrd_configure(true, true);
```

Both variations solved the issue on the instance I tested with. I think variation 1 should be enough, as the monitor call should just start the `dpinger` and `gateway_watcher.php` instances. Thus I doubt `filter_configure_sync` relies on the monitor plugin being configured first. However, as I don’t know the OPNsense code well enough to say this for certain without spending more time on it I also tested variation 2 where the monitor configure call happens once before and once after `filter_configure_sync`.

@fichtner, do you see any problem swapping these two calls?

**Comment by fichtner** [comment]
@Daggolin first one looks good, you can open a PR
