### ISSUE TITLE
Port forwarding (DNAT) needs static port config in outbound NAT if port is unchanged

### ISSUE THREAD

**Issue by alexanderharm** [opnsense/core#5087]
**Important notices**

Before you add a new report, we ask you kindly to acknowledge the following:

- [x] I have read the contributing guide lines at https://github.com/opnsense/core/blob/master/CONTRIBUTING.md
- [x] I am convinced that my issue is new after having checked both open and closed issues at https://github.com/opnsense/core/issues?q=is%3Aissue

**Describe the bug**

I believe this is an issue since 20.7 but I'm not 100% sure.

I only experienced/tested this with outbound NAT rule generation set to manual with the standard ruleset:
- static port for ISAKMP
- port randomization for the rest
- all translating to interface address

When configuring a port forward with a changed destination port, port forwarding works as expected, e. g.

`WAN | TCP | * | * | WAN address | 80 | InternalHost | 8080`

However, if the destination port is unchanged the source port is subject to port randomization for the replies, e. g.

`WAN | TCP | * | * | WAN address | 8443 | InternalHost | 8443`

leads to

```
14	2.417808	<clientip>	<publicip>	TCP	78	57719 → 8443 [SYN, ECN, CWR] Seq=0 Win=65535 Len=0 MSS=1452 WS=64 TSval=219446651 TSecr=0 SACK_PERM=1
15	2.418959	<publicip>	<clientip>	TCP	74	38238 → 57719 [SYN, ACK, ECN] Seq=0 Ack=1 Win=14480 Len=0 MSS=1460 SACK_PERM=1 TSval=3573347765 TSecr=219446651 WS=128
16	2.434824	<clientip>	<publicip>	TCP	60	57719 → 38238 [RST, ACK] Seq=1041084811 Ack=1 Win=0 Len=0
35	3.419890	<clientip>	<publicip>	TCP	78	[TCP Retransmission] 57719 → 8443 [SYN] Seq=0 Win=65535 Len=0 MSS=1452 WS=64 TSval=219447651 TSecr=0 SACK_PERM=1
36	3.420647	<publicip>	<clientip>	TCP	74	[TCP Retransmission] 38238 → 57719 [SYN, ACK, ECN] Seq=0 Ack=1 Win=14480 Len=0 MSS=1460 SACK_PERM=1 TSval=3573348767 TSecr=219446651 WS=128
```

By adding a rule to the outbound NAT this can be mitigated, e. g.

`WAN | any | tcp/8443 | * | tcp/* | Interface address | * | YES`

See also <https://forum.opnsense.org/index.php?topic=23857.0>

**Expected behavior**

Port forwarding works consistently without outbound nat rule.

**Environment**

OPNsense 21.1.8 (amd64, OpenSSL).

**Comment by alexanderharm** [comment]
Credits to @mimugmail who pointed out that this is caused by setting the source of outbound NAT to any which I could verify.
