### ISSUE TITLE
Intermittent answer to IPv6 neighbor solicitation

### ISSUE THREAD

**Issue by Crazyachmed** [opnsense/core#7804]
**Important notices**

Before you add a new report, we ask you kindly to acknowledge the following:

- [x] I have read the contributing guide lines at https://github.com/opnsense/core/blob/master/CONTRIBUTING.md
- [x] I am convinced that my issue is new after having checked both open and closed issues at https://github.com/opnsense/core/issues?q=is%3Aissue

**Describe the bug**

Android devices drop WiFi connectivity every couple of minutes and reconnect immediately. A capture showed that opnsense does not reply to IPv6 neighbor solicitation for its link-local address right before the disconnections.

Using multiple **wired** Linux devices and the tool ndisc6 I can replicate the issue sending about one solicitation per second, failure rate is above 90%.

- In a packet capture **on opnsense itself** I can verify that all neighbor solicitation arrive but are not answered most of the time.
- There is no overlap in timing when one device receives an answer.
- Sometimes a device randomly works correctly for multiple minutes without any changes, while other devices are still affected
- Under Firewall > Diagnostics > Statistics > interfaces > vtnet0 I can see a rising count for out6_block_packets when ndisc6 is running on other devices
- I don't see any drops in the log or hits in any drop-rules (including floating, auto generated and default deny).
- The problem goes away if check "Disable Firewall" in the advanced firewall settings and comes back immediately after apply when unchecked.

**To Reproduce**

```
while :
do
	ndisc6 -m -n -r 1 fe80::5864:8aff:fef1:7a5 eth0
done
```

Change IP to link-local address of firewall and change interface to the name of the interface on the sending station.

**Expected behavior**

Every neighbor solicitation should be answered, however a reasonably rate-limit may apply (much higher than here)

**Describe alternatives you considered**

I suspected my Proxmox, Switch or APs to be at fault, but for me the tcpdump on opnsense nails it down for me.

**Relevant log files**

```
root@sense:~ # tcpdump -i vtnet0 icmp6 and ip6 net fe80::/64
tcpdump: verbose output suppressed, use -v[v]... for full protocol decode
listening on vtnet0, link-type EN10MB (Ethernet), snapshot length 262144 bytes
14:58:16.948460 IP6 fe80::7b5d:be4e:512:ac91 > ff02::1:fff1:7a5: ICMP6, neighbor solicitation, who has fe80::5864:8aff:fef1:7a5, length 32
14:58:17.952548 IP6 fe80::7b5d:be4e:512:ac91 > ff02::1:fff1:7a5: ICMP6, neighbor solicitation, who has fe80::5864:8aff:fef1:7a5, length 32
14:58:18.957144 IP6 fe80::7b5d:be4e:512:ac91 > ff02::1:fff1:7a5: ICMP6, neighbor solicitation, who has fe80::5864:8aff:fef1:7a5, length 32
14:58:19.706487 IP6 fe80::5864:8aff:fef1:7a5 > fe80::7b5d:be4e:512:ac91: ICMP6, neighbor solicitation, who has fe80::7b5d:be4e:512:ac91, length 32
14:58:19.707107 IP6 fe80::7b5d:be4e:512:ac91 > fe80::5864:8aff:fef1:7a5: ICMP6, neighbor advertisement, tgt is fe80::7b5d:be4e:512:ac91, length 24
14:58:19.961609 IP6 fe80::7b5d:be4e:512:ac91 > ff02::1:fff1:7a5: ICMP6, neighbor solicitation, who has fe80::5864:8aff:fef1:7a5, length 32
14:58:20.965847 IP6 fe80::7b5d:be4e:512:ac91 > ff02::1:fff1:7a5: ICMP6, neighbor solicitation, who has fe80::5864:8aff:fef1:7a5, length 32
14:58:21.396036 IP6 fe80::5864:8aff:fef1:7a5 > fe80::61f5:3d5:b49d:1ab0: ICMP6, neighbor solicitation, who has fe80::61f5:3d5:b49d:1ab0, length 32
14:58:21.470895 IP6 fe80::61f5:3d5:b49d:1ab0 > fe80::5864:8aff:fef1:7a5: ICMP6, neighbor advertisement, tgt is fe80::61f5:3d5:b49d:1ab0, length 24
14:58:21.970370 IP6 fe80::7b5d:be4e:512:ac91 > ff02::1:fff1:7a5: ICMP6, neighbor solicitation, who has fe80::5864:8aff:fef1:7a5, length 32
14:58:22.974822 IP6 fe80::7b5d:be4e:512:ac91 > ff02::1:fff1:7a5: ICMP6, neighbor solicitation, who has fe80::5864:8aff:fef1:7a5, length 32
14:58:23.979156 IP6 fe80::7b5d:be4e:512:ac91 > ff02::1:fff1:7a5: ICMP6, neighbor solicitation, who has fe80::5864:8aff:fef1:7a5, length 32
14:58:24.983611 IP6 fe80::7b5d:be4e:512:ac91 > ff02::1:fff1:7a5: ICMP6, neighbor solicitation, who has fe80::5864:8aff:fef1:7a5, length 32
14:58:25.987861 IP6 fe80::7b5d:be4e:512:ac91 > ff02::1:fff1:7a5: ICMP6, neighbor solicitation, who has fe80::5864:8aff:fef1:7a5, length 32
14:58:26.992253 IP6 fe80::7b5d:be4e:512:ac91 > ff02::1:fff1:7a5: ICMP6, neighbor solicitation, who has fe80::5864:8aff:fef1:7a5, length 32
14:58:27.996596 IP6 fe80::7b5d:be4e:512:ac91 > ff02::1:fff1:7a5: ICMP6, neighbor solicitation, who has fe80::5864:8aff:fef1:7a5, length 32
14:58:29.001043 IP6 fe80::7b5d:be4e:512:ac91 > ff02::1:fff1:7a5: ICMP6, neighbor solicitation, who has fe80::5864:8aff:fef1:7a5, length 32
14:58:30.005406 IP6 fe80::7b5d:be4e:512:ac91 > ff02::1:fff1:7a5: ICMP6, neighbor solicitation, who has fe80::5864:8aff:fef1:7a5, length 32
14:58:30.216896 IP6 fe80::b2f2:8ff:fe18:974d > fe80::5864:8aff:fef1:7a5: ICMP6, neighbor solicitation, who has fe80::5864:8aff:fef1:7a5, length 32
14:58:30.216931 IP6 fe80::5864:8aff:fef1:7a5 > fe80::b2f2:8ff:fe18:974d: ICMP6, neighbor advertisement, tgt is fe80::5864:8aff:fef1:7a5, length 24
14:58:30.499881 IP6 fe80::5864:8aff:fef1:7a5 > ff02::1: ICMP6, router advertisement, length 104
14:58:31.009706 IP6 fe80::7b5d:be4e:512:ac91 > ff02::1:fff1:7a5: ICMP6, neighbor solicitation, who has fe80::5864:8aff:fef1:7a5, length 32
14:58:32.013353 IP6 fe80::7b5d:be4e:512:ac91 > ff02::1:fff1:7a5: ICMP6, neighbor solicitation, who has fe80::5864:8aff:fef1:7a5, length 32
14:58:33.017650 IP6 fe80::7b5d:be4e:512:ac91 > ff02::1:fff1:7a5: ICMP6, neighbor solicitation, who has fe80::5864:8aff:fef1:7a5, length 32
14:58:34.022072 IP6 fe80::7b5d:be4e:512:ac91 > ff02::1:fff1:7a5: ICMP6, neighbor solicitation, who has fe80::5864:8aff:fef1:7a5, length 32
14:58:35.026415 IP6 fe80::7b5d:be4e:512:ac91 > ff02::1:fff1:7a5: ICMP6, neighbor solicitation, who has fe80::5864:8aff:fef1:7a5, length 32
14:58:35.026452 IP6 fe80::5864:8aff:fef1:7a5 > fe80::7b5d:be4e:512:ac91: ICMP6, neighbor advertisement, tgt is fe80::5864:8aff:fef1:7a5, length 32
14:58:36.030782 IP6 fe80::7b5d:be4e:512:ac91 > ff02::1:fff1:7a5: ICMP6, neighbor solicitation, who has fe80::5864:8aff:fef1:7a5, length 32
14:58:37.035154 IP6 fe80::7b5d:be4e:512:ac91 > ff02::1:fff1:7a5: ICMP6, neighbor solicitation, who has fe80::5864:8aff:fef1:7a5, length 32
14:58:38.039424 IP6 fe80::7b5d:be4e:512:ac91 > ff02::1:fff1:7a5: ICMP6, neighbor solicitation, who has fe80::5864:8aff:fef1:7a5, length 32
14:58:39.043784 IP6 fe80::7b5d:be4e:512:ac91 > ff02::1:fff1:7a5: ICMP6, neighbor solicitation, who has fe80::5864:8aff:fef1:7a5, length 32
14:58:40.048012 IP6 fe80::7b5d:be4e:512:ac91 > ff02::1:fff1:7a5: ICMP6, neighbor solicitation, who has fe80::5864:8aff:fef1:7a5, length 32
14:58:41.052328 IP6 fe80::7b5d:be4e:512:ac91 > ff02::1:fff1:7a5: ICMP6, neighbor solicitation, who has fe80::5864:8aff:fef1:7a5, length 32
14:58:42.056492 IP6 fe80::7b5d:be4e:512:ac91 > ff02::1:fff1:7a5: ICMP6, neighbor solicitation, who has fe80::5864:8aff:fef1:7a5, length 32
14:58:43.060648 IP6 fe80::7b5d:be4e:512:ac91 > ff02::1:fff1:7a5: ICMP6, neighbor solicitation, who has fe80::5864:8aff:fef1:7a5, length 32
14:58:44.065127 IP6 fe80::7b5d:be4e:512:ac91 > ff02::1:fff1:7a5: ICMP6, neighbor solicitation, who has fe80::5864:8aff:fef1:7a5, length 32
14:58:44.081477 IP6 fe80::7b5d:be4e:512:ac91 > sense: ICMP6, neighbor solicitation, who has sense, length 32
14:58:45.069324 IP6 fe80::7b5d:be4e:512:ac91 > ff02::1:fff1:7a5: ICMP6, neighbor solicitation, who has fe80::5864:8aff:fef1:7a5, length 32
14:58:45.094855 IP6 fe80::7b5d:be4e:512:ac91 > sense: ICMP6, neighbor solicitation, who has sense, length 32
14:58:46.073780 IP6 fe80::7b5d:be4e:512:ac91 > ff02::1:fff1:7a5: ICMP6, neighbor solicitation, who has fe80::5864:8aff:fef1:7a5, length 32
14:58:46.108110 IP6 fe80::7b5d:be4e:512:ac91 > sense: ICMP6, neighbor solicitation, who has sense, length 32
14:58:47.077911 IP6 fe80::7b5d:be4e:512:ac91 > ff02::1:fff1:7a5: ICMP6, neighbor solicitation, who has fe80::5864:8aff:fef1:7a5, length 32
14:58:48.082187 IP6 fe80::7b5d:be4e:512:ac91 > ff02::1:fff1:7a5: ICMP6, neighbor solicitation, who has fe80::5864:8aff:fef1:7a5, length 32
14:58:49.086716 IP6 fe80::7b5d:be4e:512:ac91 > ff02::1:fff1:7a5: ICMP6, neighbor solicitation, who has fe80::5864:8aff:fef1:7a5, length 32
14:58:50.090925 IP6 fe80::7b5d:be4e:512:ac91 > ff02::1:fff1:7a5: ICMP6, neighbor solicitation, who has fe80::5864:8aff:fef1:7a5, length 32
14:58:51.095030 IP6 fe80::7b5d:be4e:512:ac91 > ff02::1:fff1:7a5: ICMP6, neighbor solicitation, who has fe80::5864:8aff:fef1:7a5, length 32
14:58:52.099541 IP6 fe80::7b5d:be4e:512:ac91 > ff02::1:fff1:7a5: ICMP6, neighbor solicitation, who has fe80::5864:8aff:fef1:7a5, length 32
14:58:53.103758 IP6 fe80::7b5d:be4e:512:ac91 > ff02::1:fff1:7a5: ICMP6, neighbor solicitation, who has fe80::5864:8aff:fef1:7a5, length 32
14:58:54.108259 IP6 fe80::7b5d:be4e:512:ac91 > ff02::1:fff1:7a5: ICMP6, neighbor solicitation, who has fe80::5864:8aff:fef1:7a5, length 32
14:58:55.112493 IP6 fe80::7b5d:be4e:512:ac91 > ff02::1:fff1:7a5: ICMP6, neighbor solicitation, who has fe80::5864:8aff:fef1:7a5, length 32
14:58:55.112522 IP6 fe80::5864:8aff:fef1:7a5 > fe80::7b5d:be4e:512:ac91: ICMP6, neighbor advertisement, tgt is fe80::5864:8aff:fef1:7a5, length 32
14:58:56.116455 IP6 fe80::7b5d:be4e:512:ac91 > ff02::1:fff1:7a5: ICMP6, neighbor solicitation, who has fe80::5864:8aff:fef1:7a5, length 32
14:58:57.120820 IP6 fe80::7b5d:be4e:512:ac91 > ff02::1:fff1:7a5: ICMP6, neighbor solicitation, who has fe80::5864:8aff:fef1:7a5, length 32
14:58:58.125251 IP6 fe80::7b5d:be4e:512:ac91 > ff02::1:fff1:7a5: ICMP6, neighbor solicitation, who has fe80::5864:8aff:fef1:7a5, length 32
14:58:58.299692 IP6 fe80::5864:8aff:fef1:7a5 > ff02::1: ICMP6, router advertisement, length 104
14:58:59.129443 IP6 fe80::7b5d:be4e:512:ac91 > ff02::1:fff1:7a5: ICMP6, neighbor solicitation, who has fe80::5864:8aff:fef1:7a5, length 32
14:58:59.770107 IP6 fe80::5864:8aff:fef1:7a5 > fe80::7b5d:be4e:512:ac91: ICMP6, neighbor solicitation, who has fe80::7b5d:be4e:512:ac91, length 32
14:58:59.770716 IP6 fe80::7b5d:be4e:512:ac91 > fe80::5864:8aff:fef1:7a5: ICMP6, neighbor advertisement, tgt is fe80::7b5d:be4e:512:ac91, length 24
14:59:00.133635 IP6 fe80::7b5d:be4e:512:ac91 > ff02::1:fff1:7a5: ICMP6, neighbor solicitation, who has fe80::5864:8aff:fef1:7a5, length 32
^C
59 packets captured
4416 packets received by filter
0 packets dropped by kernel
root@sense:~ #
```

**Additional context**

I think this behavior was introduced in the update to 24.7 or 24.7.1. No other config changes at the time except the update.

**Environment**

OPNsense 24.7.2-amd64 on Proxmox 8.2.4, Kernel 6.8.12-1-pve
Virtual NIC is virtio with 4 queues and MTU 9000

**Comment by fichtner** [comment]
It was introduced in 24.7.1 FreeBSD and there is a ticket for it. https://github.com/opnsense/src/issues/217

**Comment by fichtner** [comment]
didn't mean to imply this is not useful... after reading the details this is very helpful indeed, thanks!

**Comment by fichtner** [comment]
How to scrape that info from pfctl verbatim:

    # pfctl -vvsInterfaces | grep -e '^[a-z]' -e Out6/Block

**Comment by Crazyachmed** [comment]
I only looked for bugs in the core-repo, so I didn't find it. Did you want to have the output of your command? Let me know if I can check anything else.

```
root@sense:~ # pfctl -vvsInterfaces | grep -e '^[a-z]' -e Out6/Block
No ALTQ support in kernel
ALTQ related functions disabled
all
        Out6/Block:  [ Packets: 0                  Bytes: 0                  ]
enc
        Out6/Block:  [ Packets: 0                  Bytes: 0                  ]
enc0
        Out6/Block:  [ Packets: 0                  Bytes: 0                  ]
lo
        Out6/Block:  [ Packets: 0                  Bytes: 0                  ]
lo0
        Out6/Block:  [ Packets: 4                  Bytes: 278                ]
pflog
        Out6/Block:  [ Packets: 0                  Bytes: 0                  ]
pflog0
        Out6/Block:  [ Packets: 0                  Bytes: 0                  ]
pfsync
        Out6/Block:  [ Packets: 0                  Bytes: 0                  ]
pfsync0 (skip)
        Out6/Block:  [ Packets: 0                  Bytes: 0                  ]
pppoe0
        Out6/Block:  [ Packets: 7                  Bytes: 1806               ]
vtnet0
        Out6/Block:  [ Packets: 17081              Bytes: 1221160            ]
vtnet1
        Out6/Block:  [ Packets: 0                  Bytes: 0                  ]
vtnet2
        Out6/Block:  [ Packets: 119                Bytes: 8616               ]
wg
        Out6/Block:  [ Packets: 0                  Bytes: 0                  ]
wg0
        Out6/Block:  [ Packets: 0                  Bytes: 0                  ]
wireguard
        Out6/Block:  [ Packets: 0                  Bytes: 0                  ]
root@sense:~ #
```

**Comment by fichtner** [comment]
You mentioned out6_block_packets so I had to chase down the raw output source for the FreeBSD ticket. I’m seeing the same. Testing against original 24.7 kernel now where the problem wasn’t present to see if there are significantly less drops visible.

**Comment by Crazyachmed** [comment]
I see the discussion in the FreeBSD ticket has sadly gone fubar. I have reverted to the last known good kernel now. If anyone else has this issue:

`opnsense-update -kr 24.7`

**Comment by fichtner** [comment]
If I give you two test kernels would you test them and tell me which one doesn't work as expected regarding this particular issue?

**Comment by Crazyachmed** [comment]
Sure, but also how to install them, please.
