### ISSUE TITLE
Incomplete User Documentation for WireGuard Site to Site Configuration

### ISSUE THREAD

**Issue by AT-StephenDetomasi** [opnsense/core#8893]
**Important notices**

Before you add a new report, we ask you kindly to acknowledge the following:

- [X] I have read the contributing guide lines at https://github.com/opnsense/core/blob/master/CONTRIBUTING.md
- [X] I am convinced that my issue is new after having checked both open and closed issues at https://github.com/opnsense/core/issues?q=is%3Aissue

**Describe the bug**

When using WireGuard VPN in a split-tunnel configuration, WireGuard will connect, OPNsense can ping the remote network, but LAN clients cannot, despite correctly configured Firewall rules. Stopped working after 25.1.x update, possibly due to changed firewall behaviour and invalid configuration.

**To Reproduce**

1. Go to https://docs.opnsense.org/manual/how-tos/wireguard-s2s.html
2. Follow the instructions exactly as described.
3. You should experience the bug mentioned above.

**Expected behavior**

Both OPNsense and LAN clients can connect to a remote site

**Describe alternatives you considered**

Switching to Netbird or OpenVPN, but would prefer standard WireGuard for performance reasons.

**Additional context**

WireGuard VPN client is working perfectly on a Windows workstation.

**Environment**

Software version used and hardware type if relevant, e.g.:

OPNsense 25.1.9_2 (amd64).
Intel i5-7300u, Proxmox 8.4

**Comment by fichtner** [comment]
This very likely stems from a fix in 25.1.6 giving WireGuard (Group) rules the documented priority. Previously the individual interface's rules were preferred, but that was wrong. It should be an easy fix in your firewall rules.

**Comment by AT-StephenDetomasi** [comment]
This sounds like the issue I am having. Could you possibly elaborate further as to what the correct configuration would be in this situation?

**Comment by fichtner** [comment]
The cases I worked on had WireGuard instances assigned to interfaces with individual pass rules in the firewall rules. The WireGuard (Group) firewall rules tab also had a pass all rule that was interfering. Disabling that group pass rule brought it back to normal for the others, but this only works if all WireGuard instances are assigned (and it might only be problematic in that particular case).

**Comment by AT-StephenDetomasi** [comment]
Hmm, I only have a single instance, and disabling the pass rule under the WireGuard (Group) did not appear to solve my issue. What else could be the culprit? Happy to post logs / diagnostic information if needed.

**Comment by fichtner** [comment]
Firewall rule states are sticky. Make sure you test this after a clean apply (best a reboot), but also make sure you don't do this remotely so lockout chances are low.

**Comment by AT-StephenDetomasi** [comment]
Yes, I did try that, sadly with no luck.

If it is helpful at all, a tcpdump shows that my echo requests do make it to the router (LAN device IP ends in 143), but never get a return, despite my router getting a return.

```
root@sd-rtr-01:~ # tcpdump -i wg0
tcpdump: verbose output suppressed, use -v[v]... for full protocol decode
listening on wg0, link-type NULL (BSD loopback), snapshot length 262144 bytes
20:46:47.467208 IP 192.168.28.13 > 192.168.20.1: ICMP echo request, id 3090, seq 925, length 9
20:46:47.476208 IP 192.168.20.1 > 192.168.28.13: ICMP echo reply, id 3090, seq 925, length 9
20:46:48.487197 IP 192.168.28.13 > 192.168.20.1: ICMP echo request, id 3090, seq 926, length 9
20:46:48.498870 IP 192.168.20.1 > 192.168.28.13: ICMP echo reply, id 3090, seq 926, length 9
20:46:49.169172 IP 192.168.88.143 > 192.168.20.1: ICMP echo request, id 1, seq 3257, length 40
20:46:49.497190 IP 192.168.28.13 > 192.168.20.1: ICMP echo request, id 3090, seq 927, length 9
20:46:49.505942 IP 192.168.20.1 > 192.168.28.13: ICMP echo reply, id 3090, seq 927, length 9
```

**Comment by fichtner** [comment]
Let's make sure we are talking about the same bug. I have a test commit that reverts the change 8079ec2

    # opnsense-patch 8079ec2

Reload filter, see if that works... it is not the fix, just the change in question.

**Comment by AT-StephenDetomasi** [comment]
I installed the patch, no difference after a reboot. I am starting to think there are multiple issues with OPNsense in general regards to this. I have never had so many issues getting a simple VPN configuration working.

In addition to this, routing is broken on every reboot - existing static routes do not work unless you disable and re-enable the rule??

Let me know if there is something else I am missing.

**Comment by fichtner** [comment]
Ok, so we're not even looking at that particular issue then.

>  I am starting to think there are multiple issues with OPNsense in general regards to this.

If you lay them out for me fine, but during support sessions we first check configuration to avoid looking for bugs that may not exist and I suspect the same is going on here.


Cheers,
Franco

**Comment by AT-StephenDetomasi** [comment]
I removed everything related to my WireGuard VPN and instead followed this guide step-by-step: https://docs.opnsense.org/manual/how-tos/wireguard-s2s.html

Still unable to connect. Could someone check this for me?

Edit: Update - was able to get LAN devices to connect, but this time around my router's can't ping eachother. Not the end of the world but still not the expected behaviour, I was using this to test my links and caught me by surprise.
